A1: G01资产负债项目统计表
A2: 填报机构： | D2: 报表日期： | F2: 货币单位：
A3: 项 目 | D3: A | E3: B | F3: C
C4: 行次 | D4: 人民币 | E4: 外币折人民币 | F4: 本外币合计
A5: 1 | B5: Ⅰ.资产
A6: 2 | B6: 1. 现金 | D6: [JRKB_MV][YW0010000600004] | E6: [JRKB_MV][YW0010000600005] | F6: [JRKB_FM][YW0010000600006]
A7: 3 | B7: 2. 贵金属 | D7: [JRKB_MV][YW0010000700004] | E7: [JRKB_MV][YW0010000700005] | F7: [JRKB_FM][YW0010000700006]
A8: 4 | B8: 3. 存放中央银行款项 | D8: [JRKB_MV][YW0010000800004] | E8: [JRKB_MV][YW0010000800005] | F8: [JRKB_FM][YW0010000800006]
A9: 5 | B9: 4. 存放同业款项 | D9: [JRKB_FM][YW0010000900004] | E9: [JRKB_FM][YW0010000900005] | F9: [JRKB_FM][YW0010000900006]
A10: 6 | B10: 4.1 境内同业 | D10: [JRKB_MV][YW0010001000004] | E10: [JRKB_MV][YW0010001000005] | F10: [JRKB_MV][YW0010001000006]
A11: 7 | B11: 4.2 境外同业 | D11: [JRKB_MV][YW0010001100004] | E11: [JRKB_MV][YW0010001100005] | F11: [JRKB_MV][YW0010001100006]
A12: 8 | B12: 5. 应收利息 | D12: [JRKB_MV][YW0010001200004] | E12: [JRKB_MV][YW0010001200005] | F12: [JRKB_FM][YW0010001200006]
A13: 9 | B13: 6. 贷款 | D13: [JRKB_MV][YW0010001300004] | E13: [JRKB_MV][YW0010001300005] | F13: [JRKB_FM][YW0010001300006]
A14: 10 | B14: 7. 贸易融资 | D14: [JRKB_MV][YW0010001400004] | E14: [JRKB_MV][YW0010001400005] | F14: [JRKB_FM][YW0010001400006]
A15: 11 | B15: 8. 贴现及买断式转贴现 | D15: [JRKB_MV][YW0010001500004] | E15: [JRKB_MV][YW0010001500005] | F15: [JRKB_FM][YW0010001500006]
A16: 12 | B16: 9. 其他贷款
A17: 13 | B17: 10. 拆放同业 | D17: [JRKB_MV][YW0010001700004] | E17: [JRKB_MV][YW0010001700005] | F17: [JRKB_FM][YW0010001700006]
A18: =A17+1 -> 14 | B18: 11. 其他应收款 | D18: [JRKB_MV][YW0010002400004] | E18: [JRKB_MV][YW0010002400005] | F18: [JRKB_MV][YW0010002400006]
A19: =A18+1 -> 15 | B19: 12. 投资 | D19: [JRKB_FM][YW0010002500004] | E19: [JRKB_FM][YW0010002500005] | F19: [JRKB_FM][YW0010002500006]
A20: =A19+1 -> 16 | B20: 12.1 债券 | D20: [JRKB_MV][YW0010002600004] | E20: [JRKB_MV][YW0010002600005] | F20: [JRKB_MV][YW0010002600006]
A21: =A20+1 -> 17 | B21: 12.2 股票 | D21: [JRKB_MV][YW0010002700004] | E21: [JRKB_MV][YW0010002700005] | F21: [JRKB_MV][YW0010002700006]
A22: =A21+1 -> 18 | B22: 12.3 其他 | D22: [JRKB_MV][YW0010002800004] | E22: [JRKB_MV][YW0010002800005] | F22: [JRKB_MV][YW0010002800006]
A23: =A22+1 -> 19 | B23: 12.3.1 其中：长期股权投资 | D23: [JRKB_MV][YW0010012500004] | E23: [JRKB_MV][YW0010012500005] | F23: [JRKB_FM][YW0010012500006]
A24: 20 | B24: 13.买入返售资产 | D24: [JRKB_FM][YW0010002900004] | E24: [JRKB_FM][YW0010002900005] | F24: [JRKB_FM][YW0010002900006]
A25: 21 | B25: 13.1 境内外金融机构 | D25: [JRKB_MV][YW0010013000004] | E25: [JRKB_MV][YW0010013000005] | F25: [JRKB_MV][YW0010013000006]
A26: 22 | B26: 13.2 境内外非金融机构 | D26: [JRKB_MV][YW0010013100004] | E26: [JRKB_MV][YW0010013100005] | F26: [JRKB_MV][YW0010013100006]
A27: 23 | B27: 14. 长期待摊费用 | D27: [JRKB_MV][YW0010004300004] | E27: [JRKB_MV][YW0010004300005] | F27: [JRKB_FM][YW0010004300006]
A28: =A27+1 -> 24 | B28: 15. 固定资产原价 | D28: [JRKB_MV][YW0010004400004] | E28: [JRKB_MV][YW0010004400005] | F28: [JRKB_MV][YW0010004400006]
A29: =A28+1 -> 25 | B29: 16. 减：累计折旧 | D29: [JRKB_MV][YW0010004500004] | E29: [JRKB_MV][YW0010004500005] | F29: [JRKB_MV][YW0010004500006]
A30: =A29+1 -> 26 | B30: 17. 固定资产净值 | D30: [JRKB_FM][YW0010004600004] | E30: [JRKB_FM][YW0010004600005] | F30: [JRKB_FM][YW0010004600006]
A31: =A30+1 -> 27 | B31: 18. 固定资产清理 | D31: [JRKB_MV][YW0010004700004] | E31: [JRKB_MV][YW0010004700005] | F31: [JRKB_FM][YW0010004700006]
A32: =A31+1 -> 28 | B32: 19. 在建工程 | D32: [JRKB_MV][YW0010004800004] | E32: [JRKB_MV][YW0010004800005] | F32: [JRKB_FM][YW0010004800006]
A33: =A32+1 -> 29 | B33: 20. 无形资产 | D33: [JRKB_MV][YW0010004900004] | E33: [JRKB_MV][YW0010004900005] | F33: [JRKB_FM][YW0010004900006]
A34: =A33+1 -> 30 | B34: 21. 抵债资产 | D34: [JRKB_MV][YW0010005000004] | E34: [JRKB_MV][YW0010005000005] | F34: [JRKB_FM][YW0010005000006]
A35: =A34+1 -> 31 | B35: 22. 递延所得税资产 | D35: [JRKB_MV][YW0010005100004] | E35: [JRKB_MV][YW0010005100005] | F35: [JRKB_FM][YW0010005100006]
A36: =A35+1 -> 32 | B36: 23. 其他资产 | D36: [JRKB_MV][YW0010005200004] | E36: [JRKB_MV][YW0010005200005] | F36: [JRKB_MV][YW0010005200006]
A37: =A36+1 -> 33 | B37: 其中：23.1投资性房地产 | D37: [JRKB_MV][YW0010012600004] | E37: [JRKB_MV][YW0010012600005] | F37: [JRKB_FM][YW0010012600006]
A38: =A37+1 -> 34 | B38: 23.2衍生金融资产 | D38: [JRKB_MV][YW0010012700004] | E38: [JRKB_MV][YW0010012700005] | F38: [JRKB_FM][YW0010012700006]
A39: =A38+1 -> 35 | B39: 23.3商誉 | D39: [JRKB_MV][YW0010012800004] | E39: [JRKB_MV][YW0010012800005] | F39: [JRKB_FM][YW0010012800006]
A40: =A39+1 -> 36 | B40: 24. 减：各项资产减值损失准备 | D40: [JRKB_MV][YW0010005300004] | E40: [JRKB_MV][YW0010005300005] | F40: [JRKB_FM][YW0010005300006]
A41: =A40+1 -> 37 | B41: 25. 资产总计 | D41: [JRKB_FM][YW0010006200004] | E41: [JRKB_FM][YW0010006200005] | F41: [JRKB_FM][YW0010006200006]
A42: =A41+1 -> 38 | B42: Ⅱ. 负债及所有者权益
A43: =A42+1 -> 39 | B43: 26. 单位存款 | D43: [JRKB_MV][YW0010006400004] | E43: [JRKB_MV][YW0010006400005] | F43: [JRKB_FM][YW0010006400006]
A44: =A43+1 -> 40 | B44: 27. 储蓄存款 | D44: [JRKB_MV][YW0010006500004] | E44: [JRKB_MV][YW0010006500005] | F44: [JRKB_FM][YW0010006500006]
A45: =A44+1 -> 41 | B45: 28. 向中央银行借款 | D45: [JRKB_MV][YW0010006600004] | E45: [JRKB_MV][YW0010006600005] | F45: [JRKB_FM][YW0010006600006]
A46: =A45+1 -> 42 | B46: 29. 同业存放款项 | D46: [JRKB_FM][YW0010006700004] | E46: [JRKB_FM][YW0010006700005] | F46: [JRKB_FM][YW0010006700006]
A47: =A46+1 -> 43 | B47: 29.1 境内同业 | D47: [JRKB_MV][YW0010006800004] | E47: [JRKB_MV][YW0010006800005] | F47: [JRKB_MV][YW0010006800006]
A48: =A47+1 -> 44 | B48: 29.2 境外同业 | D48: [JRKB_MV][YW0010006900004] | E48: [JRKB_MV][YW0010006900005] | F48: [JRKB_MV][YW0010006900006]
A49: =A48+1 -> 45 | B49: 30. 同业拆入 | D49: [JRKB_MV][YW0010007000004] | E49: [JRKB_MV][YW0010007000005] | F49: [JRKB_FM][YW0010007000006]
A50: =A49+1 -> 46 | B50: 31. 卖出回购款项 | D50: [JRKB_FM][YW0010007700004] | E50: [JRKB_FM][YW0010007700005] | F50: [JRKB_FM][YW0010007700006]
A51: 47 | B51: 31.1 境内外金融机构 | D51: [JRKB_MV][YW0010013200004] | E51: [JRKB_MV][YW0010013200005] | F51: [JRKB_MV][YW0010013200006]
A52: 48 | B52: 31.2 境内外非金融机构 | D52: [JRKB_MV][YW0010013300004] | E52: [JRKB_MV][YW0010013300005] | F52: [JRKB_MV][YW0010013300006]
A53: 49 | B53: 32. 汇出汇款 | D53: [JRKB_MV][YW0010009100004] | E53: [JRKB_MV][YW0010009100005] | F53: [JRKB_FM][YW0010009100006]
A54: =A53+1 -> 50 | B54: 33. 应解汇款 | D54: [JRKB_MV][YW0010009200004] | E54: [JRKB_MV][YW0010009200005] | F54: [JRKB_FM][YW0010009200006]
A55: =A54+1 -> 51 | B55: 34.存入保证金 | D55: [JRKB_MV][YW0010009300004] | E55: [JRKB_MV][YW0010009300005] | F55: [JRKB_FM][YW0010009300006]
A56: =A55+1 -> 52 | B56: 35. 其他存款
A57: =A56+1 -> 53 | B57: 36. 应付利息 | D57: [JRKB_MV][YW0010009500004] | E57: [JRKB_MV][YW0010009500005] | F57: [JRKB_FM][YW0010009500006]
A58: =A57+1 -> 54 | B58: 37. 应交税费 | D58: [JRKB_MV][YW0010009600004] | E58: [JRKB_MV][YW0010009600005] | F58: [JRKB_FM][YW0010009600006]
A59: =A58+1 -> 55 | B59: 38. 应付职工薪酬 | D59: [JRKB_MV][YW0010009700004] | E59: [JRKB_MV][YW0010009700005] | F59: [JRKB_FM][YW0010009700006]
A60: =A59+1 -> 56 | B60: 39. 应付福利费
A61: =A60+1 -> 57 | B61: 40. 应付股利 | D61: [JRKB_MV][YW0010009900004] | E61: [JRKB_MV][YW0010009900005] | F61: [JRKB_MV][YW0010009900006]
A62: =A61+1 -> 58 | B62: 41. 其他应付款 | D62: [JRKB_MV][YW0010010000004] | E62: [JRKB_MV][YW0010010000005] | F62: [JRKB_MV][YW0010010000006]
A63: =A62+1 -> 59 | B63: 42. 预提费用
A64: =A63+1 -> 60 | B64: 43. 递延收益 | D64: [JRKB_MV][YW0010010200004] | E64: [JRKB_MV][YW0010010200005] | F64: [JRKB_FM][YW0010010200006]
A65: =A64+1 -> 61 | B65: 44. 预计负债 | D65: [JRKB_MV][YW0010010300004] | E65: [JRKB_MV][YW0010010300005] | F65: [JRKB_FM][YW0010010300006]
A66: =A65+1 -> 62 | B66: 45. 转贷款资金
A67: =A66+1 -> 63 | B67: 46. 应付债券 | D67: [JRKB_MV][YW0010010500004] | E67: [JRKB_MV][YW0010010500005] | F67: [JRKB_FM][YW0010010500006]
A68: =A67+1 -> 64 | B68: 47. 其他负债 | D68: [JRKB_MV][YW0010010600004] | E68: [JRKB_MV][YW0010010600005] | F68: [JRKB_MV][YW0010010600006]
A69: =A68+1 -> 65 | B69: 其中： 47.1 衍生金融负债 | D69: [JRKB_MV][YW0010012900004] | E69: [JRKB_MV][YW0010012900005] | F69: [JRKB_FM][YW0010012900006]
A70: =A69+1 -> 66 | B70: 48. 递延所得税负债 | D70: [JRKB_MV][YW0010010700004] | E70: [JRKB_MV][YW0010010700005] | F70: [JRKB_FM][YW0010010700006]
A71: =A70+1 -> 67 | B71: 49. 负债合计 | D71: [JRKB_FM][YW0010010800004] | E71: [JRKB_FM][YW0010010800005] | F71: [JRKB_FM][YW0010010800006]
A72: =A71+1 -> 68 | B72: 50. 少数股东权益 | D72: [JRKB_MV][YW0010010900004] | E72: [JRKB_MV][YW0010010900005] | F72: [JRKB_FM][YW0010010900006]
A73: =A72+1 -> 69 | B73: 51. 所有者权益
A74: =A73+1 -> 70 | B74: 52. 实收资本 | D74: [JRKB_MV][YW0010011100004] | E74: [JRKB_MV][YW0010011100005] | F74: [JRKB_MV][YW0010011100006]
A75: =A74+1 -> 71 | B75: 53. 资本公积 | D75: [JRKB_MV][YW0010011200004] | E75: [JRKB_MV][YW0010011200005] | F75: [JRKB_MV][YW0010011200006]
A76: =A75+1 -> 72 | B76: 53.1 其中：重估储备 | D76: [JRKB_MV][YW0010011300004] | E76: [JRKB_MV][YW0010011300005] | F76: [JRKB_MV][YW0010011300006]
A77: =A76+1 -> 73 | B77: 54. 盈余公积 | D77: [JRKB_MV][YW0010011400004] | E77: [JRKB_MV][YW0010011400005] | F77: [JRKB_MV][YW0010011400006]
A78: =A77+1 -> 74 | B78: 55 . 一般风险准备 | D78: [JRKB_MV][YW0010011500004] | E78: [JRKB_MV][YW0010011500005] | F78: [JRKB_MV][YW0010011500006]
A79: =A78+1 -> 75 | B79: 56. 信托赔偿准备 | D79: [JRKB_MV][YW0010011600004] | E79: [JRKB_MV][YW0010011600005] | F79: [JRKB_MV][YW0010011600006]
A80: =A79+1 -> 76 | B80: 57. 未分配利润 | D80: [JRKB_MV][YW0010011700004] | E80: [JRKB_MV][YW0010011700005] | F80: [JRKB_MV][YW0010011700006]
A81: =A80+1 -> 77 | B81: 57.1 其中：本年利润 | D81: [JRKB_MV][YW0010011800004] | E81: [JRKB_MV][YW0010011800005] | F81: [JRKB_MV][YW0010011800006]
A82: =A81+1 -> 78 | B82: 58. 外币报表折算差额 | D82: [JRKB_MV][YW0010011900004] | E82: [JRKB_MV][YW0010011900005] | F82: [JRKB_MV][YW0010011900006]
A83: =A82+1 -> 79 | B83: 59. 所有者权益合计 | D83: [JRKB_FM][YW0010012000004] | E83: [JRKB_FM][YW0010012000005] | F83: [JRKB_FM][YW0010012000006]
A84: =A83+1 -> 80 | B84: 60. 负债及所有者权益总计 | D84: [JRKB_FM][YW0010012100004] | E84: [JRKB_FM][YW0010012100005] | F84: [JRKB_FM][YW0010012100006]
A85: =A84+1 -> 81 | B85: 附注项目
A86: =A85+1 -> 82 | B86: 61. 各项存款 | D86: [JRKB_MV][YW0010012200004] | E86: [JRKB_MV][YW0010012200005] | F86: [JRKB_FM][YW0010012200006]
A87: =A86+1 -> 83 | B87: 62. 各项贷款 | D87: [JRKB_MV][YW0010012400004] | E87: [JRKB_MV][YW0010012400005] | F87: [JRKB_FM][YW0010012400006]
A88: 填表人： | C88: 复核人： | D88: 复核人： | F88: 负责人：
E89: 无数据部分
E90: 公式部分