A1: S41农村合作金融机构业务状况表
A2: 报送口径: | C2: 报表日期：Transino_RptDate | F2: 货币单位：万元
B3: 项目名称 | C3: A | D3: B | E3: C | F3: D | G3: E | H3: F
C4: 上期末借方余额 | D4: 上期末贷方余额 | E4: 本期借方发生额 | F4: 本期贷方发生额 | G4: 本期末借方余额 | H4: 本期末贷方余额
A5: 1 | B5: 1.资产类 | C5: [指标][代码:A80540000500004;币种:1560001;属性:01;日期:;频度:;机构:;扩展1:;扩展2:;期数:1;可编辑:2;颜色:#99CCFF] | D5: [指标][代码:A80540000500005;币种:1560001;属性:01;日期:;频度:;机构:;扩展1:;扩展2:;期数:1;可编辑:2;颜色:#99CCFF] | E5: [指标][代码:A80540000500006;币种:1560001;属性:01;日期:;频度:;机构:;扩展1:;扩展2:;期数:1;可编辑:2;颜色:#99CCFF] | F5: [指标][代码:A80540000500007;币种:1560001;属性:01;日期:;频度:;机构:;扩展1:;扩展2:;期数:1;可编辑:2;颜色:#99CCFF] | G5: [指标][代码:A80540000500008;币种:1560001;属性:01;日期:;频度:;机构:;扩展1:;扩展2:;期数:1;可编辑:2;颜色:#99CCFF] | H5: [指标][代码:A80540000500009;币种:1560001;属性:01;日期:;频度:;机构:;扩展1:;扩展2:;期数:1;可编辑:2;颜色:#99CCFF]
A6: =A5+1 -> 2 | B6: 1.1现金 | C6: [指标][代码:A80540000600004;币种:1560001;属性:01;日期:;频度:;机构:;扩展1:;扩展2:;期数:1;可编辑:1;颜色:] | D6: [指标][代码:A80540000600005;币种:1560001;属性:01;日期:;频度:;机构:;扩展1:;扩展2:;期数:1;可编辑:1;颜色:] | E6: [指标][代码:A80540000600006;币种:1560001;属性:01;日期:;频度:;机构:;扩展1:;扩展2:;期数:1;可编辑:1;颜色:] | F6: [指标][代码:A80540000600007;币种:1560001;属性:01;日期:;频度:;机构:;扩展1:;扩展2:;期数:1;可编辑:1;颜色:] | G6: [指标][代码:A80540000600008;币种:1560001;属性:01;日期:;频度:;机构:;扩展1:;扩展2:;期数:1;可编辑:2;颜色:#99CCFF] | H6: [指标][代码:A80540000600009;币种:1560001;属性:01;日期:;频度:;机构:;扩展1:;扩展2:;期数:1;可编辑:1;颜色:]
A7: =A6+1 -> 3 | B7: 1.2存放中央银行款项 | C7: [指标][代码:A80540000700004;币种:1560001;属性:01;日期:;频度:;机构:;扩展1:;扩展2:;期数:1;可编辑:1;颜色:] | D7: [指标][代码:A80540000700005;币种:1560001;属性:01;日期:;频度:;机构:;扩展1:;扩展2:;期数:1;可编辑:1;颜色:] | E7: [指标][代码:A80540000700006;币种:1560001;属性:01;日期:;频度:;机构:;扩展1:;扩展2:;期数:1;可编辑:1;颜色:] | F7: [指标][代码:A80540000700007;币种:1560001;属性:01;日期:;频度:;机构:;扩展1:;扩展2:;期数:1;可编辑:1;颜色:] | G7: [指标][代码:A80540000700008;币种:1560001;属性:01;日期:;频度:;机构:;扩展1:;扩展2:;期数:1;可编辑:2;颜色:#99CCFF] | H7: [指标][代码:A80540000700009;币种:1560001;属性:01;日期:;频度:;机构:;扩展1:;扩展2:;期数:1;可编辑:1;颜色:]
A8: =A7+1 -> 4 | B8: 1.3专项央行票据 | C8: [指标][代码:A80540000800004;币种:1560001;属性:01;日期:;频度:;机构:;扩展1:;扩展2:;期数:1;可编辑:1;颜色:] | D8: [指标][代码:A80540000800005;币种:1560001;属性:01;日期:;频度:;机构:;扩展1:;扩展2:;期数:1;可编辑:1;颜色:] | E8: [指标][代码:A80540000800006;币种:1560001;属性:01;日期:;频度:;机构:;扩展1:;扩展2:;期数:1;可编辑:1;颜色:] | F8: [指标][代码:A80540000800007;币种:1560001;属性:01;日期:;频度:;机构:;扩展1:;扩展2:;期数:1;可编辑:1;颜色:] | G8: [指标][代码:A80540000800008;币种:1560001;属性:01;日期:;频度:;机构:;扩展1:;扩展2:;期数:1;可编辑:2;颜色:#99CCFF] | H8: [指标][代码:A80540000800009;币种:1560001;属性:01;日期:;频度:;机构:;扩展1:;扩展2:;期数:1;可编辑:1;颜色:]
A9: =A8+1 -> 5 | B9: 1.4央行专项扶持资金 | C9: [指标][代码:A80540000900004;币种:1560001;属性:01;日期:;频度:;机构:;扩展1:;扩展2:;期数:1;可编辑:1;颜色:] | D9: [指标][代码:A80540000900005;币种:1560001;属性:01;日期:;频度:;机构:;扩展1:;扩展2:;期数:1;可编辑:1;颜色:] | E9: [指标][代码:A80540000900006;币种:1560001;属性:01;日期:;频度:;机构:;扩展1:;扩展2:;期数:1;可编辑:1;颜色:] | F9: [指标][代码:A80540000900007;币种:1560001;属性:01;日期:;频度:;机构:;扩展1:;扩展2:;期数:1;可编辑:1;颜色:] | G9: [指标][代码:A80540000900008;币种:1560001;属性:01;日期:;频度:;机构:;扩展1:;扩展2:;期数:1;可编辑:2;颜色:#99CCFF] | H9: [指标][代码:A80540000900009;币种:1560001;属性:01;日期:;频度:;机构:;扩展1:;扩展2:;期数:1;可编辑:1;颜色:]
A10: =A9+1 -> 6 | B10: 1.5存放同业款项 | C10: [指标][代码:A80540001000004;币种:1560001;属性:01;日期:;频度:;机构:;扩展1:;扩展2:;期数:1;可编辑:1;颜色:] | D10: [指标][代码:A80540001000005;币种:1560001;属性:01;日期:;频度:;机构:;扩展1:;扩展2:;期数:1;可编辑:1;颜色:] | E10: [指标][代码:A80540001000006;币种:1560001;属性:01;日期:;频度:;机构:;扩展1:;扩展2:;期数:1;可编辑:1;颜色:] | F10: [指标][代码:A80540001000007;币种:1560001;属性:01;日期:;频度:;机构:;扩展1:;扩展2:;期数:1;可编辑:1;颜色:] | G10: [指标][代码:A80540001000008;币种:1560001;属性:01;日期:;频度:;机构:;扩展1:;扩展2:;期数:1;可编辑:2;颜色:#99CCFF] | H10: [指标][代码:A80540001000009;币种:1560001;属性:01;日期:;频度:;机构:;扩展1:;扩展2:;期数:1;可编辑:1;颜色:]
A11: =A10+1 -> 7 | B11: 1.6存放系统内款项 | C11: [指标][代码:A80540001100004;币种:1560001;属性:01;日期:;频度:;机构:;扩展1:;扩展2:;期数:1;可编辑:1;颜色:] | D11: [指标][代码:A80540001100005;币种:1560001;属性:01;日期:;频度:;机构:;扩展1:;扩展2:;期数:1;可编辑:1;颜色:] | E11: [指标][代码:A80540001100006;币种:1560001;属性:01;日期:;频度:;机构:;扩展1:;扩展2:;期数:1;可编辑:1;颜色:] | F11: [指标][代码:A80540001100007;币种:1560001;属性:01;日期:;频度:;机构:;扩展1:;扩展2:;期数:1;可编辑:1;颜色:] | G11: [指标][代码:A80540001100008;币种:1560001;属性:01;日期:;频度:;机构:;扩展1:;扩展2:;期数:1;可编辑:2;颜色:#99CCFF] | H11: [指标][代码:A80540001100009;币种:1560001;属性:01;日期:;频度:;机构:;扩展1:;扩展2:;期数:1;可编辑:1;颜色:]
A12: =A11+1 -> 8 | B12: 1.6.1其中：上存联社款项 | C12: [指标][代码:A80540001200004;币种:1560001;属性:01;日期:;频度:;机构:;扩展1:;扩展2:;期数:1;可编辑:1;颜色:] | D12: [指标][代码:A80540001200005;币种:1560001;属性:01;日期:;频度:;机构:;扩展1:;扩展2:;期数:1;可编辑:1;颜色:] | E12: [指标][代码:A80540001200006;币种:1560001;属性:01;日期:;频度:;机构:;扩展1:;扩展2:;期数:1;可编辑:1;颜色:] | F12: [指标][代码:A80540001200007;币种:1560001;属性:01;日期:;频度:;机构:;扩展1:;扩展2:;期数:1;可编辑:1;颜色:] | G12: [指标][代码:A80540001200008;币种:1560001;属性:01;日期:;频度:;机构:;扩展1:;扩展2:;期数:1;可编辑:1;颜色:] | H12: [指标][代码:A80540001200009;币种:1560001;属性:01;日期:;频度:;机构:;扩展1:;扩展2:;期数:1;可编辑:1;颜色:]
A13: =A12+1 -> 9 | B13: 1.7拆放同业款项 | C13: [指标][代码:A80540001300004;币种:1560001;属性:01;日期:;频度:;机构:;扩展1:;扩展2:;期数:1;可编辑:1;颜色:] | D13: [指标][代码:A80540001300005;币种:1560001;属性:01;日期:;频度:;机构:;扩展1:;扩展2:;期数:1;可编辑:1;颜色:] | E13: [指标][代码:A80540001300006;币种:1560001;属性:01;日期:;频度:;机构:;扩展1:;扩展2:;期数:1;可编辑:1;颜色:] | F13: [指标][代码:A80540001300007;币种:1560001;属性:01;日期:;频度:;机构:;扩展1:;扩展2:;期数:1;可编辑:1;颜色:] | G13: [指标][代码:A80540001300008;币种:1560001;属性:01;日期:;频度:;机构:;扩展1:;扩展2:;期数:1;可编辑:2;颜色:#99CCFF] | H13: [指标][代码:A80540001300009;币种:1560001;属性:01;日期:;频度:;机构:;扩展1:;扩展2:;期数:1;可编辑:1;颜色:]
A14: =A13+1 -> 10 | B14: 1.8拆放系统内款项 | C14: [指标][代码:A80540001400004;币种:1560001;属性:01;日期:;频度:;机构:;扩展1:;扩展2:;期数:1;可编辑:2;颜色:#99CCFF] | D14: [指标][代码:A80540001400005;币种:1560001;属性:01;日期:;频度:;机构:;扩展1:;扩展2:;期数:1;可编辑:2;颜色:#99CCFF] | E14: [指标][代码:A80540001400006;币种:1560001;属性:01;日期:;频度:;机构:;扩展1:;扩展2:;期数:1;可编辑:2;颜色:#99CCFF] | F14: [指标][代码:A80540001400007;币种:1560001;属性:01;日期:;频度:;机构:;扩展1:;扩展2:;期数:1;可编辑:2;颜色:#99CCFF] | G14: [指标][代码:A80540001400008;币种:1560001;属性:01;日期:;频度:;机构:;扩展1:;扩展2:;期数:1;可编辑:2;颜色:#99CCFF] | H14: [指标][代码:A80540001400009;币种:1560001;属性:01;日期:;频度:;机构:;扩展1:;扩展2:;期数:1;可编辑:2;颜色:#99CCFF]
A15: =A14+1 -> 11 | B15: 1.8.1其中：拆放省内 | C15: [指标][代码:A80540001500004;币种:1560001;属性:01;日期:;频度:;机构:;扩展1:;扩展2:;期数:1;可编辑:1;颜色:] | D15: [指标][代码:A80540001500005;币种:1560001;属性:01;日期:;频度:;机构:;扩展1:;扩展2:;期数:1;可编辑:1;颜色:] | E15: [指标][代码:A80540001500006;币种:1560001;属性:01;日期:;频度:;机构:;扩展1:;扩展2:;期数:1;可编辑:1;颜色:] | F15: [指标][代码:A80540001500007;币种:1560001;属性:01;日期:;频度:;机构:;扩展1:;扩展2:;期数:1;可编辑:1;颜色:] | G15: [指标][代码:A80540001500008;币种:1560001;属性:01;日期:;频度:;机构:;扩展1:;扩展2:;期数:1;可编辑:1;颜色:] | H15: [指标][代码:A80540001500009;币种:1560001;属性:01;日期:;频度:;机构:;扩展1:;扩展2:;期数:1;可编辑:1;颜色:]
A16: =A15+1 -> 12 | B16: 1.8.2拆放省外 | C16: [指标][代码:A80540001600004;币种:1560001;属性:01;日期:;频度:;机构:;扩展1:;扩展2:;期数:1;可编辑:1;颜色:] | D16: [指标][代码:A80540001600005;币种:1560001;属性:01;日期:;频度:;机构:;扩展1:;扩展2:;期数:1;可编辑:1;颜色:] | E16: [指标][代码:A80540001600006;币种:1560001;属性:01;日期:;频度:;机构:;扩展1:;扩展2:;期数:1;可编辑:1;颜色:] | F16: [指标][代码:A80540001600007;币种:1560001;属性:01;日期:;频度:;机构:;扩展1:;扩展2:;期数:1;可编辑:1;颜色:] | G16: [指标][代码:A80540001600008;币种:1560001;属性:01;日期:;频度:;机构:;扩展1:;扩展2:;期数:1;可编辑:1;颜色:] | H16: [指标][代码:A80540001600009;币种:1560001;属性:01;日期:;频度:;机构:;扩展1:;扩展2:;期数:1;可编辑:1;颜色:]
A17: =A16+1 -> 13 | B17: 1.9存出保证金 | C17: [指标][代码:A80540001700004;币种:1560001;属性:01;日期:;频度:;机构:;扩展1:;扩展2:;期数:1;可编辑:1;颜色:] | D17: [指标][代码:A80540001700005;币种:1560001;属性:01;日期:;频度:;机构:;扩展1:;扩展2:;期数:1;可编辑:1;颜色:] | E17: [指标][代码:A80540001700006;币种:1560001;属性:01;日期:;频度:;机构:;扩展1:;扩展2:;期数:1;可编辑:1;颜色:] | F17: [指标][代码:A80540001700007;币种:1560001;属性:01;日期:;频度:;机构:;扩展1:;扩展2:;期数:1;可编辑:1;颜色:] | G17: [指标][代码:A80540001700008;币种:1560001;属性:01;日期:;频度:;机构:;扩展1:;扩展2:;期数:1;可编辑:2;颜色:#99CCFF] | H17: [指标][代码:A80540001700009;币种:1560001;属性:01;日期:;频度:;机构:;扩展1:;扩展2:;期数:1;可编辑:1;颜色:]
A18: =A17+1 -> 14 | B18: 1.10存出保证金减值准备 | C18: [指标][代码:A80540001800004;币种:1560001;属性:01;日期:;频度:;机构:;扩展1:;扩展2:;期数:1;可编辑:1;颜色:] | D18: [指标][代码:A80540001800005;币种:1560001;属性:01;日期:;频度:;机构:;扩展1:;扩展2:;期数:1;可编辑:1;颜色:] | E18: [指标][代码:A80540001800006;币种:1560001;属性:01;日期:;频度:;机构:;扩展1:;扩展2:;期数:1;可编辑:1;颜色:] | F18: [指标][代码:A80540001800007;币种:1560001;属性:01;日期:;频度:;机构:;扩展1:;扩展2:;期数:1;可编辑:1;颜色:] | G18: [指标][代码:A80540001800008;币种:1560001;属性:01;日期:;频度:;机构:;扩展1:;扩展2:;期数:1;可编辑:1;颜色:] | H18: [指标][代码:A80540001800009;币种:1560001;属性:01;日期:;频度:;机构:;扩展1:;扩展2:;期数:1;可编辑:2;颜色:#99CCFF]
A19: =A18+1 -> 15 | B19: 1.11交易性金融资产 | C19: [指标][代码:A80540001900004;币种:1560001;属性:01;日期:;频度:;机构:;扩展1:;扩展2:;期数:1;可编辑:1;颜色:] | D19: [指标][代码:A80540001900005;币种:1560001;属性:01;日期:;频度:;机构:;扩展1:;扩展2:;期数:1;可编辑:1;颜色:] | E19: [指标][代码:A80540001900006;币种:1560001;属性:01;日期:;频度:;机构:;扩展1:;扩展2:;期数:1;可编辑:1;颜色:] | F19: [指标][代码:A80540001900007;币种:1560001;属性:01;日期:;频度:;机构:;扩展1:;扩展2:;期数:1;可编辑:1;颜色:] | G19: [指标][代码:A80540001900008;币种:1560001;属性:01;日期:;频度:;机构:;扩展1:;扩展2:;期数:1;可编辑:2;颜色:#99CCFF] | H19: [指标][代码:A80540001900009;币种:1560001;属性:01;日期:;频度:;机构:;扩展1:;扩展2:;期数:1;可编辑:1;颜色:]
A20: =A19+1 -> 16 | B20: 1.12买入返售金融资产 | C20: [指标][代码:A80540002000004;币种:1560001;属性:01;日期:;频度:;机构:;扩展1:;扩展2:;期数:1;可编辑:1;颜色:] | D20: [指标][代码:A80540002000005;币种:1560001;属性:01;日期:;频度:;机构:;扩展1:;扩展2:;期数:1;可编辑:1;颜色:] | E20: [指标][代码:A80540002000006;币种:1560001;属性:01;日期:;频度:;机构:;扩展1:;扩展2:;期数:1;可编辑:1;颜色:] | F20: [指标][代码:A80540002000007;币种:1560001;属性:01;日期:;频度:;机构:;扩展1:;扩展2:;期数:1;可编辑:1;颜色:] | G20: [指标][代码:A80540002000008;币种:1560001;属性:01;日期:;频度:;机构:;扩展1:;扩展2:;期数:1;可编辑:2;颜色:#99CCFF] | H20: [指标][代码:A80540002000009;币种:1560001;属性:01;日期:;频度:;机构:;扩展1:;扩展2:;期数:1;可编辑:1;颜色:]
A21: =A20+1 -> 17 | B21: 1.13买入返售金融资产减值准备 | C21: [指标][代码:A80540002100004;币种:1560001;属性:01;日期:;频度:;机构:;扩展1:;扩展2:;期数:1;可编辑:1;颜色:] | D21: [指标][代码:A80540002100005;币种:1560001;属性:01;日期:;频度:;机构:;扩展1:;扩展2:;期数:1;可编辑:1;颜色:] | E21: [指标][代码:A80540002100006;币种:1560001;属性:01;日期:;频度:;机构:;扩展1:;扩展2:;期数:1;可编辑:1;颜色:] | F21: [指标][代码:A80540002100007;币种:1560001;属性:01;日期:;频度:;机构:;扩展1:;扩展2:;期数:1;可编辑:1;颜色:] | G21: [指标][代码:A80540002100008;币种:1560001;属性:01;日期:;频度:;机构:;扩展1:;扩展2:;期数:1;可编辑:1;颜色:] | H21: [指标][代码:A80540002100009;币种:1560001;属性:01;日期:;频度:;机构:;扩展1:;扩展2:;期数:1;可编辑:2;颜色:#99CCFF]
A22: =A21+1 -> 18 | B22: 1.14应收股利 | C22: [指标][代码:A80540002200004;币种:1560001;属性:01;日期:;频度:;机构:;扩展1:;扩展2:;期数:1;可编辑:1;颜色:] | D22: [指标][代码:A80540002200005;币种:1560001;属性:01;日期:;频度:;机构:;扩展1:;扩展2:;期数:1;可编辑:1;颜色:] | E22: [指标][代码:A80540002200006;币种:1560001;属性:01;日期:;频度:;机构:;扩展1:;扩展2:;期数:1;可编辑:1;颜色:] | F22: [指标][代码:A80540002200007;币种:1560001;属性:01;日期:;频度:;机构:;扩展1:;扩展2:;期数:1;可编辑:1;颜色:] | G22: [指标][代码:A80540002200008;币种:1560001;属性:01;日期:;频度:;机构:;扩展1:;扩展2:;期数:1;可编辑:2;颜色:#99CCFF] | H22: [指标][代码:A80540002200009;币种:1560001;属性:01;日期:;频度:;机构:;扩展1:;扩展2:;期数:1;可编辑:1;颜色:]
A23: =A22+1 -> 19 | B23: 1.15应收利息 | C23: [指标][代码:A80540002300004;币种:1560001;属性:01;日期:;频度:;机构:;扩展1:;扩展2:;期数:1;可编辑:1;颜色:] | D23: [指标][代码:A80540002300005;币种:1560001;属性:01;日期:;频度:;机构:;扩展1:;扩展2:;期数:1;可编辑:1;颜色:] | E23: [指标][代码:A80540002300006;币种:1560001;属性:01;日期:;频度:;机构:;扩展1:;扩展2:;期数:1;可编辑:1;颜色:] | F23: [指标][代码:A80540002300007;币种:1560001;属性:01;日期:;频度:;机构:;扩展1:;扩展2:;期数:1;可编辑:1;颜色:] | G23: [指标][代码:A80540002300008;币种:1560001;属性:01;日期:;频度:;机构:;扩展1:;扩展2:;期数:1;可编辑:2;颜色:#99CCFF] | H23: [指标][代码:A80540002300009;币种:1560001;属性:01;日期:;频度:;机构:;扩展1:;扩展2:;期数:1;可编辑:1;颜色:]
A24: =A23+1 -> 20 | B24: 1.16其他应收款 | C24: [指标][代码:A80540002400004;币种:1560001;属性:01;日期:;频度:;机构:;扩展1:;扩展2:;期数:1;可编辑:1;颜色:] | D24: [指标][代码:A80540002400005;币种:1560001;属性:01;日期:;频度:;机构:;扩展1:;扩展2:;期数:1;可编辑:1;颜色:] | E24: [指标][代码:A80540002400006;币种:1560001;属性:01;日期:;频度:;机构:;扩展1:;扩展2:;期数:1;可编辑:1;颜色:] | F24: [指标][代码:A80540002400007;币种:1560001;属性:01;日期:;频度:;机构:;扩展1:;扩展2:;期数:1;可编辑:1;颜色:] | G24: [指标][代码:A80540002400008;币种:1560001;属性:01;日期:;频度:;机构:;扩展1:;扩展2:;期数:1;可编辑:2;颜色:#99CCFF] | H24: [指标][代码:A80540002400009;币种:1560001;属性:01;日期:;频度:;机构:;扩展1:;扩展2:;期数:1;可编辑:1;颜色:]
A25: =A24+1 -> 21 | B25: 1.17坏账准备 | C25: [指标][代码:A80540002500004;币种:1560001;属性:01;日期:;频度:;机构:;扩展1:;扩展2:;期数:1;可编辑:1;颜色:] | D25: [指标][代码:A80540002500005;币种:1560001;属性:01;日期:;频度:;机构:;扩展1:;扩展2:;期数:1;可编辑:1;颜色:] | E25: [指标][代码:A80540002500006;币种:1560001;属性:01;日期:;频度:;机构:;扩展1:;扩展2:;期数:1;可编辑:1;颜色:] | F25: [指标][代码:A80540002500007;币种:1560001;属性:01;日期:;频度:;机构:;扩展1:;扩展2:;期数:1;可编辑:1;颜色:] | G25: [指标][代码:A80540002500008;币种:1560001;属性:01;日期:;频度:;机构:;扩展1:;扩展2:;期数:1;可编辑:1;颜色:] | H25: [指标][代码:A80540002500009;币种:1560001;属性:01;日期:;频度:;机构:;扩展1:;扩展2:;期数:1;可编辑:2;颜色:#99CCFF]
A26: =A25+1 -> 22 | B26: 1.18各项贷款 | C26: [指标][代码:A80540002600004;币种:1560001;属性:01;日期:;频度:;机构:;扩展1:;扩展2:;期数:1;可编辑:2;颜色:#99CCFF] | D26: [指标][代码:A80540002600005;币种:1560001;属性:01;日期:;频度:;机构:;扩展1:;扩展2:;期数:1;可编辑:2;颜色:#99CCFF] | E26: [指标][代码:A80540002600006;币种:1560001;属性:01;日期:;频度:;机构:;扩展1:;扩展2:;期数:1;可编辑:2;颜色:#99CCFF] | F26: [指标][代码:A80540002600007;币种:1560001;属性:01;日期:;频度:;机构:;扩展1:;扩展2:;期数:1;可编辑:2;颜色:#99CCFF] | G26: [指标][代码:A80540002600008;币种:1560001;属性:01;日期:;频度:;机构:;扩展1:;扩展2:;期数:1;可编辑:2;颜色:#99CCFF] | H26: [指标][代码:A80540002600009;币种:1560001;属性:01;日期:;频度:;机构:;扩展1:;扩展2:;期数:1;可编辑:2;颜色:#99CCFF]
A27: =A26+1 -> 23 | B27: 1.19农业贷款小计 | C27: [指标][代码:A80540002700004;币种:1560001;属性:01;日期:;频度:;机构:;扩展1:;扩展2:;期数:1;可编辑:2;颜色:#99CCFF] | D27: [指标][代码:A80540002700005;币种:1560001;属性:01;日期:;频度:;机构:;扩展1:;扩展2:;期数:1;可编辑:2;颜色:#99CCFF] | E27: [指标][代码:A80540002700006;币种:1560001;属性:01;日期:;频度:;机构:;扩展1:;扩展2:;期数:1;可编辑:2;颜色:#99CCFF] | F27: [指标][代码:A80540002700007;币种:1560001;属性:01;日期:;频度:;机构:;扩展1:;扩展2:;期数:1;可编辑:2;颜色:#99CCFF] | G27: [指标][代码:A80540002700008;币种:1560001;属性:01;日期:;频度:;机构:;扩展1:;扩展2:;期数:1;可编辑:2;颜色:#99CCFF] | H27: [指标][代码:A80540002700009;币种:1560001;属性:01;日期:;频度:;机构:;扩展1:;扩展2:;期数:1;可编辑:2;颜色:#99CCFF]
A28: =A27+1 -> 24 | B28: 1.20农户贷款 | C28: [指标][代码:A80540002800004;币种:1560001;属性:01;日期:;频度:;机构:;扩展1:;扩展2:;期数:1;可编辑:1;颜色:] | D28: [指标][代码:A80540002800005;币种:1560001;属性:01;日期:;频度:;机构:;扩展1:;扩展2:;期数:1;可编辑:1;颜色:] | E28: [指标][代码:A80540002800006;币种:1560001;属性:01;日期:;频度:;机构:;扩展1:;扩展2:;期数:1;可编辑:1;颜色:] | F28: [指标][代码:A80540002800007;币种:1560001;属性:01;日期:;频度:;机构:;扩展1:;扩展2:;期数:1;可编辑:1;颜色:] | G28: [指标][代码:A80540002800008;币种:1560001;属性:01;日期:;频度:;机构:;扩展1:;扩展2:;期数:1;可编辑:2;颜色:#99CCFF] | H28: [指标][代码:A80540002800009;币种:1560001;属性:01;日期:;频度:;机构:;扩展1:;扩展2:;期数:1;可编辑:1;颜色:]
A29: =A28+1 -> 25 | B29: 1.21农村经济组织贷款 | C29: [指标][代码:A80540002900004;币种:1560001;属性:01;日期:;频度:;机构:;扩展1:;扩展2:;期数:1;可编辑:1;颜色:] | D29: [指标][代码:A80540002900005;币种:1560001;属性:01;日期:;频度:;机构:;扩展1:;扩展2:;期数:1;可编辑:1;颜色:] | E29: [指标][代码:A80540002900006;币种:1560001;属性:01;日期:;频度:;机构:;扩展1:;扩展2:;期数:1;可编辑:1;颜色:] | F29: [指标][代码:A80540002900007;币种:1560001;属性:01;日期:;频度:;机构:;扩展1:;扩展2:;期数:1;可编辑:1;颜色:] | G29: [指标][代码:A80540002900008;币种:1560001;属性:01;日期:;频度:;机构:;扩展1:;扩展2:;期数:1;可编辑:2;颜色:#99CCFF] | H29: [指标][代码:A80540002900009;币种:1560001;属性:01;日期:;频度:;机构:;扩展1:;扩展2:;期数:1;可编辑:1;颜色:]
A30: =A29+1 -> 26 | B30: 1.22农村企业贷款 | C30: [指标][代码:A80540003000004;币种:1560001;属性:01;日期:;频度:;机构:;扩展1:;扩展2:;期数:1;可编辑:1;颜色:] | D30: [指标][代码:A80540003000005;币种:1560001;属性:01;日期:;频度:;机构:;扩展1:;扩展2:;期数:1;可编辑:1;颜色:] | E30: [指标][代码:A80540003000006;币种:1560001;属性:01;日期:;频度:;机构:;扩展1:;扩展2:;期数:1;可编辑:1;颜色:] | F30: [指标][代码:A80540003000007;币种:1560001;属性:01;日期:;频度:;机构:;扩展1:;扩展2:;期数:1;可编辑:1;颜色:] | G30: [指标][代码:A80540003000008;币种:1560001;属性:01;日期:;频度:;机构:;扩展1:;扩展2:;期数:1;可编辑:2;颜色:#99CCFF] | H30: [指标][代码:A80540003000009;币种:1560001;属性:01;日期:;频度:;机构:;扩展1:;扩展2:;期数:1;可编辑:1;颜色:]
A31: =A30+1 -> 27 | B31: 1.23非农贷款 | C31: [指标][代码:A80540003100004;币种:1560001;属性:01;日期:;频度:;机构:;扩展1:;扩展2:;期数:1;可编辑:1;颜色:] | D31: [指标][代码:A80540003100005;币种:1560001;属性:01;日期:;频度:;机构:;扩展1:;扩展2:;期数:1;可编辑:1;颜色:] | E31: [指标][代码:A80540003100006;币种:1560001;属性:01;日期:;频度:;机构:;扩展1:;扩展2:;期数:1;可编辑:1;颜色:] | F31: [指标][代码:A80540003100007;币种:1560001;属性:01;日期:;频度:;机构:;扩展1:;扩展2:;期数:1;可编辑:1;颜色:] | G31: [指标][代码:A80540003100008;币种:1560001;属性:01;日期:;频度:;机构:;扩展1:;扩展2:;期数:1;可编辑:2;颜色:#99CCFF] | H31: [指标][代码:A80540003100009;币种:1560001;属性:01;日期:;频度:;机构:;扩展1:;扩展2:;期数:1;可编辑:1;颜色:]
A32: =A31+1 -> 28 | B32: 1.24信用卡透支 | C32: [指标][代码:A80540003200004;币种:1560001;属性:01;日期:;频度:;机构:;扩展1:;扩展2:;期数:1;可编辑:1;颜色:] | D32: [指标][代码:A80540003200005;币种:1560001;属性:01;日期:;频度:;机构:;扩展1:;扩展2:;期数:1;可编辑:1;颜色:] | E32: [指标][代码:A80540003200006;币种:1560001;属性:01;日期:;频度:;机构:;扩展1:;扩展2:;期数:1;可编辑:1;颜色:] | F32: [指标][代码:A80540003200007;币种:1560001;属性:01;日期:;频度:;机构:;扩展1:;扩展2:;期数:1;可编辑:1;颜色:] | G32: [指标][代码:A80540003200008;币种:1560001;属性:01;日期:;频度:;机构:;扩展1:;扩展2:;期数:1;可编辑:2;颜色:#99CCFF] | H32: [指标][代码:A80540003200009;币种:1560001;属性:01;日期:;频度:;机构:;扩展1:;扩展2:;期数:1;可编辑:1;颜色:]
A33: =A32+1 -> 29 | B33: 1.25 贴现资产 | C33: [指标][代码:A80540003300004;币种:1560001;属性:01;日期:;频度:;机构:;扩展1:;扩展2:;期数:1;可编辑:2;颜色:#99CCFF] | D33: [指标][代码:A80540003300005;币种:1560001;属性:01;日期:;频度:;机构:;扩展1:;扩展2:;期数:1;可编辑:1;颜色:] | E33: [指标][代码:A80540003300006;币种:1560001;属性:01;日期:;频度:;机构:;扩展1:;扩展2:;期数:1;可编辑:1;颜色:] | F33: [指标][代码:A80540003300007;币种:1560001;属性:01;日期:;频度:;机构:;扩展1:;扩展2:;期数:1;可编辑:1;颜色:] | G33: [指标][代码:A80540003300008;币种:1560001;属性:01;日期:;频度:;机构:;扩展1:;扩展2:;期数:1;可编辑:1;颜色:] | H33: [指标][代码:A80540003300009;币种:1560001;属性:01;日期:;频度:;机构:;扩展1:;扩展2:;期数:1;可编辑:1;颜色:]
A34: =A33+1 -> 30 | B34: 1.25.1其中：票据贴现 | C34: [指标][代码:A80540003400004;币种:1560001;属性:01;日期:;频度:;机构:;扩展1:;扩展2:;期数:1;可编辑:1;颜色:] | D34: [指标][代码:A80540003400005;币种:1560001;属性:01;日期:;频度:;机构:;扩展1:;扩展2:;期数:1;可编辑:1;颜色:] | E34: [指标][代码:A80540003400006;币种:1560001;属性:01;日期:;频度:;机构:;扩展1:;扩展2:;期数:1;可编辑:1;颜色:] | F34: [指标][代码:A80540003400007;币种:1560001;属性:01;日期:;频度:;机构:;扩展1:;扩展2:;期数:1;可编辑:1;颜色:] | G34: [指标][代码:A80540003400008;币种:1560001;属性:01;日期:;频度:;机构:;扩展1:;扩展2:;期数:1;可编辑:2;颜色:#99CCFF] | H34: [指标][代码:A80540003400009;币种:1560001;属性:01;日期:;频度:;机构:;扩展1:;扩展2:;期数:1;可编辑:1;颜色:]
A35: =A34+1 -> 31 | B35: 1.25.2转贴现 | C35: [指标][代码:A80540003500004;币种:1560001;属性:01;日期:;频度:;机构:;扩展1:;扩展2:;期数:1;可编辑:1;颜色:] | D35: [指标][代码:A80540003500005;币种:1560001;属性:01;日期:;频度:;机构:;扩展1:;扩展2:;期数:1;可编辑:1;颜色:] | E35: [指标][代码:A80540003500006;币种:1560001;属性:01;日期:;频度:;机构:;扩展1:;扩展2:;期数:1;可编辑:1;颜色:] | F35: [指标][代码:A80540003500007;币种:1560001;属性:01;日期:;频度:;机构:;扩展1:;扩展2:;期数:1;可编辑:1;颜色:] | G35: [指标][代码:A80540003500008;币种:1560001;属性:01;日期:;频度:;机构:;扩展1:;扩展2:;期数:1;可编辑:1;颜色:] | H35: [指标][代码:A80540003500009;币种:1560001;属性:01;日期:;频度:;机构:;扩展1:;扩展2:;期数:1;可编辑:1;颜色:]
A36: =A35+1 -> 32 | B36: 1.26贸易融资 | C36: [指标][代码:A80540003600004;币种:1560001;属性:01;日期:;频度:;机构:;扩展1:;扩展2:;期数:1;可编辑:1;颜色:] | D36: [指标][代码:A80540003600005;币种:1560001;属性:01;日期:;频度:;机构:;扩展1:;扩展2:;期数:1;可编辑:1;颜色:] | E36: [指标][代码:A80540003600006;币种:1560001;属性:01;日期:;频度:;机构:;扩展1:;扩展2:;期数:1;可编辑:1;颜色:] | F36: [指标][代码:A80540003600007;币种:1560001;属性:01;日期:;频度:;机构:;扩展1:;扩展2:;期数:1;可编辑:1;颜色:] | G36: [指标][代码:A80540003600008;币种:1560001;属性:01;日期:;频度:;机构:;扩展1:;扩展2:;期数:1;可编辑:2;颜色:#99CCFF] | H36: [指标][代码:A80540003600009;币种:1560001;属性:01;日期:;频度:;机构:;扩展1:;扩展2:;期数:1;可编辑:1;颜色:]
A37: =A36+1 -> 33 | B37: 1.27垫款 | C37: [指标][代码:A80540003700004;币种:1560001;属性:01;日期:;频度:;机构:;扩展1:;扩展2:;期数:1;可编辑:1;颜色:] | D37: [指标][代码:A80540003700005;币种:1560001;属性:01;日期:;频度:;机构:;扩展1:;扩展2:;期数:1;可编辑:1;颜色:] | E37: [指标][代码:A80540003700006;币种:1560001;属性:01;日期:;频度:;机构:;扩展1:;扩展2:;期数:1;可编辑:1;颜色:] | F37: [指标][代码:A80540003700007;币种:1560001;属性:01;日期:;频度:;机构:;扩展1:;扩展2:;期数:1;可编辑:1;颜色:] | G37: [指标][代码:A80540003700008;币种:1560001;属性:01;日期:;频度:;机构:;扩展1:;扩展2:;期数:1;可编辑:2;颜色:#99CCFF] | H37: [指标][代码:A80540003700009;币种:1560001;属性:01;日期:;频度:;机构:;扩展1:;扩展2:;期数:1;可编辑:1;颜色:]
A38: =A37+1 -> 34 | B38: 1.27.1其中：贴现垫款 | C38: [指标][代码:A80540003800004;币种:1560001;属性:01;日期:;频度:;机构:;扩展1:;扩展2:;期数:1;可编辑:1;颜色:] | D38: [指标][代码:A80540003800005;币种:1560001;属性:01;日期:;频度:;机构:;扩展1:;扩展2:;期数:1;可编辑:1;颜色:] | E38: [指标][代码:A80540003800006;币种:1560001;属性:01;日期:;频度:;机构:;扩展1:;扩展2:;期数:1;可编辑:1;颜色:] | F38: [指标][代码:A80540003800007;币种:1560001;属性:01;日期:;频度:;机构:;扩展1:;扩展2:;期数:1;可编辑:1;颜色:] | G38: [指标][代码:A80540003800008;币种:1560001;属性:01;日期:;频度:;机构:;扩展1:;扩展2:;期数:1;可编辑:1;颜色:] | H38: [指标][代码:A80540003800009;币种:1560001;属性:01;日期:;频度:;机构:;扩展1:;扩展2:;期数:1;可编辑:1;颜色:]
A39: =A38+1 -> 35 | B39: 1.27.2银行承兑汇票垫款 | C39: [指标][代码:A80540003900004;币种:1560001;属性:01;日期:;频度:;机构:;扩展1:;扩展2:;期数:1;可编辑:1;颜色:] | D39: [指标][代码:A80540003900005;币种:1560001;属性:01;日期:;频度:;机构:;扩展1:;扩展2:;期数:1;可编辑:1;颜色:] | E39: [指标][代码:A80540003900006;币种:1560001;属性:01;日期:;频度:;机构:;扩展1:;扩展2:;期数:1;可编辑:1;颜色:] | F39: [指标][代码:A80540003900007;币种:1560001;属性:01;日期:;频度:;机构:;扩展1:;扩展2:;期数:1;可编辑:1;颜色:] | G39: [指标][代码:A80540003900008;币种:1560001;属性:01;日期:;频度:;机构:;扩展1:;扩展2:;期数:1;可编辑:1;颜色:] | H39: [指标][代码:A80540003900009;币种:1560001;属性:01;日期:;频度:;机构:;扩展1:;扩展2:;期数:1;可编辑:1;颜色:]
A40: =A39+1 -> 36 | B40: 1.27.3保函业务垫款 | C40: [指标][代码:A80540004000004;币种:1560001;属性:01;日期:;频度:;机构:;扩展1:;扩展2:;期数:1;可编辑:1;颜色:] | D40: [指标][代码:A80540004000005;币种:1560001;属性:01;日期:;频度:;机构:;扩展1:;扩展2:;期数:1;可编辑:1;颜色:] | E40: [指标][代码:A80540004000006;币种:1560001;属性:01;日期:;频度:;机构:;扩展1:;扩展2:;期数:1;可编辑:1;颜色:] | F40: [指标][代码:A80540004000007;币种:1560001;属性:01;日期:;频度:;机构:;扩展1:;扩展2:;期数:1;可编辑:1;颜色:] | G40: [指标][代码:A80540004000008;币种:1560001;属性:01;日期:;频度:;机构:;扩展1:;扩展2:;期数:1;可编辑:1;颜色:] | H40: [指标][代码:A80540004000009;币种:1560001;属性:01;日期:;频度:;机构:;扩展1:;扩展2:;期数:1;可编辑:1;颜色:]
A41: =A40+1 -> 37 | B41: 1.27.4信用证垫款 | C41: [指标][代码:A80540004100004;币种:1560001;属性:01;日期:;频度:;机构:;扩展1:;扩展2:;期数:1;可编辑:1;颜色:] | D41: [指标][代码:A80540004100005;币种:1560001;属性:01;日期:;频度:;机构:;扩展1:;扩展2:;期数:1;可编辑:1;颜色:] | E41: [指标][代码:A80540004100006;币种:1560001;属性:01;日期:;频度:;机构:;扩展1:;扩展2:;期数:1;可编辑:1;颜色:] | F41: [指标][代码:A80540004100007;币种:1560001;属性:01;日期:;频度:;机构:;扩展1:;扩展2:;期数:1;可编辑:1;颜色:] | G41: [指标][代码:A80540004100008;币种:1560001;属性:01;日期:;频度:;机构:;扩展1:;扩展2:;期数:1;可编辑:1;颜色:] | H41: [指标][代码:A80540004100009;币种:1560001;属性:01;日期:;频度:;机构:;扩展1:;扩展2:;期数:1;可编辑:1;颜色:]
A42: =A41+1 -> 38 | B42: 1.28贷款损失准备 | C42: [指标][代码:A80540004200004;币种:1560001;属性:01;日期:;频度:;机构:;扩展1:;扩展2:;期数:1;可编辑:1;颜色:] | D42: [指标][代码:A80540004200005;币种:1560001;属性:01;日期:;频度:;机构:;扩展1:;扩展2:;期数:1;可编辑:1;颜色:] | E42: [指标][代码:A80540004200006;币种:1560001;属性:01;日期:;频度:;机构:;扩展1:;扩展2:;期数:1;可编辑:1;颜色:] | F42: [指标][代码:A80540004200007;币种:1560001;属性:01;日期:;频度:;机构:;扩展1:;扩展2:;期数:1;可编辑:1;颜色:] | G42: [指标][代码:A80540004200008;币种:1560001;属性:01;日期:;频度:;机构:;扩展1:;扩展2:;期数:1;可编辑:1;颜色:] | H42: [指标][代码:A80540004200009;币种:1560001;属性:01;日期:;频度:;机构:;扩展1:;扩展2:;期数:1;可编辑:2;颜色:#99CCFF]
A43: =A42+1 -> 39 | B43: 1.29代理兑付证券 | C43: [指标][代码:A80540004300004;币种:1560001;属性:01;日期:;频度:;机构:;扩展1:;扩展2:;期数:1;可编辑:1;颜色:] | D43: [指标][代码:A80540004300005;币种:1560001;属性:01;日期:;频度:;机构:;扩展1:;扩展2:;期数:1;可编辑:1;颜色:] | E43: [指标][代码:A80540004300006;币种:1560001;属性:01;日期:;频度:;机构:;扩展1:;扩展2:;期数:1;可编辑:1;颜色:] | F43: [指标][代码:A80540004300007;币种:1560001;属性:01;日期:;频度:;机构:;扩展1:;扩展2:;期数:1;可编辑:1;颜色:] | G43: [指标][代码:A80540004300008;币种:1560001;属性:01;日期:;频度:;机构:;扩展1:;扩展2:;期数:1;可编辑:2;颜色:#99CCFF] | H43: [指标][代码:A80540004300009;币种:1560001;属性:01;日期:;频度:;机构:;扩展1:;扩展2:;期数:1;可编辑:1;颜色:]
A44: =A43+1 -> 40 | B44: 1.30代理业务资产 | C44: [指标][代码:A80540004400004;币种:1560001;属性:01;日期:;频度:;机构:;扩展1:;扩展2:;期数:1;可编辑:1;颜色:] | D44: [指标][代码:A80540004400005;币种:1560001;属性:01;日期:;频度:;机构:;扩展1:;扩展2:;期数:1;可编辑:1;颜色:] | E44: [指标][代码:A80540004400006;币种:1560001;属性:01;日期:;频度:;机构:;扩展1:;扩展2:;期数:1;可编辑:1;颜色:] | F44: [指标][代码:A80540004400007;币种:1560001;属性:01;日期:;频度:;机构:;扩展1:;扩展2:;期数:1;可编辑:1;颜色:] | G44: [指标][代码:A80540004400008;币种:1560001;属性:01;日期:;频度:;机构:;扩展1:;扩展2:;期数:1;可编辑:2;颜色:#99CCFF] | H44: [指标][代码:A80540004400009;币种:1560001;属性:01;日期:;频度:;机构:;扩展1:;扩展2:;期数:1;可编辑:1;颜色:]
A45: =A44+1 -> 41 | B45: 1.31贵金属 | C45: [指标][代码:A80540004500004;币种:1560001;属性:01;日期:;频度:;机构:;扩展1:;扩展2:;期数:1;可编辑:1;颜色:] | D45: [指标][代码:A80540004500005;币种:1560001;属性:01;日期:;频度:;机构:;扩展1:;扩展2:;期数:1;可编辑:1;颜色:] | E45: [指标][代码:A80540004500006;币种:1560001;属性:01;日期:;频度:;机构:;扩展1:;扩展2:;期数:1;可编辑:1;颜色:] | F45: [指标][代码:A80540004500007;币种:1560001;属性:01;日期:;频度:;机构:;扩展1:;扩展2:;期数:1;可编辑:1;颜色:] | G45: [指标][代码:A80540004500008;币种:1560001;属性:01;日期:;频度:;机构:;扩展1:;扩展2:;期数:1;可编辑:2;颜色:#99CCFF] | H45: [指标][代码:A80540004500009;币种:1560001;属性:01;日期:;频度:;机构:;扩展1:;扩展2:;期数:1;可编辑:1;颜色:]
A46: =A45+1 -> 42 | B46: 1.32贵金属跌价准备 | C46: [指标][代码:A80540004600004;币种:1560001;属性:01;日期:;频度:;机构:;扩展1:;扩展2:;期数:1;可编辑:1;颜色:] | D46: [指标][代码:A80540004600005;币种:1560001;属性:01;日期:;频度:;机构:;扩展1:;扩展2:;期数:1;可编辑:1;颜色:] | E46: [指标][代码:A80540004600006;币种:1560001;属性:01;日期:;频度:;机构:;扩展1:;扩展2:;期数:1;可编辑:1;颜色:] | F46: [指标][代码:A80540004600007;币种:1560001;属性:01;日期:;频度:;机构:;扩展1:;扩展2:;期数:1;可编辑:1;颜色:] | G46: [指标][代码:A80540004600008;币种:1560001;属性:01;日期:;频度:;机构:;扩展1:;扩展2:;期数:1;可编辑:1;颜色:] | H46: [指标][代码:A80540004600009;币种:1560001;属性:01;日期:;频度:;机构:;扩展1:;扩展2:;期数:1;可编辑:2;颜色:#99CCFF]
A47: =A46+1 -> 43 | B47: 1.33抵债资产 | C47: [指标][代码:A80540004700004;币种:1560001;属性:01;日期:;频度:;机构:;扩展1:;扩展2:;期数:1;可编辑:1;颜色:] | D47: [指标][代码:A80540004700005;币种:1560001;属性:01;日期:;频度:;机构:;扩展1:;扩展2:;期数:1;可编辑:1;颜色:] | E47: [指标][代码:A80540004700006;币种:1560001;属性:01;日期:;频度:;机构:;扩展1:;扩展2:;期数:1;可编辑:1;颜色:] | F47: [指标][代码:A80540004700007;币种:1560001;属性:01;日期:;频度:;机构:;扩展1:;扩展2:;期数:1;可编辑:1;颜色:] | G47: [指标][代码:A80540004700008;币种:1560001;属性:01;日期:;频度:;机构:;扩展1:;扩展2:;期数:1;可编辑:2;颜色:#99CCFF] | H47: [指标][代码:A80540004700009;币种:1560001;属性:01;日期:;频度:;机构:;扩展1:;扩展2:;期数:1;可编辑:1;颜色:]
A48: =A47+1 -> 44 | B48: 1.34抵债资产减值准备 | C48: [指标][代码:A80540004800004;币种:1560001;属性:01;日期:;频度:;机构:;扩展1:;扩展2:;期数:1;可编辑:1;颜色:] | D48: [指标][代码:A80540004800005;币种:1560001;属性:01;日期:;频度:;机构:;扩展1:;扩展2:;期数:1;可编辑:1;颜色:] | E48: [指标][代码:A80540004800006;币种:1560001;属性:01;日期:;频度:;机构:;扩展1:;扩展2:;期数:1;可编辑:1;颜色:] | F48: [指标][代码:A80540004800007;币种:1560001;属性:01;日期:;频度:;机构:;扩展1:;扩展2:;期数:1;可编辑:1;颜色:] | G48: [指标][代码:A80540004800008;币种:1560001;属性:01;日期:;频度:;机构:;扩展1:;扩展2:;期数:1;可编辑:1;颜色:] | H48: [指标][代码:A80540004800009;币种:1560001;属性:01;日期:;频度:;机构:;扩展1:;扩展2:;期数:1;可编辑:2;颜色:#99CCFF]
A49: =A48+1 -> 45 | B49: 1.35持有至到期投资 | C49: [指标][代码:A80540004900004;币种:1560001;属性:01;日期:;频度:;机构:;扩展1:;扩展2:;期数:1;可编辑:1;颜色:] | D49: [指标][代码:A80540004900005;币种:1560001;属性:01;日期:;频度:;机构:;扩展1:;扩展2:;期数:1;可编辑:1;颜色:] | E49: [指标][代码:A80540004900006;币种:1560001;属性:01;日期:;频度:;机构:;扩展1:;扩展2:;期数:1;可编辑:1;颜色:] | F49: [指标][代码:A80540004900007;币种:1560001;属性:01;日期:;频度:;机构:;扩展1:;扩展2:;期数:1;可编辑:1;颜色:] | G49: [指标][代码:A80540004900008;币种:1560001;属性:01;日期:;频度:;机构:;扩展1:;扩展2:;期数:1;可编辑:2;颜色:#99CCFF] | H49: [指标][代码:A80540004900009;币种:1560001;属性:01;日期:;频度:;机构:;扩展1:;扩展2:;期数:1;可编辑:1;颜色:]
A50: =A49+1 -> 46 | B50: 1.36持有至到期投资减值准备 | C50: [指标][代码:A80540005000004;币种:1560001;属性:01;日期:;频度:;机构:;扩展1:;扩展2:;期数:1;可编辑:1;颜色:] | D50: [指标][代码:A80540005000005;币种:1560001;属性:01;日期:;频度:;机构:;扩展1:;扩展2:;期数:1;可编辑:1;颜色:] | E50: [指标][代码:A80540005000006;币种:1560001;属性:01;日期:;频度:;机构:;扩展1:;扩展2:;期数:1;可编辑:1;颜色:] | F50: [指标][代码:A80540005000007;币种:1560001;属性:01;日期:;频度:;机构:;扩展1:;扩展2:;期数:1;可编辑:1;颜色:] | G50: [指标][代码:A80540005000008;币种:1560001;属性:01;日期:;频度:;机构:;扩展1:;扩展2:;期数:1;可编辑:1;颜色:] | H50: [指标][代码:A80540005000009;币种:1560001;属性:01;日期:;频度:;机构:;扩展1:;扩展2:;期数:1;可编辑:2;颜色:#99CCFF]
A51: =A50+1 -> 47 | B51: 1.37可供出售金融资产 | C51: [指标][代码:A80540005100004;币种:1560001;属性:01;日期:;频度:;机构:;扩展1:;扩展2:;期数:1;可编辑:1;颜色:] | D51: [指标][代码:A80540005100005;币种:1560001;属性:01;日期:;频度:;机构:;扩展1:;扩展2:;期数:1;可编辑:1;颜色:] | E51: [指标][代码:A80540005100006;币种:1560001;属性:01;日期:;频度:;机构:;扩展1:;扩展2:;期数:1;可编辑:1;颜色:] | F51: [指标][代码:A80540005100007;币种:1560001;属性:01;日期:;频度:;机构:;扩展1:;扩展2:;期数:1;可编辑:1;颜色:] | G51: [指标][代码:A80540005100008;币种:1560001;属性:01;日期:;频度:;机构:;扩展1:;扩展2:;期数:1;可编辑:2;颜色:#99CCFF] | H51: [指标][代码:A80540005100009;币种:1560001;属性:01;日期:;频度:;机构:;扩展1:;扩展2:;期数:1;可编辑:1;颜色:]
A52: =A51+1 -> 48 | B52: 1.38可供出售金融资产减值准备 | C52: [指标][代码:A80540005200004;币种:1560001;属性:01;日期:;频度:;机构:;扩展1:;扩展2:;期数:1;可编辑:1;颜色:] | D52: [指标][代码:A80540005200005;币种:1560001;属性:01;日期:;频度:;机构:;扩展1:;扩展2:;期数:1;可编辑:1;颜色:] | E52: [指标][代码:A80540005200006;币种:1560001;属性:01;日期:;频度:;机构:;扩展1:;扩展2:;期数:1;可编辑:1;颜色:] | F52: [指标][代码:A80540005200007;币种:1560001;属性:01;日期:;频度:;机构:;扩展1:;扩展2:;期数:1;可编辑:1;颜色:] | G52: [指标][代码:A80540005200008;币种:1560001;属性:01;日期:;频度:;机构:;扩展1:;扩展2:;期数:1;可编辑:1;颜色:] | H52: [指标][代码:A80540005200009;币种:1560001;属性:01;日期:;频度:;机构:;扩展1:;扩展2:;期数:1;可编辑:2;颜色:#99CCFF]
A53: =A52+1 -> 49 | B53: 1.39长期股权投资 | C53: [指标][代码:A80540005300004;币种:1560001;属性:01;日期:;频度:;机构:;扩展1:;扩展2:;期数:1;可编辑:1;颜色:] | D53: [指标][代码:A80540005300005;币种:1560001;属性:01;日期:;频度:;机构:;扩展1:;扩展2:;期数:1;可编辑:1;颜色:] | E53: [指标][代码:A80540005300006;币种:1560001;属性:01;日期:;频度:;机构:;扩展1:;扩展2:;期数:1;可编辑:1;颜色:] | F53: [指标][代码:A80540005300007;币种:1560001;属性:01;日期:;频度:;机构:;扩展1:;扩展2:;期数:1;可编辑:1;颜色:] | G53: [指标][代码:A80540005300008;币种:1560001;属性:01;日期:;频度:;机构:;扩展1:;扩展2:;期数:1;可编辑:2;颜色:#99CCFF] | H53: [指标][代码:A80540005300009;币种:1560001;属性:01;日期:;频度:;机构:;扩展1:;扩展2:;期数:1;可编辑:1;颜色:]
A54: =A53+1 -> 50 | B54: 1.39.1其中：入股联社资金 | C54: [指标][代码:A80540005400004;币种:1560001;属性:01;日期:;频度:;机构:;扩展1:;扩展2:;期数:1;可编辑:1;颜色:] | D54: [指标][代码:A80540005400005;币种:1560001;属性:01;日期:;频度:;机构:;扩展1:;扩展2:;期数:1;可编辑:1;颜色:] | E54: [指标][代码:A80540005400006;币种:1560001;属性:01;日期:;频度:;机构:;扩展1:;扩展2:;期数:1;可编辑:1;颜色:] | F54: [指标][代码:A80540005400007;币种:1560001;属性:01;日期:;频度:;机构:;扩展1:;扩展2:;期数:1;可编辑:1;颜色:] | G54: [指标][代码:A80540005400008;币种:1560001;属性:01;日期:;频度:;机构:;扩展1:;扩展2:;期数:1;可编辑:1;颜色:] | H54: [指标][代码:A80540005400009;币种:1560001;属性:01;日期:;频度:;机构:;扩展1:;扩展2:;期数:1;可编辑:1;颜色:]
A55: =A54+1 -> 51 | B55: 1.40长期股权投资减值准备 | C55: [指标][代码:A80540005500004;币种:1560001;属性:01;日期:;频度:;机构:;扩展1:;扩展2:;期数:1;可编辑:1;颜色:] | D55: [指标][代码:A80540005500005;币种:1560001;属性:01;日期:;频度:;机构:;扩展1:;扩展2:;期数:1;可编辑:1;颜色:] | E55: [指标][代码:A80540005500006;币种:1560001;属性:01;日期:;频度:;机构:;扩展1:;扩展2:;期数:1;可编辑:1;颜色:] | F55: [指标][代码:A80540005500007;币种:1560001;属性:01;日期:;频度:;机构:;扩展1:;扩展2:;期数:1;可编辑:1;颜色:] | G55: [指标][代码:A80540005500008;币种:1560001;属性:01;日期:;频度:;机构:;扩展1:;扩展2:;期数:1;可编辑:1;颜色:] | H55: [指标][代码:A80540005500009;币种:1560001;属性:01;日期:;频度:;机构:;扩展1:;扩展2:;期数:1;可编辑:2;颜色:#99CCFF]
A56: =A55+1 -> 52 | B56: 1.41投资性房地产 | C56: [指标][代码:A80540005600004;币种:1560001;属性:01;日期:;频度:;机构:;扩展1:;扩展2:;期数:1;可编辑:1;颜色:] | D56: [指标][代码:A80540005600005;币种:1560001;属性:01;日期:;频度:;机构:;扩展1:;扩展2:;期数:1;可编辑:1;颜色:] | E56: [指标][代码:A80540005600006;币种:1560001;属性:01;日期:;频度:;机构:;扩展1:;扩展2:;期数:1;可编辑:1;颜色:] | F56: [指标][代码:A80540005600007;币种:1560001;属性:01;日期:;频度:;机构:;扩展1:;扩展2:;期数:1;可编辑:1;颜色:] | G56: [指标][代码:A80540005600008;币种:1560001;属性:01;日期:;频度:;机构:;扩展1:;扩展2:;期数:1;可编辑:2;颜色:#99CCFF] | H56: [指标][代码:A80540005600009;币种:1560001;属性:01;日期:;频度:;机构:;扩展1:;扩展2:;期数:1;可编辑:1;颜色:]
A57: =A56+1 -> 53 | B57: 1.42投资性房地产累计折旧（摊销） | C57: [指标][代码:A80540005700004;币种:1560001;属性:01;日期:;频度:;机构:;扩展1:;扩展2:;期数:1;可编辑:1;颜色:] | D57: [指标][代码:A80540005700005;币种:1560001;属性:01;日期:;频度:;机构:;扩展1:;扩展2:;期数:1;可编辑:1;颜色:] | E57: [指标][代码:A80540005700006;币种:1560001;属性:01;日期:;频度:;机构:;扩展1:;扩展2:;期数:1;可编辑:1;颜色:] | F57: [指标][代码:A80540005700007;币种:1560001;属性:01;日期:;频度:;机构:;扩展1:;扩展2:;期数:1;可编辑:1;颜色:] | G57: [指标][代码:A80540005700008;币种:1560001;属性:01;日期:;频度:;机构:;扩展1:;扩展2:;期数:1;可编辑:1;颜色:] | H57: [指标][代码:A80540005700009;币种:1560001;属性:01;日期:;频度:;机构:;扩展1:;扩展2:;期数:1;可编辑:2;颜色:#99CCFF]
A58: =A57+1 -> 54 | B58: 1.43投资性房地产减值准备 | C58: [指标][代码:A80540005800004;币种:1560001;属性:01;日期:;频度:;机构:;扩展1:;扩展2:;期数:1;可编辑:1;颜色:] | D58: [指标][代码:A80540005800005;币种:1560001;属性:01;日期:;频度:;机构:;扩展1:;扩展2:;期数:1;可编辑:1;颜色:] | E58: [指标][代码:A80540005800006;币种:1560001;属性:01;日期:;频度:;机构:;扩展1:;扩展2:;期数:1;可编辑:1;颜色:] | F58: [指标][代码:A80540005800007;币种:1560001;属性:01;日期:;频度:;机构:;扩展1:;扩展2:;期数:1;可编辑:1;颜色:] | G58: [指标][代码:A80540005800008;币种:1560001;属性:01;日期:;频度:;机构:;扩展1:;扩展2:;期数:1;可编辑:1;颜色:] | H58: [指标][代码:A80540005800009;币种:1560001;属性:01;日期:;频度:;机构:;扩展1:;扩展2:;期数:1;可编辑:2;颜色:#99CCFF]
A59: =A58+1 -> 55 | B59: 1.44应收款项类投资 | C59: [指标][代码:A80540005900004;币种:1560001;属性:01;日期:;频度:;机构:;扩展1:;扩展2:;期数:1;可编辑:1;颜色:] | D59: [指标][代码:A80540005900005;币种:1560001;属性:01;日期:;频度:;机构:;扩展1:;扩展2:;期数:1;可编辑:1;颜色:] | E59: [指标][代码:A80540005900006;币种:1560001;属性:01;日期:;频度:;机构:;扩展1:;扩展2:;期数:1;可编辑:1;颜色:] | F59: [指标][代码:A80540005900007;币种:1560001;属性:01;日期:;频度:;机构:;扩展1:;扩展2:;期数:1;可编辑:1;颜色:] | G59: [指标][代码:A80540005900008;币种:1560001;属性:01;日期:;频度:;机构:;扩展1:;扩展2:;期数:1;可编辑:2;颜色:#99CCFF] | H59: [指标][代码:A80540005900009;币种:1560001;属性:01;日期:;频度:;机构:;扩展1:;扩展2:;期数:1;可编辑:1;颜色:]
A60: =A59+1 -> 56 | B60: 1.45 未实现融资收益 | C60: [指标][代码:A80540006000004;币种:1560001;属性:01;日期:;频度:;机构:;扩展1:;扩展2:;期数:1;可编辑:1;颜色:] | D60: [指标][代码:A80540006000005;币种:1560001;属性:01;日期:;频度:;机构:;扩展1:;扩展2:;期数:1;可编辑:1;颜色:] | E60: [指标][代码:A80540006000006;币种:1560001;属性:01;日期:;频度:;机构:;扩展1:;扩展2:;期数:1;可编辑:1;颜色:] | F60: [指标][代码:A80540006000007;币种:1560001;属性:01;日期:;频度:;机构:;扩展1:;扩展2:;期数:1;可编辑:1;颜色:] | G60: [指标][代码:A80540006000008;币种:1560001;属性:01;日期:;频度:;机构:;扩展1:;扩展2:;期数:1;可编辑:2;颜色:#99CCFF] | H60: [指标][代码:A80540006000009;币种:1560001;属性:01;日期:;频度:;机构:;扩展1:;扩展2:;期数:1;可编辑:1;颜色:]
A61: =A60+1 -> 57 | B61: 1.46固定资产 | C61: [指标][代码:A80540006100004;币种:1560001;属性:01;日期:;频度:;机构:;扩展1:;扩展2:;期数:1;可编辑:1;颜色:] | D61: [指标][代码:A80540006100005;币种:1560001;属性:01;日期:;频度:;机构:;扩展1:;扩展2:;期数:1;可编辑:1;颜色:] | E61: [指标][代码:A80540006100006;币种:1560001;属性:01;日期:;频度:;机构:;扩展1:;扩展2:;期数:1;可编辑:1;颜色:] | F61: [指标][代码:A80540006100007;币种:1560001;属性:01;日期:;频度:;机构:;扩展1:;扩展2:;期数:1;可编辑:1;颜色:] | G61: [指标][代码:A80540006100008;币种:1560001;属性:01;日期:;频度:;机构:;扩展1:;扩展2:;期数:1;可编辑:2;颜色:#99CCFF] | H61: [指标][代码:A80540006100009;币种:1560001;属性:01;日期:;频度:;机构:;扩展1:;扩展2:;期数:1;可编辑:1;颜色:]
A62: =A61+1 -> 58 | B62: 1.47累计折旧款 | C62: [指标][代码:A80540006200004;币种:1560001;属性:01;日期:;频度:;机构:;扩展1:;扩展2:;期数:1;可编辑:1;颜色:] | D62: [指标][代码:A80540006200005;币种:1560001;属性:01;日期:;频度:;机构:;扩展1:;扩展2:;期数:1;可编辑:1;颜色:] | E62: [指标][代码:A80540006200006;币种:1560001;属性:01;日期:;频度:;机构:;扩展1:;扩展2:;期数:1;可编辑:1;颜色:] | F62: [指标][代码:A80540006200007;币种:1560001;属性:01;日期:;频度:;机构:;扩展1:;扩展2:;期数:1;可编辑:1;颜色:] | G62: [指标][代码:A80540006200008;币种:1560001;属性:01;日期:;频度:;机构:;扩展1:;扩展2:;期数:1;可编辑:1;颜色:] | H62: [指标][代码:A80540006200009;币种:1560001;属性:01;日期:;频度:;机构:;扩展1:;扩展2:;期数:1;可编辑:2;颜色:#99CCFF]
A63: =A62+1 -> 59 | B63: 1.48固定资产减值准备 | C63: [指标][代码:A80540006300004;币种:1560001;属性:01;日期:;频度:;机构:;扩展1:;扩展2:;期数:1;可编辑:1;颜色:] | D63: [指标][代码:A80540006300005;币种:1560001;属性:01;日期:;频度:;机构:;扩展1:;扩展2:;期数:1;可编辑:1;颜色:] | E63: [指标][代码:A80540006300006;币种:1560001;属性:01;日期:;频度:;机构:;扩展1:;扩展2:;期数:1;可编辑:1;颜色:] | F63: [指标][代码:A80540006300007;币种:1560001;属性:01;日期:;频度:;机构:;扩展1:;扩展2:;期数:1;可编辑:1;颜色:] | G63: [指标][代码:A80540006300008;币种:1560001;属性:01;日期:;频度:;机构:;扩展1:;扩展2:;期数:1;可编辑:1;颜色:] | H63: [指标][代码:A80540006300009;币种:1560001;属性:01;日期:;频度:;机构:;扩展1:;扩展2:;期数:1;可编辑:2;颜色:#99CCFF]
A64: =A63+1 -> 60 | B64: 1.49在建工程 | C64: [指标][代码:A80540006400004;币种:1560001;属性:01;日期:;频度:;机构:;扩展1:;扩展2:;期数:1;可编辑:1;颜色:] | D64: [指标][代码:A80540006400005;币种:1560001;属性:01;日期:;频度:;机构:;扩展1:;扩展2:;期数:1;可编辑:1;颜色:] | E64: [指标][代码:A80540006400006;币种:1560001;属性:01;日期:;频度:;机构:;扩展1:;扩展2:;期数:1;可编辑:1;颜色:] | F64: [指标][代码:A80540006400007;币种:1560001;属性:01;日期:;频度:;机构:;扩展1:;扩展2:;期数:1;可编辑:1;颜色:] | G64: [指标][代码:A80540006400008;币种:1560001;属性:01;日期:;频度:;机构:;扩展1:;扩展2:;期数:1;可编辑:2;颜色:#99CCFF] | H64: [指标][代码:A80540006400009;币种:1560001;属性:01;日期:;频度:;机构:;扩展1:;扩展2:;期数:1;可编辑:1;颜色:]
A65: =A64+1 -> 61 | B65: 1.50在建工程减值准备 | C65: [指标][代码:A80540006500004;币种:1560001;属性:01;日期:;频度:;机构:;扩展1:;扩展2:;期数:1;可编辑:1;颜色:] | D65: [指标][代码:A80540006500005;币种:1560001;属性:01;日期:;频度:;机构:;扩展1:;扩展2:;期数:1;可编辑:1;颜色:] | E65: [指标][代码:A80540006500006;币种:1560001;属性:01;日期:;频度:;机构:;扩展1:;扩展2:;期数:1;可编辑:1;颜色:] | F65: [指标][代码:A80540006500007;币种:1560001;属性:01;日期:;频度:;机构:;扩展1:;扩展2:;期数:1;可编辑:1;颜色:] | G65: [指标][代码:A80540006500008;币种:1560001;属性:01;日期:;频度:;机构:;扩展1:;扩展2:;期数:1;可编辑:1;颜色:] | H65: [指标][代码:A80540006500009;币种:1560001;属性:01;日期:;频度:;机构:;扩展1:;扩展2:;期数:1;可编辑:2;颜色:#99CCFF]
A66: =A65+1 -> 62 | B66: 1.51固定资产清理 | C66: [指标][代码:A80540006600004;币种:1560001;属性:01;日期:;频度:;机构:;扩展1:;扩展2:;期数:1;可编辑:1;颜色:] | D66: [指标][代码:A80540006600005;币种:1560001;属性:01;日期:;频度:;机构:;扩展1:;扩展2:;期数:1;可编辑:1;颜色:] | E66: [指标][代码:A80540006600006;币种:1560001;属性:01;日期:;频度:;机构:;扩展1:;扩展2:;期数:1;可编辑:1;颜色:] | F66: [指标][代码:A80540006600007;币种:1560001;属性:01;日期:;频度:;机构:;扩展1:;扩展2:;期数:1;可编辑:1;颜色:] | G66: [指标][代码:A80540006600008;币种:1560001;属性:01;日期:;频度:;机构:;扩展1:;扩展2:;期数:1;可编辑:1;颜色:] | H66: [指标][代码:A80540006600009;币种:1560001;属性:01;日期:;频度:;机构:;扩展1:;扩展2:;期数:1;可编辑:1;颜色:]
A67: =A66+1 -> 63 | B67: 1.52无形资产 | C67: [指标][代码:A80540006700004;币种:1560001;属性:01;日期:;频度:;机构:;扩展1:;扩展2:;期数:1;可编辑:1;颜色:] | D67: [指标][代码:A80540006700005;币种:1560001;属性:01;日期:;频度:;机构:;扩展1:;扩展2:;期数:1;可编辑:1;颜色:] | E67: [指标][代码:A80540006700006;币种:1560001;属性:01;日期:;频度:;机构:;扩展1:;扩展2:;期数:1;可编辑:1;颜色:] | F67: [指标][代码:A80540006700007;币种:1560001;属性:01;日期:;频度:;机构:;扩展1:;扩展2:;期数:1;可编辑:1;颜色:] | G67: [指标][代码:A80540006700008;币种:1560001;属性:01;日期:;频度:;机构:;扩展1:;扩展2:;期数:1;可编辑:2;颜色:#99CCFF] | H67: [指标][代码:A80540006700009;币种:1560001;属性:01;日期:;频度:;机构:;扩展1:;扩展2:;期数:1;可编辑:1;颜色:]
A68: =A67+1 -> 64 | B68: 1.53无形资产累计摊销 | C68: [指标][代码:A80540006800004;币种:1560001;属性:01;日期:;频度:;机构:;扩展1:;扩展2:;期数:1;可编辑:1;颜色:] | D68: [指标][代码:A80540006800005;币种:1560001;属性:01;日期:;频度:;机构:;扩展1:;扩展2:;期数:1;可编辑:1;颜色:] | E68: [指标][代码:A80540006800006;币种:1560001;属性:01;日期:;频度:;机构:;扩展1:;扩展2:;期数:1;可编辑:1;颜色:] | F68: [指标][代码:A80540006800007;币种:1560001;属性:01;日期:;频度:;机构:;扩展1:;扩展2:;期数:1;可编辑:1;颜色:] | G68: [指标][代码:A80540006800008;币种:1560001;属性:01;日期:;频度:;机构:;扩展1:;扩展2:;期数:1;可编辑:1;颜色:] | H68: [指标][代码:A80540006800009;币种:1560001;属性:01;日期:;频度:;机构:;扩展1:;扩展2:;期数:1;可编辑:2;颜色:#99CCFF]
A69: =A68+1 -> 65 | B69: 1.54无形资产减值准备 | C69: [指标][代码:A80540006900004;币种:1560001;属性:01;日期:;频度:;机构:;扩展1:;扩展2:;期数:1;可编辑:1;颜色:] | D69: [指标][代码:A80540006900005;币种:1560001;属性:01;日期:;频度:;机构:;扩展1:;扩展2:;期数:1;可编辑:1;颜色:] | E69: [指标][代码:A80540006900006;币种:1560001;属性:01;日期:;频度:;机构:;扩展1:;扩展2:;期数:1;可编辑:1;颜色:] | F69: [指标][代码:A80540006900007;币种:1560001;属性:01;日期:;频度:;机构:;扩展1:;扩展2:;期数:1;可编辑:1;颜色:] | G69: [指标][代码:A80540006900008;币种:1560001;属性:01;日期:;频度:;机构:;扩展1:;扩展2:;期数:1;可编辑:1;颜色:] | H69: [指标][代码:A80540006900009;币种:1560001;属性:01;日期:;频度:;机构:;扩展1:;扩展2:;期数:1;可编辑:2;颜色:#99CCFF]
A70: =A69+1 -> 66 | B70: 1.55长期待摊费用 | C70: [指标][代码:A80540007000004;币种:1560001;属性:01;日期:;频度:;机构:;扩展1:;扩展2:;期数:1;可编辑:1;颜色:] | D70: [指标][代码:A80540007000005;币种:1560001;属性:01;日期:;频度:;机构:;扩展1:;扩展2:;期数:1;可编辑:1;颜色:] | E70: [指标][代码:A80540007000006;币种:1560001;属性:01;日期:;频度:;机构:;扩展1:;扩展2:;期数:1;可编辑:1;颜色:] | F70: [指标][代码:A80540007000007;币种:1560001;属性:01;日期:;频度:;机构:;扩展1:;扩展2:;期数:1;可编辑:1;颜色:] | G70: [指标][代码:A80540007000008;币种:1560001;属性:01;日期:;频度:;机构:;扩展1:;扩展2:;期数:1;可编辑:2;颜色:#99CCFF] | H70: [指标][代码:A80540007000009;币种:1560001;属性:01;日期:;频度:;机构:;扩展1:;扩展2:;期数:1;可编辑:1;颜色:]
A71: =A70+1 -> 67 | B71: 1.56递延所得税资产 | C71: [指标][代码:A80540007100004;币种:1560001;属性:01;日期:;频度:;机构:;扩展1:;扩展2:;期数:1;可编辑:1;颜色:] | D71: [指标][代码:A80540007100005;币种:1560001;属性:01;日期:;频度:;机构:;扩展1:;扩展2:;期数:1;可编辑:1;颜色:] | E71: [指标][代码:A80540007100006;币种:1560001;属性:01;日期:;频度:;机构:;扩展1:;扩展2:;期数:1;可编辑:1;颜色:] | F71: [指标][代码:A80540007100007;币种:1560001;属性:01;日期:;频度:;机构:;扩展1:;扩展2:;期数:1;可编辑:1;颜色:] | G71: [指标][代码:A80540007100008;币种:1560001;属性:01;日期:;频度:;机构:;扩展1:;扩展2:;期数:1;可编辑:2;颜色:#99CCFF] | H71: [指标][代码:A80540007100009;币种:1560001;属性:01;日期:;频度:;机构:;扩展1:;扩展2:;期数:1;可编辑:1;颜色:]
A72: =A71+1 -> 68 | B72: 1.57待处理财产损溢 | C72: [指标][代码:A80540007200004;币种:1560001;属性:01;日期:;频度:;机构:;扩展1:;扩展2:;期数:1;可编辑:1;颜色:] | D72: [指标][代码:A80540007200005;币种:1560001;属性:01;日期:;频度:;机构:;扩展1:;扩展2:;期数:1;可编辑:1;颜色:] | E72: [指标][代码:A80540007200006;币种:1560001;属性:01;日期:;频度:;机构:;扩展1:;扩展2:;期数:1;可编辑:1;颜色:] | F72: [指标][代码:A80540007200007;币种:1560001;属性:01;日期:;频度:;机构:;扩展1:;扩展2:;期数:1;可编辑:1;颜色:] | G72: [指标][代码:A80540007200008;币种:1560001;属性:01;日期:;频度:;机构:;扩展1:;扩展2:;期数:1;可编辑:2;颜色:#99CCFF] | H72: [指标][代码:A80540007200009;币种:1560001;属性:01;日期:;频度:;机构:;扩展1:;扩展2:;期数:1;可编辑:1;颜色:]
A73: =A72+1 -> 69 | B73: 2.负债类 | C73: [指标][代码:A80540007300004;币种:1560001;属性:01;日期:;频度:;机构:;扩展1:;扩展2:;期数:1;可编辑:2;颜色:#99CCFF] | D73: [指标][代码:A80540007300005;币种:1560001;属性:01;日期:;频度:;机构:;扩展1:;扩展2:;期数:1;可编辑:2;颜色:#99CCFF] | E73: [指标][代码:A80540007300006;币种:1560001;属性:01;日期:;频度:;机构:;扩展1:;扩展2:;期数:1;可编辑:2;颜色:#99CCFF] | F73: [指标][代码:A80540007300007;币种:1560001;属性:01;日期:;频度:;机构:;扩展1:;扩展2:;期数:1;可编辑:2;颜色:#99CCFF] | G73: [指标][代码:A80540007300008;币种:1560001;属性:01;日期:;频度:;机构:;扩展1:;扩展2:;期数:1;可编辑:2;颜色:#99CCFF] | H73: [指标][代码:A80540007300009;币种:1560001;属性:01;日期:;频度:;机构:;扩展1:;扩展2:;期数:1;可编辑:2;颜色:#99CCFF]
A74: =A73+1 -> 70 | B74: 2.1各项存款 | C74: [指标][代码:A80540007400004;币种:1560001;属性:01;日期:;频度:;机构:;扩展1:;扩展2:;期数:1;可编辑:1;颜色:] | D74: [指标][代码:A80540007400005;币种:1560001;属性:01;日期:;频度:;机构:;扩展1:;扩展2:;期数:1;可编辑:1;颜色:] | E74: [指标][代码:A80540007400006;币种:1560001;属性:01;日期:;频度:;机构:;扩展1:;扩展2:;期数:1;可编辑:1;颜色:] | F74: [指标][代码:A80540007400007;币种:1560001;属性:01;日期:;频度:;机构:;扩展1:;扩展2:;期数:1;可编辑:1;颜色:] | G74: [指标][代码:A80540007400008;币种:1560001;属性:01;日期:;频度:;机构:;扩展1:;扩展2:;期数:1;可编辑:1;颜色:] | H74: [指标][代码:A80540007400009;币种:1560001;属性:01;日期:;频度:;机构:;扩展1:;扩展2:;期数:1;可编辑:1;颜色:]
A75: =A74+1 -> 71 | B75: 2.2单位活期存款 | C75: [指标][代码:A80540007500004;币种:1560001;属性:01;日期:;频度:;机构:;扩展1:;扩展2:;期数:1;可编辑:1;颜色:] | D75: [指标][代码:A80540007500005;币种:1560001;属性:01;日期:;频度:;机构:;扩展1:;扩展2:;期数:1;可编辑:1;颜色:] | E75: [指标][代码:A80540007500006;币种:1560001;属性:01;日期:;频度:;机构:;扩展1:;扩展2:;期数:1;可编辑:1;颜色:] | F75: [指标][代码:A80540007500007;币种:1560001;属性:01;日期:;频度:;机构:;扩展1:;扩展2:;期数:1;可编辑:1;颜色:] | G75: [指标][代码:A80540007500008;币种:1560001;属性:01;日期:;频度:;机构:;扩展1:;扩展2:;期数:1;可编辑:1;颜色:] | H75: [指标][代码:A80540007500009;币种:1560001;属性:01;日期:;频度:;机构:;扩展1:;扩展2:;期数:1;可编辑:2;颜色:#99CCFF]
A76: =A75+1 -> 72 | B76: 2.3单位定期存款 | C76: [指标][代码:A80540007600004;币种:1560001;属性:01;日期:;频度:;机构:;扩展1:;扩展2:;期数:1;可编辑:1;颜色:] | D76: [指标][代码:A80540007600005;币种:1560001;属性:01;日期:;频度:;机构:;扩展1:;扩展2:;期数:1;可编辑:1;颜色:] | E76: [指标][代码:A80540007600006;币种:1560001;属性:01;日期:;频度:;机构:;扩展1:;扩展2:;期数:1;可编辑:1;颜色:] | F76: [指标][代码:A80540007600007;币种:1560001;属性:01;日期:;频度:;机构:;扩展1:;扩展2:;期数:1;可编辑:1;颜色:] | G76: [指标][代码:A80540007600008;币种:1560001;属性:01;日期:;频度:;机构:;扩展1:;扩展2:;期数:1;可编辑:1;颜色:] | H76: [指标][代码:A80540007600009;币种:1560001;属性:01;日期:;频度:;机构:;扩展1:;扩展2:;期数:1;可编辑:2;颜色:#99CCFF]
A77: =A76+1 -> 73 | B77: 2.4个人活期存款 | C77: [指标][代码:A80540007700004;币种:1560001;属性:01;日期:;频度:;机构:;扩展1:;扩展2:;期数:1;可编辑:1;颜色:] | D77: [指标][代码:A80540007700005;币种:1560001;属性:01;日期:;频度:;机构:;扩展1:;扩展2:;期数:1;可编辑:1;颜色:] | E77: [指标][代码:A80540007700006;币种:1560001;属性:01;日期:;频度:;机构:;扩展1:;扩展2:;期数:1;可编辑:1;颜色:] | F77: [指标][代码:A80540007700007;币种:1560001;属性:01;日期:;频度:;机构:;扩展1:;扩展2:;期数:1;可编辑:1;颜色:] | G77: [指标][代码:A80540007700008;币种:1560001;属性:01;日期:;频度:;机构:;扩展1:;扩展2:;期数:1;可编辑:1;颜色:] | H77: [指标][代码:A80540007700009;币种:1560001;属性:01;日期:;频度:;机构:;扩展1:;扩展2:;期数:1;可编辑:2;颜色:#99CCFF]
A78: =A77+1 -> 74 | B78: 2.5个人定期存款 | C78: [指标][代码:A80540007800004;币种:1560001;属性:01;日期:;频度:;机构:;扩展1:;扩展2:;期数:1;可编辑:1;颜色:] | D78: [指标][代码:A80540007800005;币种:1560001;属性:01;日期:;频度:;机构:;扩展1:;扩展2:;期数:1;可编辑:1;颜色:] | E78: [指标][代码:A80540007800006;币种:1560001;属性:01;日期:;频度:;机构:;扩展1:;扩展2:;期数:1;可编辑:1;颜色:] | F78: [指标][代码:A80540007800007;币种:1560001;属性:01;日期:;频度:;机构:;扩展1:;扩展2:;期数:1;可编辑:1;颜色:] | G78: [指标][代码:A80540007800008;币种:1560001;属性:01;日期:;频度:;机构:;扩展1:;扩展2:;期数:1;可编辑:1;颜色:] | H78: [指标][代码:A80540007800009;币种:1560001;属性:01;日期:;频度:;机构:;扩展1:;扩展2:;期数:1;可编辑:2;颜色:#99CCFF]
A79: =A78+1 -> 75 | B79: 2.6银行卡存款 | C79: [指标][代码:A80540007900004;币种:1560001;属性:01;日期:;频度:;机构:;扩展1:;扩展2:;期数:1;可编辑:2;颜色:#99CCFF] | D79: [指标][代码:A80540007900005;币种:1560001;属性:01;日期:;频度:;机构:;扩展1:;扩展2:;期数:1;可编辑:2;颜色:#99CCFF] | E79: [指标][代码:A80540007900006;币种:1560001;属性:01;日期:;频度:;机构:;扩展1:;扩展2:;期数:1;可编辑:2;颜色:#99CCFF] | F79: [指标][代码:A80540007900007;币种:1560001;属性:01;日期:;频度:;机构:;扩展1:;扩展2:;期数:1;可编辑:2;颜色:#99CCFF] | G79: [指标][代码:A80540007900008;币种:1560001;属性:01;日期:;频度:;机构:;扩展1:;扩展2:;期数:1;可编辑:2;颜色:#99CCFF] | H79: [指标][代码:A80540007900009;币种:1560001;属性:01;日期:;频度:;机构:;扩展1:;扩展2:;期数:1;可编辑:2;颜色:#99CCFF]
A80: =A79+1 -> 76 | B80: 2.6.1其中：单位银行卡存款 | C80: [指标][代码:A80540008000004;币种:1560001;属性:01;日期:;频度:;机构:;扩展1:;扩展2:;期数:1;可编辑:1;颜色:] | D80: [指标][代码:A80540008000005;币种:1560001;属性:01;日期:;频度:;机构:;扩展1:;扩展2:;期数:1;可编辑:1;颜色:] | E80: [指标][代码:A80540008000006;币种:1560001;属性:01;日期:;频度:;机构:;扩展1:;扩展2:;期数:1;可编辑:1;颜色:] | F80: [指标][代码:A80540008000007;币种:1560001;属性:01;日期:;频度:;机构:;扩展1:;扩展2:;期数:1;可编辑:1;颜色:] | G80: [指标][代码:A80540008000008;币种:1560001;属性:01;日期:;频度:;机构:;扩展1:;扩展2:;期数:1;可编辑:1;颜色:] | H80: [指标][代码:A80540008000009;币种:1560001;属性:01;日期:;频度:;机构:;扩展1:;扩展2:;期数:1;可编辑:1;颜色:]
A81: =A80+1 -> 77 | B81: 2.6.2个人银行卡存款 | C81: [指标][代码:A80540008100004;币种:1560001;属性:01;日期:;频度:;机构:;扩展1:;扩展2:;期数:1;可编辑:1;颜色:] | D81: [指标][代码:A80540008100005;币种:1560001;属性:01;日期:;频度:;机构:;扩展1:;扩展2:;期数:1;可编辑:1;颜色:] | E81: [指标][代码:A80540008100006;币种:1560001;属性:01;日期:;频度:;机构:;扩展1:;扩展2:;期数:1;可编辑:1;颜色:] | F81: [指标][代码:A80540008100007;币种:1560001;属性:01;日期:;频度:;机构:;扩展1:;扩展2:;期数:1;可编辑:1;颜色:] | G81: [指标][代码:A80540008100008;币种:1560001;属性:01;日期:;频度:;机构:;扩展1:;扩展2:;期数:1;可编辑:1;颜色:] | H81: [指标][代码:A80540008100009;币种:1560001;属性:01;日期:;频度:;机构:;扩展1:;扩展2:;期数:1;可编辑:2;颜色:#99CCFF]
A82: =A81+1 -> 78 | B82: 2.7财政性存款 | C82: [指标][代码:A80540008200004;币种:1560001;属性:01;日期:;频度:;机构:;扩展1:;扩展2:;期数:1;可编辑:1;颜色:] | D82: [指标][代码:A80540008200005;币种:1560001;属性:01;日期:;频度:;机构:;扩展1:;扩展2:;期数:1;可编辑:1;颜色:] | E82: [指标][代码:A80540008200006;币种:1560001;属性:01;日期:;频度:;机构:;扩展1:;扩展2:;期数:1;可编辑:1;颜色:] | F82: [指标][代码:A80540008200007;币种:1560001;属性:01;日期:;频度:;机构:;扩展1:;扩展2:;期数:1;可编辑:1;颜色:] | G82: [指标][代码:A80540008200008;币种:1560001;属性:01;日期:;频度:;机构:;扩展1:;扩展2:;期数:1;可编辑:1;颜色:] | H82: [指标][代码:A80540008200009;币种:1560001;属性:01;日期:;频度:;机构:;扩展1:;扩展2:;期数:1;可编辑:2;颜色:#99CCFF]
A83: =A82+1 -> 79 | B83: 2.8待结算财政款项 | C83: [指标][代码:A80540008300004;币种:1560001;属性:01;日期:;频度:;机构:;扩展1:;扩展2:;期数:1;可编辑:1;颜色:] | D83: [指标][代码:A80540008300005;币种:1560001;属性:01;日期:;频度:;机构:;扩展1:;扩展2:;期数:1;可编辑:1;颜色:] | E83: [指标][代码:A80540008300006;币种:1560001;属性:01;日期:;频度:;机构:;扩展1:;扩展2:;期数:1;可编辑:1;颜色:] | F83: [指标][代码:A80540008300007;币种:1560001;属性:01;日期:;频度:;机构:;扩展1:;扩展2:;期数:1;可编辑:1;颜色:] | G83: [指标][代码:A80540008300008;币种:1560001;属性:01;日期:;频度:;机构:;扩展1:;扩展2:;期数:1;可编辑:1;颜色:] | H83: [指标][代码:A80540008300009;币种:1560001;属性:01;日期:;频度:;机构:;扩展1:;扩展2:;期数:1;可编辑:2;颜色:#99CCFF]
A84: =A83+1 -> 80 | B84: 2.9应解汇款 | C84: [指标][代码:A80540008400004;币种:1560001;属性:01;日期:;频度:;机构:;扩展1:;扩展2:;期数:1;可编辑:1;颜色:] | D84: [指标][代码:A80540008400005;币种:1560001;属性:01;日期:;频度:;机构:;扩展1:;扩展2:;期数:1;可编辑:1;颜色:] | E84: [指标][代码:A80540008400006;币种:1560001;属性:01;日期:;频度:;机构:;扩展1:;扩展2:;期数:1;可编辑:1;颜色:] | F84: [指标][代码:A80540008400007;币种:1560001;属性:01;日期:;频度:;机构:;扩展1:;扩展2:;期数:1;可编辑:1;颜色:] | G84: [指标][代码:A80540008400008;币种:1560001;属性:01;日期:;频度:;机构:;扩展1:;扩展2:;期数:1;可编辑:1;颜色:] | H84: [指标][代码:A80540008400009;币种:1560001;属性:01;日期:;频度:;机构:;扩展1:;扩展2:;期数:1;可编辑:2;颜色:#99CCFF]
A85: =A84+1 -> 81 | B85: 2.10汇出汇款 | C85: [指标][代码:A80540008500004;币种:1560001;属性:01;日期:;频度:;机构:;扩展1:;扩展2:;期数:1;可编辑:1;颜色:] | D85: [指标][代码:A80540008500005;币种:1560001;属性:01;日期:;频度:;机构:;扩展1:;扩展2:;期数:1;可编辑:1;颜色:] | E85: [指标][代码:A80540008500006;币种:1560001;属性:01;日期:;频度:;机构:;扩展1:;扩展2:;期数:1;可编辑:1;颜色:] | F85: [指标][代码:A80540008500007;币种:1560001;属性:01;日期:;频度:;机构:;扩展1:;扩展2:;期数:1;可编辑:1;颜色:] | G85: [指标][代码:A80540008500008;币种:1560001;属性:01;日期:;频度:;机构:;扩展1:;扩展2:;期数:1;可编辑:1;颜色:] | H85: [指标][代码:A80540008500009;币种:1560001;属性:01;日期:;频度:;机构:;扩展1:;扩展2:;期数:1;可编辑:2;颜色:#99CCFF]
A86: =A85+1 -> 82 | B86: 2.11开出本票 | C86: [指标][代码:A80540008600004;币种:1560001;属性:01;日期:;频度:;机构:;扩展1:;扩展2:;期数:1;可编辑:1;颜色:] | D86: [指标][代码:A80540008600005;币种:1560001;属性:01;日期:;频度:;机构:;扩展1:;扩展2:;期数:1;可编辑:1;颜色:] | E86: [指标][代码:A80540008600006;币种:1560001;属性:01;日期:;频度:;机构:;扩展1:;扩展2:;期数:1;可编辑:1;颜色:] | F86: [指标][代码:A80540008600007;币种:1560001;属性:01;日期:;频度:;机构:;扩展1:;扩展2:;期数:1;可编辑:1;颜色:] | G86: [指标][代码:A80540008600008;币种:1560001;属性:01;日期:;频度:;机构:;扩展1:;扩展2:;期数:1;可编辑:1;颜色:] | H86: [指标][代码:A80540008600009;币种:1560001;属性:01;日期:;频度:;机构:;扩展1:;扩展2:;期数:1;可编辑:2;颜色:#99CCFF]
A87: =A86+1 -> 83 | B87: 2.12保证金存款 | C87: [指标][代码:A80540008700004;币种:1560001;属性:01;日期:;频度:;机构:;扩展1:;扩展2:;期数:1;可编辑:1;颜色:] | D87: [指标][代码:A80540008700005;币种:1560001;属性:01;日期:;频度:;机构:;扩展1:;扩展2:;期数:1;可编辑:1;颜色:] | E87: [指标][代码:A80540008700006;币种:1560001;属性:01;日期:;频度:;机构:;扩展1:;扩展2:;期数:1;可编辑:1;颜色:] | F87: [指标][代码:A80540008700007;币种:1560001;属性:01;日期:;频度:;机构:;扩展1:;扩展2:;期数:1;可编辑:1;颜色:] | G87: [指标][代码:A80540008700008;币种:1560001;属性:01;日期:;频度:;机构:;扩展1:;扩展2:;期数:1;可编辑:1;颜色:] | H87: [指标][代码:A80540008700009;币种:1560001;属性:01;日期:;频度:;机构:;扩展1:;扩展2:;期数:1;可编辑:2;颜色:#99CCFF]
A88: =A87+1 -> 84 | B88: 2.12.1其中：贷款保证金 | C88: [指标][代码:A80540008800004;币种:1560001;属性:01;日期:;频度:;机构:;扩展1:;扩展2:;期数:1;可编辑:1;颜色:] | D88: [指标][代码:A80540008800005;币种:1560001;属性:01;日期:;频度:;机构:;扩展1:;扩展2:;期数:1;可编辑:1;颜色:] | E88: [指标][代码:A80540008800006;币种:1560001;属性:01;日期:;频度:;机构:;扩展1:;扩展2:;期数:1;可编辑:1;颜色:] | F88: [指标][代码:A80540008800007;币种:1560001;属性:01;日期:;频度:;机构:;扩展1:;扩展2:;期数:1;可编辑:1;颜色:] | G88: [指标][代码:A80540008800008;币种:1560001;属性:01;日期:;频度:;机构:;扩展1:;扩展2:;期数:1;可编辑:1;颜色:] | H88: [指标][代码:A80540008800009;币种:1560001;属性:01;日期:;频度:;机构:;扩展1:;扩展2:;期数:1;可编辑:1;颜色:]
A89: =A88+1 -> 85 | B89: 2.12.2银行承兑汇票保证金 | C89: [指标][代码:A80540008900004;币种:1560001;属性:01;日期:;频度:;机构:;扩展1:;扩展2:;期数:1;可编辑:1;颜色:] | D89: [指标][代码:A80540008900005;币种:1560001;属性:01;日期:;频度:;机构:;扩展1:;扩展2:;期数:1;可编辑:1;颜色:] | E89: [指标][代码:A80540008900006;币种:1560001;属性:01;日期:;频度:;机构:;扩展1:;扩展2:;期数:1;可编辑:1;颜色:] | F89: [指标][代码:A80540008900007;币种:1560001;属性:01;日期:;频度:;机构:;扩展1:;扩展2:;期数:1;可编辑:1;颜色:] | G89: [指标][代码:A80540008900008;币种:1560001;属性:01;日期:;频度:;机构:;扩展1:;扩展2:;期数:1;可编辑:1;颜色:] | H89: [指标][代码:A80540008900009;币种:1560001;属性:01;日期:;频度:;机构:;扩展1:;扩展2:;期数:1;可编辑:1;颜色:]
A90: =A89+1 -> 86 | B90: 2.13向中央银行借款 | C90: [指标][代码:A80540009000004;币种:1560001;属性:01;日期:;频度:;机构:;扩展1:;扩展2:;期数:1;可编辑:1;颜色:] | D90: [指标][代码:A80540009000005;币种:1560001;属性:01;日期:;频度:;机构:;扩展1:;扩展2:;期数:1;可编辑:1;颜色:] | E90: [指标][代码:A80540009000006;币种:1560001;属性:01;日期:;频度:;机构:;扩展1:;扩展2:;期数:1;可编辑:1;颜色:] | F90: [指标][代码:A80540009000007;币种:1560001;属性:01;日期:;频度:;机构:;扩展1:;扩展2:;期数:1;可编辑:1;颜色:] | G90: [指标][代码:A80540009000008;币种:1560001;属性:01;日期:;频度:;机构:;扩展1:;扩展2:;期数:1;可编辑:1;颜色:] | H90: [指标][代码:A80540009000009;币种:1560001;属性:01;日期:;频度:;机构:;扩展1:;扩展2:;期数:1;可编辑:2;颜色:#99CCFF]
A91: =A90+1 -> 87 | B91: 2.14央行拨付专项票据资金 | C91: [指标][代码:A80540009100004;币种:1560001;属性:01;日期:;频度:;机构:;扩展1:;扩展2:;期数:1;可编辑:1;颜色:] | D91: [指标][代码:A80540009100005;币种:1560001;属性:01;日期:;频度:;机构:;扩展1:;扩展2:;期数:1;可编辑:1;颜色:] | E91: [指标][代码:A80540009100006;币种:1560001;属性:01;日期:;频度:;机构:;扩展1:;扩展2:;期数:1;可编辑:1;颜色:] | F91: [指标][代码:A80540009100007;币种:1560001;属性:01;日期:;频度:;机构:;扩展1:;扩展2:;期数:1;可编辑:1;颜色:] | G91: [指标][代码:A80540009100008;币种:1560001;属性:01;日期:;频度:;机构:;扩展1:;扩展2:;期数:1;可编辑:1;颜色:] | H91: [指标][代码:A80540009100009;币种:1560001;属性:01;日期:;频度:;机构:;扩展1:;扩展2:;期数:1;可编辑:2;颜色:#99CCFF]
A92: =A91+1 -> 88 | B92: 2.15同业存放款项 | C92: [指标][代码:A80540009200004;币种:1560001;属性:01;日期:;频度:;机构:;扩展1:;扩展2:;期数:1;可编辑:1;颜色:] | D92: [指标][代码:A80540009200005;币种:1560001;属性:01;日期:;频度:;机构:;扩展1:;扩展2:;期数:1;可编辑:1;颜色:] | E92: [指标][代码:A80540009200006;币种:1560001;属性:01;日期:;频度:;机构:;扩展1:;扩展2:;期数:1;可编辑:1;颜色:] | F92: [指标][代码:A80540009200007;币种:1560001;属性:01;日期:;频度:;机构:;扩展1:;扩展2:;期数:1;可编辑:1;颜色:] | G92: [指标][代码:A80540009200008;币种:1560001;属性:01;日期:;频度:;机构:;扩展1:;扩展2:;期数:1;可编辑:1;颜色:] | H92: [指标][代码:A80540009200009;币种:1560001;属性:01;日期:;频度:;机构:;扩展1:;扩展2:;期数:1;可编辑:2;颜色:#99CCFF]
A93: =A92+1 -> 89 | B93: 2.16系统内存放款项 | C93: [指标][代码:A80540009300004;币种:1560001;属性:01;日期:;频度:;机构:;扩展1:;扩展2:;期数:1;可编辑:1;颜色:] | D93: [指标][代码:A80540009300005;币种:1560001;属性:01;日期:;频度:;机构:;扩展1:;扩展2:;期数:1;可编辑:1;颜色:] | E93: [指标][代码:A80540009300006;币种:1560001;属性:01;日期:;频度:;机构:;扩展1:;扩展2:;期数:1;可编辑:1;颜色:] | F93: [指标][代码:A80540009300007;币种:1560001;属性:01;日期:;频度:;机构:;扩展1:;扩展2:;期数:1;可编辑:1;颜色:] | G93: [指标][代码:A80540009300008;币种:1560001;属性:01;日期:;频度:;机构:;扩展1:;扩展2:;期数:1;可编辑:1;颜色:] | H93: [指标][代码:A80540009300009;币种:1560001;属性:01;日期:;频度:;机构:;扩展1:;扩展2:;期数:1;可编辑:2;颜色:#99CCFF]
A94: =A93+1 -> 90 | B94: 2.17同业拆入资金 | C94: [指标][代码:A80540009400004;币种:1560001;属性:01;日期:;频度:;机构:;扩展1:;扩展2:;期数:1;可编辑:1;颜色:] | D94: [指标][代码:A80540009400005;币种:1560001;属性:01;日期:;频度:;机构:;扩展1:;扩展2:;期数:1;可编辑:1;颜色:] | E94: [指标][代码:A80540009400006;币种:1560001;属性:01;日期:;频度:;机构:;扩展1:;扩展2:;期数:1;可编辑:1;颜色:] | F94: [指标][代码:A80540009400007;币种:1560001;属性:01;日期:;频度:;机构:;扩展1:;扩展2:;期数:1;可编辑:1;颜色:] | G94: [指标][代码:A80540009400008;币种:1560001;属性:01;日期:;频度:;机构:;扩展1:;扩展2:;期数:1;可编辑:1;颜色:] | H94: [指标][代码:A80540009400009;币种:1560001;属性:01;日期:;频度:;机构:;扩展1:;扩展2:;期数:1;可编辑:2;颜色:#99CCFF]
A95: =A94+1 -> 91 | B95: 2.18系统内拆入资金 | C95: [指标][代码:A80540009500004;币种:1560001;属性:01;日期:;频度:;机构:;扩展1:;扩展2:;期数:1;可编辑:2;颜色:#99CCFF] | D95: [指标][代码:A80540009500005;币种:1560001;属性:01;日期:;频度:;机构:;扩展1:;扩展2:;期数:1;可编辑:2;颜色:#99CCFF] | E95: [指标][代码:A80540009500006;币种:1560001;属性:01;日期:;频度:;机构:;扩展1:;扩展2:;期数:1;可编辑:2;颜色:#99CCFF] | F95: [指标][代码:A80540009500007;币种:1560001;属性:01;日期:;频度:;机构:;扩展1:;扩展2:;期数:1;可编辑:2;颜色:#99CCFF] | G95: [指标][代码:A80540009500008;币种:1560001;属性:01;日期:;频度:;机构:;扩展1:;扩展2:;期数:1;可编辑:2;颜色:#99CCFF] | H95: [指标][代码:A80540009500009;币种:1560001;属性:01;日期:;频度:;机构:;扩展1:;扩展2:;期数:1;可编辑:2;颜色:#99CCFF]
A96: =A95+1 -> 92 | B96: 2.18.1其中：省内拆入 | C96: [指标][代码:A80540009600004;币种:1560001;属性:01;日期:;频度:;机构:;扩展1:;扩展2:;期数:1;可编辑:1;颜色:] | D96: [指标][代码:A80540009600005;币种:1560001;属性:01;日期:;频度:;机构:;扩展1:;扩展2:;期数:1;可编辑:1;颜色:] | E96: [指标][代码:A80540009600006;币种:1560001;属性:01;日期:;频度:;机构:;扩展1:;扩展2:;期数:1;可编辑:1;颜色:] | F96: [指标][代码:A80540009600007;币种:1560001;属性:01;日期:;频度:;机构:;扩展1:;扩展2:;期数:1;可编辑:1;颜色:] | G96: [指标][代码:A80540009600008;币种:1560001;属性:01;日期:;频度:;机构:;扩展1:;扩展2:;期数:1;可编辑:1;颜色:] | H96: [指标][代码:A80540009600009;币种:1560001;属性:01;日期:;频度:;机构:;扩展1:;扩展2:;期数:1;可编辑:1;颜色:]
A97: =A96+1 -> 93 | B97: 2.18.2省外拆入 | C97: [指标][代码:A80540009700004;币种:1560001;属性:01;日期:;频度:;机构:;扩展1:;扩展2:;期数:1;可编辑:1;颜色:] | D97: [指标][代码:A80540009700005;币种:1560001;属性:01;日期:;频度:;机构:;扩展1:;扩展2:;期数:1;可编辑:1;颜色:] | E97: [指标][代码:A80540009700006;币种:1560001;属性:01;日期:;频度:;机构:;扩展1:;扩展2:;期数:1;可编辑:1;颜色:] | F97: [指标][代码:A80540009700007;币种:1560001;属性:01;日期:;频度:;机构:;扩展1:;扩展2:;期数:1;可编辑:1;颜色:] | G97: [指标][代码:A80540009700008;币种:1560001;属性:01;日期:;频度:;机构:;扩展1:;扩展2:;期数:1;可编辑:1;颜色:] | H97: [指标][代码:A80540009700009;币种:1560001;属性:01;日期:;频度:;机构:;扩展1:;扩展2:;期数:1;可编辑:1;颜色:]
A98: =A97+1 -> 94 | B98: 2.19转帖现负债 | C98: [指标][代码:A80540009800004;币种:1560001;属性:01;日期:;频度:;机构:;扩展1:;扩展2:;期数:1;可编辑:1;颜色:] | D98: [指标][代码:A80540009800005;币种:1560001;属性:01;日期:;频度:;机构:;扩展1:;扩展2:;期数:1;可编辑:1;颜色:] | E98: [指标][代码:A80540009800006;币种:1560001;属性:01;日期:;频度:;机构:;扩展1:;扩展2:;期数:1;可编辑:1;颜色:] | F98: [指标][代码:A80540009800007;币种:1560001;属性:01;日期:;频度:;机构:;扩展1:;扩展2:;期数:1;可编辑:1;颜色:] | G98: [指标][代码:A80540009800008;币种:1560001;属性:01;日期:;频度:;机构:;扩展1:;扩展2:;期数:1;可编辑:1;颜色:] | H98: [指标][代码:A80540009800009;币种:1560001;属性:01;日期:;频度:;机构:;扩展1:;扩展2:;期数:1;可编辑:2;颜色:#99CCFF]
A99: =A98+1 -> 95 | B99: 2.20再贴现负债 | C99: [指标][代码:A80540009900004;币种:1560001;属性:01;日期:;频度:;机构:;扩展1:;扩展2:;期数:1;可编辑:1;颜色:] | D99: [指标][代码:A80540009900005;币种:1560001;属性:01;日期:;频度:;机构:;扩展1:;扩展2:;期数:1;可编辑:1;颜色:] | E99: [指标][代码:A80540009900006;币种:1560001;属性:01;日期:;频度:;机构:;扩展1:;扩展2:;期数:1;可编辑:1;颜色:] | F99: [指标][代码:A80540009900007;币种:1560001;属性:01;日期:;频度:;机构:;扩展1:;扩展2:;期数:1;可编辑:1;颜色:] | G99: [指标][代码:A80540009900008;币种:1560001;属性:01;日期:;频度:;机构:;扩展1:;扩展2:;期数:1;可编辑:1;颜色:] | H99: [指标][代码:A80540009900009;币种:1560001;属性:01;日期:;频度:;机构:;扩展1:;扩展2:;期数:1;可编辑:2;颜色:#99CCFF]
A100: =A99+1 -> 96 | B100: 2.21交易性金融负债 | C100: [指标][代码:A80540010000004;币种:1560001;属性:01;日期:;频度:;机构:;扩展1:;扩展2:;期数:1;可编辑:1;颜色:] | D100: [指标][代码:A80540010000005;币种:1560001;属性:01;日期:;频度:;机构:;扩展1:;扩展2:;期数:1;可编辑:1;颜色:] | E100: [指标][代码:A80540010000006;币种:1560001;属性:01;日期:;频度:;机构:;扩展1:;扩展2:;期数:1;可编辑:1;颜色:] | F100: [指标][代码:A80540010000007;币种:1560001;属性:01;日期:;频度:;机构:;扩展1:;扩展2:;期数:1;可编辑:1;颜色:] | G100: [指标][代码:A80540010000008;币种:1560001;属性:01;日期:;频度:;机构:;扩展1:;扩展2:;期数:1;可编辑:1;颜色:] | H100: [指标][代码:A80540010000009;币种:1560001;属性:01;日期:;频度:;机构:;扩展1:;扩展2:;期数:1;可编辑:2;颜色:#99CCFF]
A101: =A100+1 -> 97 | B101: 2.22卖出回购金融资产款 | C101: [指标][代码:A80540010100004;币种:1560001;属性:01;日期:;频度:;机构:;扩展1:;扩展2:;期数:1;可编辑:1;颜色:] | D101: [指标][代码:A80540010100005;币种:1560001;属性:01;日期:;频度:;机构:;扩展1:;扩展2:;期数:1;可编辑:1;颜色:] | E101: [指标][代码:A80540010100006;币种:1560001;属性:01;日期:;频度:;机构:;扩展1:;扩展2:;期数:1;可编辑:1;颜色:] | F101: [指标][代码:A80540010100007;币种:1560001;属性:01;日期:;频度:;机构:;扩展1:;扩展2:;期数:1;可编辑:1;颜色:] | G101: [指标][代码:A80540010100008;币种:1560001;属性:01;日期:;频度:;机构:;扩展1:;扩展2:;期数:1;可编辑:1;颜色:] | H101: [指标][代码:A80540010100009;币种:1560001;属性:01;日期:;频度:;机构:;扩展1:;扩展2:;期数:1;可编辑:2;颜色:#99CCFF]
A102: =A101+1 -> 98 | B102: 2.23应付职工薪酬 | C102: [指标][代码:A80540010200004;币种:1560001;属性:01;日期:;频度:;机构:;扩展1:;扩展2:;期数:1;可编辑:1;颜色:] | D102: [指标][代码:A80540010200005;币种:1560001;属性:01;日期:;频度:;机构:;扩展1:;扩展2:;期数:1;可编辑:1;颜色:] | E102: [指标][代码:A80540010200006;币种:1560001;属性:01;日期:;频度:;机构:;扩展1:;扩展2:;期数:1;可编辑:1;颜色:] | F102: [指标][代码:A80540010200007;币种:1560001;属性:01;日期:;频度:;机构:;扩展1:;扩展2:;期数:1;可编辑:1;颜色:] | G102: [指标][代码:A80540010200008;币种:1560001;属性:01;日期:;频度:;机构:;扩展1:;扩展2:;期数:1;可编辑:1;颜色:] | H102: [指标][代码:A80540010200009;币种:1560001;属性:01;日期:;频度:;机构:;扩展1:;扩展2:;期数:1;可编辑:2;颜色:#99CCFF]
A103: =A102+1 -> 99 | B103: 2.24应交税费 | C103: [指标][代码:A80540010300004;币种:1560001;属性:01;日期:;频度:;机构:;扩展1:;扩展2:;期数:1;可编辑:1;颜色:] | D103: [指标][代码:A80540010300005;币种:1560001;属性:01;日期:;频度:;机构:;扩展1:;扩展2:;期数:1;可编辑:1;颜色:] | E103: [指标][代码:A80540010300006;币种:1560001;属性:01;日期:;频度:;机构:;扩展1:;扩展2:;期数:1;可编辑:1;颜色:] | F103: [指标][代码:A80540010300007;币种:1560001;属性:01;日期:;频度:;机构:;扩展1:;扩展2:;期数:1;可编辑:1;颜色:] | G103: [指标][代码:A80540010300008;币种:1560001;属性:01;日期:;频度:;机构:;扩展1:;扩展2:;期数:1;可编辑:1;颜色:] | H103: [指标][代码:A80540010300009;币种:1560001;属性:01;日期:;频度:;机构:;扩展1:;扩展2:;期数:1;可编辑:2;颜色:#99CCFF]
A104: =A103+1 -> 100 | B104: 2.25应付利息 | C104: [指标][代码:A80540010400004;币种:1560001;属性:01;日期:;频度:;机构:;扩展1:;扩展2:;期数:1;可编辑:1;颜色:] | D104: [指标][代码:A80540010400005;币种:1560001;属性:01;日期:;频度:;机构:;扩展1:;扩展2:;期数:1;可编辑:1;颜色:] | E104: [指标][代码:A80540010400006;币种:1560001;属性:01;日期:;频度:;机构:;扩展1:;扩展2:;期数:1;可编辑:1;颜色:] | F104: [指标][代码:A80540010400007;币种:1560001;属性:01;日期:;频度:;机构:;扩展1:;扩展2:;期数:1;可编辑:1;颜色:] | G104: [指标][代码:A80540010400008;币种:1560001;属性:01;日期:;频度:;机构:;扩展1:;扩展2:;期数:1;可编辑:1;颜色:] | H104: [指标][代码:A80540010400009;币种:1560001;属性:01;日期:;频度:;机构:;扩展1:;扩展2:;期数:1;可编辑:2;颜色:#99CCFF]
A105: =A104+1 -> 101 | B105: 2.26应付股利 | C105: [指标][代码:A80540010500004;币种:1560001;属性:01;日期:;频度:;机构:;扩展1:;扩展2:;期数:1;可编辑:1;颜色:] | D105: [指标][代码:A80540010500005;币种:1560001;属性:01;日期:;频度:;机构:;扩展1:;扩展2:;期数:1;可编辑:1;颜色:] | E105: [指标][代码:A80540010500006;币种:1560001;属性:01;日期:;频度:;机构:;扩展1:;扩展2:;期数:1;可编辑:1;颜色:] | F105: [指标][代码:A80540010500007;币种:1560001;属性:01;日期:;频度:;机构:;扩展1:;扩展2:;期数:1;可编辑:1;颜色:] | G105: [指标][代码:A80540010500008;币种:1560001;属性:01;日期:;频度:;机构:;扩展1:;扩展2:;期数:1;可编辑:1;颜色:] | H105: [指标][代码:A80540010500009;币种:1560001;属性:01;日期:;频度:;机构:;扩展1:;扩展2:;期数:1;可编辑:2;颜色:#99CCFF]
A106: =A105+1 -> 102 | B106: 2.27其他应付款 | C106: [指标][代码:A80540010600004;币种:1560001;属性:01;日期:;频度:;机构:;扩展1:;扩展2:;期数:1;可编辑:1;颜色:] | D106: [指标][代码:A80540010600005;币种:1560001;属性:01;日期:;频度:;机构:;扩展1:;扩展2:;期数:1;可编辑:1;颜色:] | E106: [指标][代码:A80540010600006;币种:1560001;属性:01;日期:;频度:;机构:;扩展1:;扩展2:;期数:1;可编辑:1;颜色:] | F106: [指标][代码:A80540010600007;币种:1560001;属性:01;日期:;频度:;机构:;扩展1:;扩展2:;期数:1;可编辑:1;颜色:] | G106: [指标][代码:A80540010600008;币种:1560001;属性:01;日期:;频度:;机构:;扩展1:;扩展2:;期数:1;可编辑:1;颜色:] | H106: [指标][代码:A80540010600009;币种:1560001;属性:01;日期:;频度:;机构:;扩展1:;扩展2:;期数:1;可编辑:2;颜色:#99CCFF]
A107: =A106+1 -> 103 | B107: 2.28代理承销证券款 | C107: [指标][代码:A80540010700004;币种:1560001;属性:01;日期:;频度:;机构:;扩展1:;扩展2:;期数:1;可编辑:1;颜色:] | D107: [指标][代码:A80540010700005;币种:1560001;属性:01;日期:;频度:;机构:;扩展1:;扩展2:;期数:1;可编辑:1;颜色:] | E107: [指标][代码:A80540010700006;币种:1560001;属性:01;日期:;频度:;机构:;扩展1:;扩展2:;期数:1;可编辑:1;颜色:] | F107: [指标][代码:A80540010700007;币种:1560001;属性:01;日期:;频度:;机构:;扩展1:;扩展2:;期数:1;可编辑:1;颜色:] | G107: [指标][代码:A80540010700008;币种:1560001;属性:01;日期:;频度:;机构:;扩展1:;扩展2:;期数:1;可编辑:1;颜色:] | H107: [指标][代码:A80540010700009;币种:1560001;属性:01;日期:;频度:;机构:;扩展1:;扩展2:;期数:1;可编辑:2;颜色:#99CCFF]
A108: =A107+1 -> 104 | B108: 2.29代理兑付证券款 | C108: [指标][代码:A80540010800004;币种:1560001;属性:01;日期:;频度:;机构:;扩展1:;扩展2:;期数:1;可编辑:1;颜色:] | D108: [指标][代码:A80540010800005;币种:1560001;属性:01;日期:;频度:;机构:;扩展1:;扩展2:;期数:1;可编辑:1;颜色:] | E108: [指标][代码:A80540010800006;币种:1560001;属性:01;日期:;频度:;机构:;扩展1:;扩展2:;期数:1;可编辑:1;颜色:] | F108: [指标][代码:A80540010800007;币种:1560001;属性:01;日期:;频度:;机构:;扩展1:;扩展2:;期数:1;可编辑:1;颜色:] | G108: [指标][代码:A80540010800008;币种:1560001;属性:01;日期:;频度:;机构:;扩展1:;扩展2:;期数:1;可编辑:1;颜色:] | H108: [指标][代码:A80540010800009;币种:1560001;属性:01;日期:;频度:;机构:;扩展1:;扩展2:;期数:1;可编辑:2;颜色:#99CCFF]
A109: =A108+1 -> 105 | B109: 2.30代理业务负债 | C109: [指标][代码:A80540010900004;币种:1560001;属性:01;日期:;频度:;机构:;扩展1:;扩展2:;期数:1;可编辑:1;颜色:] | D109: [指标][代码:A80540010900005;币种:1560001;属性:01;日期:;频度:;机构:;扩展1:;扩展2:;期数:1;可编辑:1;颜色:] | E109: [指标][代码:A80540010900006;币种:1560001;属性:01;日期:;频度:;机构:;扩展1:;扩展2:;期数:1;可编辑:1;颜色:] | F109: [指标][代码:A80540010900007;币种:1560001;属性:01;日期:;频度:;机构:;扩展1:;扩展2:;期数:1;可编辑:1;颜色:] | G109: [指标][代码:A80540010900008;币种:1560001;属性:01;日期:;频度:;机构:;扩展1:;扩展2:;期数:1;可编辑:1;颜色:] | H109: [指标][代码:A80540010900009;币种:1560001;属性:01;日期:;频度:;机构:;扩展1:;扩展2:;期数:1;可编辑:2;颜色:#99CCFF]
A110: =A109+1 -> 106 | B110: 2.31递延收益 | C110: [指标][代码:A80540011000004;币种:1560001;属性:01;日期:;频度:;机构:;扩展1:;扩展2:;期数:1;可编辑:1;颜色:] | D110: [指标][代码:A80540011000005;币种:1560001;属性:01;日期:;频度:;机构:;扩展1:;扩展2:;期数:1;可编辑:1;颜色:] | E110: [指标][代码:A80540011000006;币种:1560001;属性:01;日期:;频度:;机构:;扩展1:;扩展2:;期数:1;可编辑:1;颜色:] | F110: [指标][代码:A80540011000007;币种:1560001;属性:01;日期:;频度:;机构:;扩展1:;扩展2:;期数:1;可编辑:1;颜色:] | G110: [指标][代码:A80540011000008;币种:1560001;属性:01;日期:;频度:;机构:;扩展1:;扩展2:;期数:1;可编辑:1;颜色:] | H110: [指标][代码:A80540011000009;币种:1560001;属性:01;日期:;频度:;机构:;扩展1:;扩展2:;期数:1;可编辑:2;颜色:#99CCFF]
A111: =A110+1 -> 107 | B111: 2.32长期借款 | C111: [指标][代码:A80540011100004;币种:1560001;属性:01;日期:;频度:;机构:;扩展1:;扩展2:;期数:1;可编辑:1;颜色:] | D111: [指标][代码:A80540011100005;币种:1560001;属性:01;日期:;频度:;机构:;扩展1:;扩展2:;期数:1;可编辑:1;颜色:] | E111: [指标][代码:A80540011100006;币种:1560001;属性:01;日期:;频度:;机构:;扩展1:;扩展2:;期数:1;可编辑:1;颜色:] | F111: [指标][代码:A80540011100007;币种:1560001;属性:01;日期:;频度:;机构:;扩展1:;扩展2:;期数:1;可编辑:1;颜色:] | G111: [指标][代码:A80540011100008;币种:1560001;属性:01;日期:;频度:;机构:;扩展1:;扩展2:;期数:1;可编辑:1;颜色:] | H111: [指标][代码:A80540011100009;币种:1560001;属性:01;日期:;频度:;机构:;扩展1:;扩展2:;期数:1;可编辑:2;颜色:#99CCFF]
A112: =A111+1 -> 108 | B112: 2.33应付债券 | C112: [指标][代码:A80540011200004;币种:1560001;属性:01;日期:;频度:;机构:;扩展1:;扩展2:;期数:1;可编辑:1;颜色:] | D112: [指标][代码:A80540011200005;币种:1560001;属性:01;日期:;频度:;机构:;扩展1:;扩展2:;期数:1;可编辑:1;颜色:] | E112: [指标][代码:A80540011200006;币种:1560001;属性:01;日期:;频度:;机构:;扩展1:;扩展2:;期数:1;可编辑:1;颜色:] | F112: [指标][代码:A80540011200007;币种:1560001;属性:01;日期:;频度:;机构:;扩展1:;扩展2:;期数:1;可编辑:1;颜色:] | G112: [指标][代码:A80540011200008;币种:1560001;属性:01;日期:;频度:;机构:;扩展1:;扩展2:;期数:1;可编辑:1;颜色:] | H112: [指标][代码:A80540011200009;币种:1560001;属性:01;日期:;频度:;机构:;扩展1:;扩展2:;期数:1;可编辑:2;颜色:#99CCFF]
A113: =A112+1 -> 109 | B113: 2.34长期应付款 | C113: [指标][代码:A80540011300004;币种:1560001;属性:01;日期:;频度:;机构:;扩展1:;扩展2:;期数:1;可编辑:1;颜色:] | D113: [指标][代码:A80540011300005;币种:1560001;属性:01;日期:;频度:;机构:;扩展1:;扩展2:;期数:1;可编辑:1;颜色:] | E113: [指标][代码:A80540011300006;币种:1560001;属性:01;日期:;频度:;机构:;扩展1:;扩展2:;期数:1;可编辑:1;颜色:] | F113: [指标][代码:A80540011300007;币种:1560001;属性:01;日期:;频度:;机构:;扩展1:;扩展2:;期数:1;可编辑:1;颜色:] | G113: [指标][代码:A80540011300008;币种:1560001;属性:01;日期:;频度:;机构:;扩展1:;扩展2:;期数:1;可编辑:1;颜色:] | H113: [指标][代码:A80540011300009;币种:1560001;属性:01;日期:;频度:;机构:;扩展1:;扩展2:;期数:1;可编辑:2;颜色:#99CCFF]
A114: =A113+1 -> 110 | B114: 2.35未确认融资费用 | C114: [指标][代码:A80540011400004;币种:1560001;属性:01;日期:;频度:;机构:;扩展1:;扩展2:;期数:1;可编辑:1;颜色:] | D114: [指标][代码:A80540011400005;币种:1560001;属性:01;日期:;频度:;机构:;扩展1:;扩展2:;期数:1;可编辑:1;颜色:] | E114: [指标][代码:A80540011400006;币种:1560001;属性:01;日期:;频度:;机构:;扩展1:;扩展2:;期数:1;可编辑:1;颜色:] | F114: [指标][代码:A80540011400007;币种:1560001;属性:01;日期:;频度:;机构:;扩展1:;扩展2:;期数:1;可编辑:1;颜色:] | G114: [指标][代码:A80540011400008;币种:1560001;属性:01;日期:;频度:;机构:;扩展1:;扩展2:;期数:1;可编辑:1;颜色:] | H114: [指标][代码:A80540011400009;币种:1560001;属性:01;日期:;频度:;机构:;扩展1:;扩展2:;期数:1;可编辑:1;颜色:]
A115: =A114+1 -> 111 | B115: 2.36管理部门统筹资金 | C115: [指标][代码:A80540011500004;币种:1560001;属性:01;日期:;频度:;机构:;扩展1:;扩展2:;期数:1;可编辑:1;颜色:] | D115: [指标][代码:A80540011500005;币种:1560001;属性:01;日期:;频度:;机构:;扩展1:;扩展2:;期数:1;可编辑:1;颜色:] | E115: [指标][代码:A80540011500006;币种:1560001;属性:01;日期:;频度:;机构:;扩展1:;扩展2:;期数:1;可编辑:1;颜色:] | F115: [指标][代码:A80540011500007;币种:1560001;属性:01;日期:;频度:;机构:;扩展1:;扩展2:;期数:1;可编辑:1;颜色:] | G115: [指标][代码:A80540011500008;币种:1560001;属性:01;日期:;频度:;机构:;扩展1:;扩展2:;期数:1;可编辑:1;颜色:] | H115: [指标][代码:A80540011500009;币种:1560001;属性:01;日期:;频度:;机构:;扩展1:;扩展2:;期数:1;可编辑:2;颜色:#99CCFF]
A116: =A115+1 -> 112 | B116: 2.37预计负债 | C116: [指标][代码:A80540011600004;币种:1560001;属性:01;日期:;频度:;机构:;扩展1:;扩展2:;期数:1;可编辑:1;颜色:] | D116: [指标][代码:A80540011600005;币种:1560001;属性:01;日期:;频度:;机构:;扩展1:;扩展2:;期数:1;可编辑:1;颜色:] | E116: [指标][代码:A80540011600006;币种:1560001;属性:01;日期:;频度:;机构:;扩展1:;扩展2:;期数:1;可编辑:1;颜色:] | F116: [指标][代码:A80540011600007;币种:1560001;属性:01;日期:;频度:;机构:;扩展1:;扩展2:;期数:1;可编辑:1;颜色:] | G116: [指标][代码:A80540011600008;币种:1560001;属性:01;日期:;频度:;机构:;扩展1:;扩展2:;期数:1;可编辑:1;颜色:] | H116: [指标][代码:A80540011600009;币种:1560001;属性:01;日期:;频度:;机构:;扩展1:;扩展2:;期数:1;可编辑:2;颜色:#99CCFF]
A117: =A116+1 -> 113 | B117: 2.38递延所得税负债 | C117: [指标][代码:A80540011700004;币种:1560001;属性:01;日期:;频度:;机构:;扩展1:;扩展2:;期数:1;可编辑:1;颜色:] | D117: [指标][代码:A80540011700005;币种:1560001;属性:01;日期:;频度:;机构:;扩展1:;扩展2:;期数:1;可编辑:1;颜色:] | E117: [指标][代码:A80540011700006;币种:1560001;属性:01;日期:;频度:;机构:;扩展1:;扩展2:;期数:1;可编辑:1;颜色:] | F117: [指标][代码:A80540011700007;币种:1560001;属性:01;日期:;频度:;机构:;扩展1:;扩展2:;期数:1;可编辑:1;颜色:] | G117: [指标][代码:A80540011700008;币种:1560001;属性:01;日期:;频度:;机构:;扩展1:;扩展2:;期数:1;可编辑:1;颜色:] | H117: [指标][代码:A80540011700009;币种:1560001;属性:01;日期:;频度:;机构:;扩展1:;扩展2:;期数:1;可编辑:2;颜色:#99CCFF]
A118: =A117+1 -> 114 | B118: 3.资产负债共同类 | C118: [指标][代码:A80540011800004;币种:1560001;属性:01;日期:;频度:;机构:;扩展1:;扩展2:;期数:1;可编辑:2;颜色:#99CCFF] | D118: [指标][代码:A80540011800005;币种:1560001;属性:01;日期:;频度:;机构:;扩展1:;扩展2:;期数:1;可编辑:2;颜色:#99CCFF] | E118: [指标][代码:A80540011800006;币种:1560001;属性:01;日期:;频度:;机构:;扩展1:;扩展2:;期数:1;可编辑:2;颜色:#99CCFF] | F118: [指标][代码:A80540011800007;币种:1560001;属性:01;日期:;频度:;机构:;扩展1:;扩展2:;期数:1;可编辑:2;颜色:#99CCFF] | G118: [指标][代码:A80540011800008;币种:1560001;属性:01;日期:;频度:;机构:;扩展1:;扩展2:;期数:1;可编辑:2;颜色:#99CCFF] | H118: [指标][代码:A80540011800009;币种:1560001;属性:01;日期:;频度:;机构:;扩展1:;扩展2:;期数:1;可编辑:2;颜色:#99CCFF]
A119: =A118+1 -> 115 | B119: 3.1全国联行系统往账 | C119: [指标][代码:A80540011900004;币种:1560001;属性:01;日期:;频度:;机构:;扩展1:;扩展2:;期数:1;可编辑:1;颜色:] | D119: [指标][代码:A80540011900005;币种:1560001;属性:01;日期:;频度:;机构:;扩展1:;扩展2:;期数:1;可编辑:1;颜色:] | E119: [指标][代码:A80540011900006;币种:1560001;属性:01;日期:;频度:;机构:;扩展1:;扩展2:;期数:1;可编辑:1;颜色:] | F119: [指标][代码:A80540011900007;币种:1560001;属性:01;日期:;频度:;机构:;扩展1:;扩展2:;期数:1;可编辑:1;颜色:] | G119: [指标][代码:A80540011900008;币种:1560001;属性:01;日期:;频度:;机构:;扩展1:;扩展2:;期数:1;可编辑:1;颜色:] | H119: [指标][代码:A80540011900009;币种:1560001;属性:01;日期:;频度:;机构:;扩展1:;扩展2:;期数:1;可编辑:1;颜色:]
A120: =A119+1 -> 116 | B120: 3.2全国联行系统来账 | C120: [指标][代码:A80540012000004;币种:1560001;属性:01;日期:;频度:;机构:;扩展1:;扩展2:;期数:1;可编辑:1;颜色:] | D120: [指标][代码:A80540012000005;币种:1560001;属性:01;日期:;频度:;机构:;扩展1:;扩展2:;期数:1;可编辑:1;颜色:] | E120: [指标][代码:A80540012000006;币种:1560001;属性:01;日期:;频度:;机构:;扩展1:;扩展2:;期数:1;可编辑:1;颜色:] | F120: [指标][代码:A80540012000007;币种:1560001;属性:01;日期:;频度:;机构:;扩展1:;扩展2:;期数:1;可编辑:1;颜色:] | G120: [指标][代码:A80540012000008;币种:1560001;属性:01;日期:;频度:;机构:;扩展1:;扩展2:;期数:1;可编辑:1;颜色:] | H120: [指标][代码:A80540012000009;币种:1560001;属性:01;日期:;频度:;机构:;扩展1:;扩展2:;期数:1;可编辑:1;颜色:]
A121: =A120+1 -> 117 | B121: 3.3全国联行汇兑汇差 | C121: [指标][代码:A80540012100004;币种:1560001;属性:01;日期:;频度:;机构:;扩展1:;扩展2:;期数:1;可编辑:1;颜色:] | D121: [指标][代码:A80540012100005;币种:1560001;属性:01;日期:;频度:;机构:;扩展1:;扩展2:;期数:1;可编辑:1;颜色:] | E121: [指标][代码:A80540012100006;币种:1560001;属性:01;日期:;频度:;机构:;扩展1:;扩展2:;期数:1;可编辑:1;颜色:] | F121: [指标][代码:A80540012100007;币种:1560001;属性:01;日期:;频度:;机构:;扩展1:;扩展2:;期数:1;可编辑:1;颜色:] | G121: [指标][代码:A80540012100008;币种:1560001;属性:01;日期:;频度:;机构:;扩展1:;扩展2:;期数:1;可编辑:1;颜色:] | H121: [指标][代码:A80540012100009;币种:1560001;属性:01;日期:;频度:;机构:;扩展1:;扩展2:;期数:1;可编辑:1;颜色:]
A122: =A121+1 -> 118 | B122: 3.4上年全国联行系统往账 | C122: [指标][代码:A80540012200004;币种:1560001;属性:01;日期:;频度:;机构:;扩展1:;扩展2:;期数:1;可编辑:1;颜色:] | D122: [指标][代码:A80540012200005;币种:1560001;属性:01;日期:;频度:;机构:;扩展1:;扩展2:;期数:1;可编辑:1;颜色:] | E122: [指标][代码:A80540012200006;币种:1560001;属性:01;日期:;频度:;机构:;扩展1:;扩展2:;期数:1;可编辑:1;颜色:] | F122: [指标][代码:A80540012200007;币种:1560001;属性:01;日期:;频度:;机构:;扩展1:;扩展2:;期数:1;可编辑:1;颜色:] | G122: [指标][代码:A80540012200008;币种:1560001;属性:01;日期:;频度:;机构:;扩展1:;扩展2:;期数:1;可编辑:1;颜色:] | H122: [指标][代码:A80540012200009;币种:1560001;属性:01;日期:;频度:;机构:;扩展1:;扩展2:;期数:1;可编辑:1;颜色:]
A123: =A122+1 -> 119 | B123: 3.5上年全国联行系统来账 | C123: [指标][代码:A80540012300004;币种:1560001;属性:01;日期:;频度:;机构:;扩展1:;扩展2:;期数:1;可编辑:1;颜色:] | D123: [指标][代码:A80540012300005;币种:1560001;属性:01;日期:;频度:;机构:;扩展1:;扩展2:;期数:1;可编辑:1;颜色:] | E123: [指标][代码:A80540012300006;币种:1560001;属性:01;日期:;频度:;机构:;扩展1:;扩展2:;期数:1;可编辑:1;颜色:] | F123: [指标][代码:A80540012300007;币种:1560001;属性:01;日期:;频度:;机构:;扩展1:;扩展2:;期数:1;可编辑:1;颜色:] | G123: [指标][代码:A80540012300008;币种:1560001;属性:01;日期:;频度:;机构:;扩展1:;扩展2:;期数:1;可编辑:1;颜色:] | H123: [指标][代码:A80540012300009;币种:1560001;属性:01;日期:;频度:;机构:;扩展1:;扩展2:;期数:1;可编辑:1;颜色:]
A124: =A123+1 -> 120 | B124: 3.6上年全国联行汇兑汇差 | C124: [指标][代码:A80540012400004;币种:1560001;属性:01;日期:;频度:;机构:;扩展1:;扩展2:;期数:1;可编辑:1;颜色:] | D124: [指标][代码:A80540012400005;币种:1560001;属性:01;日期:;频度:;机构:;扩展1:;扩展2:;期数:1;可编辑:1;颜色:] | E124: [指标][代码:A80540012400006;币种:1560001;属性:01;日期:;频度:;机构:;扩展1:;扩展2:;期数:1;可编辑:1;颜色:] | F124: [指标][代码:A80540012400007;币种:1560001;属性:01;日期:;频度:;机构:;扩展1:;扩展2:;期数:1;可编辑:1;颜色:] | G124: [指标][代码:A80540012400008;币种:1560001;属性:01;日期:;频度:;机构:;扩展1:;扩展2:;期数:1;可编辑:1;颜色:] | H124: [指标][代码:A80540012400009;币种:1560001;属性:01;日期:;频度:;机构:;扩展1:;扩展2:;期数:1;可编辑:1;颜色:]
A125: =A124+1 -> 121 | B125: 3.7省辖联行系统往账 | C125: [指标][代码:A80540012500004;币种:1560001;属性:01;日期:;频度:;机构:;扩展1:;扩展2:;期数:1;可编辑:1;颜色:] | D125: [指标][代码:A80540012500005;币种:1560001;属性:01;日期:;频度:;机构:;扩展1:;扩展2:;期数:1;可编辑:1;颜色:] | E125: [指标][代码:A80540012500006;币种:1560001;属性:01;日期:;频度:;机构:;扩展1:;扩展2:;期数:1;可编辑:1;颜色:] | F125: [指标][代码:A80540012500007;币种:1560001;属性:01;日期:;频度:;机构:;扩展1:;扩展2:;期数:1;可编辑:1;颜色:] | G125: [指标][代码:A80540012500008;币种:1560001;属性:01;日期:;频度:;机构:;扩展1:;扩展2:;期数:1;可编辑:1;颜色:] | H125: [指标][代码:A80540012500009;币种:1560001;属性:01;日期:;频度:;机构:;扩展1:;扩展2:;期数:1;可编辑:1;颜色:]
A126: =A125+1 -> 122 | B126: 3.8省辖联行系统来账 | C126: [指标][代码:A80540012600004;币种:1560001;属性:01;日期:;频度:;机构:;扩展1:;扩展2:;期数:1;可编辑:1;颜色:] | D126: [指标][代码:A80540012600005;币种:1560001;属性:01;日期:;频度:;机构:;扩展1:;扩展2:;期数:1;可编辑:1;颜色:] | E126: [指标][代码:A80540012600006;币种:1560001;属性:01;日期:;频度:;机构:;扩展1:;扩展2:;期数:1;可编辑:1;颜色:] | F126: [指标][代码:A80540012600007;币种:1560001;属性:01;日期:;频度:;机构:;扩展1:;扩展2:;期数:1;可编辑:1;颜色:] | G126: [指标][代码:A80540012600008;币种:1560001;属性:01;日期:;频度:;机构:;扩展1:;扩展2:;期数:1;可编辑:1;颜色:] | H126: [指标][代码:A80540012600009;币种:1560001;属性:01;日期:;频度:;机构:;扩展1:;扩展2:;期数:1;可编辑:1;颜色:]
A127: =A126+1 -> 123 | B127: 3.9省辖联行汇兑汇差 | C127: [指标][代码:A80540012700004;币种:1560001;属性:01;日期:;频度:;机构:;扩展1:;扩展2:;期数:1;可编辑:1;颜色:] | D127: [指标][代码:A80540012700005;币种:1560001;属性:01;日期:;频度:;机构:;扩展1:;扩展2:;期数:1;可编辑:1;颜色:] | E127: [指标][代码:A80540012700006;币种:1560001;属性:01;日期:;频度:;机构:;扩展1:;扩展2:;期数:1;可编辑:1;颜色:] | F127: [指标][代码:A80540012700007;币种:1560001;属性:01;日期:;频度:;机构:;扩展1:;扩展2:;期数:1;可编辑:1;颜色:] | G127: [指标][代码:A80540012700008;币种:1560001;属性:01;日期:;频度:;机构:;扩展1:;扩展2:;期数:1;可编辑:1;颜色:] | H127: [指标][代码:A80540012700009;币种:1560001;属性:01;日期:;频度:;机构:;扩展1:;扩展2:;期数:1;可编辑:1;颜色:]
A128: =A127+1 -> 124 | B128: 3.10上年省辖联行系统往账 | C128: [指标][代码:A80540012800004;币种:1560001;属性:01;日期:;频度:;机构:;扩展1:;扩展2:;期数:1;可编辑:1;颜色:] | D128: [指标][代码:A80540012800005;币种:1560001;属性:01;日期:;频度:;机构:;扩展1:;扩展2:;期数:1;可编辑:1;颜色:] | E128: [指标][代码:A80540012800006;币种:1560001;属性:01;日期:;频度:;机构:;扩展1:;扩展2:;期数:1;可编辑:1;颜色:] | F128: [指标][代码:A80540012800007;币种:1560001;属性:01;日期:;频度:;机构:;扩展1:;扩展2:;期数:1;可编辑:1;颜色:] | G128: [指标][代码:A80540012800008;币种:1560001;属性:01;日期:;频度:;机构:;扩展1:;扩展2:;期数:1;可编辑:1;颜色:] | H128: [指标][代码:A80540012800009;币种:1560001;属性:01;日期:;频度:;机构:;扩展1:;扩展2:;期数:1;可编辑:1;颜色:]
A129: =A128+1 -> 125 | B129: 3.11上年省辖联行系统来账 | C129: [指标][代码:A80540012900004;币种:1560001;属性:01;日期:;频度:;机构:;扩展1:;扩展2:;期数:1;可编辑:1;颜色:] | D129: [指标][代码:A80540012900005;币种:1560001;属性:01;日期:;频度:;机构:;扩展1:;扩展2:;期数:1;可编辑:1;颜色:] | E129: [指标][代码:A80540012900006;币种:1560001;属性:01;日期:;频度:;机构:;扩展1:;扩展2:;期数:1;可编辑:1;颜色:] | F129: [指标][代码:A80540012900007;币种:1560001;属性:01;日期:;频度:;机构:;扩展1:;扩展2:;期数:1;可编辑:1;颜色:] | G129: [指标][代码:A80540012900008;币种:1560001;属性:01;日期:;频度:;机构:;扩展1:;扩展2:;期数:1;可编辑:1;颜色:] | H129: [指标][代码:A80540012900009;币种:1560001;属性:01;日期:;频度:;机构:;扩展1:;扩展2:;期数:1;可编辑:1;颜色:]
A130: =A129+1 -> 126 | B130: 3.12上年省辖联行汇兑汇差 | C130: [指标][代码:A80540013000004;币种:1560001;属性:01;日期:;频度:;机构:;扩展1:;扩展2:;期数:1;可编辑:1;颜色:] | D130: [指标][代码:A80540013000005;币种:1560001;属性:01;日期:;频度:;机构:;扩展1:;扩展2:;期数:1;可编辑:1;颜色:] | E130: [指标][代码:A80540013000006;币种:1560001;属性:01;日期:;频度:;机构:;扩展1:;扩展2:;期数:1;可编辑:1;颜色:] | F130: [指标][代码:A80540013000007;币种:1560001;属性:01;日期:;频度:;机构:;扩展1:;扩展2:;期数:1;可编辑:1;颜色:] | G130: [指标][代码:A80540013000008;币种:1560001;属性:01;日期:;频度:;机构:;扩展1:;扩展2:;期数:1;可编辑:1;颜色:] | H130: [指标][代码:A80540013000009;币种:1560001;属性:01;日期:;频度:;机构:;扩展1:;扩展2:;期数:1;可编辑:1;颜色:]
A131: =A130+1 -> 127 | B131: 3.13农信银系统往账 | C131: [指标][代码:A80540013100004;币种:1560001;属性:01;日期:;频度:;机构:;扩展1:;扩展2:;期数:1;可编辑:1;颜色:] | D131: [指标][代码:A80540013100005;币种:1560001;属性:01;日期:;频度:;机构:;扩展1:;扩展2:;期数:1;可编辑:1;颜色:] | E131: [指标][代码:A80540013100006;币种:1560001;属性:01;日期:;频度:;机构:;扩展1:;扩展2:;期数:1;可编辑:1;颜色:] | F131: [指标][代码:A80540013100007;币种:1560001;属性:01;日期:;频度:;机构:;扩展1:;扩展2:;期数:1;可编辑:1;颜色:] | G131: [指标][代码:A80540013100008;币种:1560001;属性:01;日期:;频度:;机构:;扩展1:;扩展2:;期数:1;可编辑:1;颜色:] | H131: [指标][代码:A80540013100009;币种:1560001;属性:01;日期:;频度:;机构:;扩展1:;扩展2:;期数:1;可编辑:1;颜色:]
A132: =A131+1 -> 128 | B132: 3.14农信银系统来账 | C132: [指标][代码:A80540013200004;币种:1560001;属性:01;日期:;频度:;机构:;扩展1:;扩展2:;期数:1;可编辑:1;颜色:] | D132: [指标][代码:A80540013200005;币种:1560001;属性:01;日期:;频度:;机构:;扩展1:;扩展2:;期数:1;可编辑:1;颜色:] | E132: [指标][代码:A80540013200006;币种:1560001;属性:01;日期:;频度:;机构:;扩展1:;扩展2:;期数:1;可编辑:1;颜色:] | F132: [指标][代码:A80540013200007;币种:1560001;属性:01;日期:;频度:;机构:;扩展1:;扩展2:;期数:1;可编辑:1;颜色:] | G132: [指标][代码:A80540013200008;币种:1560001;属性:01;日期:;频度:;机构:;扩展1:;扩展2:;期数:1;可编辑:1;颜色:] | H132: [指标][代码:A80540013200009;币种:1560001;属性:01;日期:;频度:;机构:;扩展1:;扩展2:;期数:1;可编辑:1;颜色:]
A133: =A132+1 -> 129 | B133: 3.15农信银系统汇兑汇差 | C133: [指标][代码:A80540013300004;币种:1560001;属性:01;日期:;频度:;机构:;扩展1:;扩展2:;期数:1;可编辑:1;颜色:] | D133: [指标][代码:A80540013300005;币种:1560001;属性:01;日期:;频度:;机构:;扩展1:;扩展2:;期数:1;可编辑:1;颜色:] | E133: [指标][代码:A80540013300006;币种:1560001;属性:01;日期:;频度:;机构:;扩展1:;扩展2:;期数:1;可编辑:1;颜色:] | F133: [指标][代码:A80540013300007;币种:1560001;属性:01;日期:;频度:;机构:;扩展1:;扩展2:;期数:1;可编辑:1;颜色:] | G133: [指标][代码:A80540013300008;币种:1560001;属性:01;日期:;频度:;机构:;扩展1:;扩展2:;期数:1;可编辑:1;颜色:] | H133: [指标][代码:A80540013300009;币种:1560001;属性:01;日期:;频度:;机构:;扩展1:;扩展2:;期数:1;可编辑:1;颜色:]
A134: =A133+1 -> 130 | B134: 3.16上年农信银系统往账 | C134: [指标][代码:A80540013400004;币种:1560001;属性:01;日期:;频度:;机构:;扩展1:;扩展2:;期数:1;可编辑:1;颜色:] | D134: [指标][代码:A80540013400005;币种:1560001;属性:01;日期:;频度:;机构:;扩展1:;扩展2:;期数:1;可编辑:1;颜色:] | E134: [指标][代码:A80540013400006;币种:1560001;属性:01;日期:;频度:;机构:;扩展1:;扩展2:;期数:1;可编辑:1;颜色:] | F134: [指标][代码:A80540013400007;币种:1560001;属性:01;日期:;频度:;机构:;扩展1:;扩展2:;期数:1;可编辑:1;颜色:] | G134: [指标][代码:A80540013400008;币种:1560001;属性:01;日期:;频度:;机构:;扩展1:;扩展2:;期数:1;可编辑:1;颜色:] | H134: [指标][代码:A80540013400009;币种:1560001;属性:01;日期:;频度:;机构:;扩展1:;扩展2:;期数:1;可编辑:1;颜色:]
A135: =A134+1 -> 131 | B135: 3.17上年农信银系统来账 | C135: [指标][代码:A80540013500004;币种:1560001;属性:01;日期:;频度:;机构:;扩展1:;扩展2:;期数:1;可编辑:1;颜色:] | D135: [指标][代码:A80540013500005;币种:1560001;属性:01;日期:;频度:;机构:;扩展1:;扩展2:;期数:1;可编辑:1;颜色:] | E135: [指标][代码:A80540013500006;币种:1560001;属性:01;日期:;频度:;机构:;扩展1:;扩展2:;期数:1;可编辑:1;颜色:] | F135: [指标][代码:A80540013500007;币种:1560001;属性:01;日期:;频度:;机构:;扩展1:;扩展2:;期数:1;可编辑:1;颜色:] | G135: [指标][代码:A80540013500008;币种:1560001;属性:01;日期:;频度:;机构:;扩展1:;扩展2:;期数:1;可编辑:1;颜色:] | H135: [指标][代码:A80540013500009;币种:1560001;属性:01;日期:;频度:;机构:;扩展1:;扩展2:;期数:1;可编辑:1;颜色:]
A136: =A135+1 -> 132 | B136: 3.18上年农信银系统汇兑汇差 | C136: [指标][代码:A80540013600004;币种:1560001;属性:01;日期:;频度:;机构:;扩展1:;扩展2:;期数:1;可编辑:1;颜色:] | D136: [指标][代码:A80540013600005;币种:1560001;属性:01;日期:;频度:;机构:;扩展1:;扩展2:;期数:1;可编辑:1;颜色:] | E136: [指标][代码:A80540013600006;币种:1560001;属性:01;日期:;频度:;机构:;扩展1:;扩展2:;期数:1;可编辑:1;颜色:] | F136: [指标][代码:A80540013600007;币种:1560001;属性:01;日期:;频度:;机构:;扩展1:;扩展2:;期数:1;可编辑:1;颜色:] | G136: [指标][代码:A80540013600008;币种:1560001;属性:01;日期:;频度:;机构:;扩展1:;扩展2:;期数:1;可编辑:1;颜色:] | H136: [指标][代码:A80540013600009;币种:1560001;属性:01;日期:;频度:;机构:;扩展1:;扩展2:;期数:1;可编辑:1;颜色:]
A137: =A136+1 -> 133 | B137: 3.19清算资金往来 | C137: [指标][代码:A80540013700004;币种:1560001;属性:01;日期:;频度:;机构:;扩展1:;扩展2:;期数:1;可编辑:1;颜色:] | D137: [指标][代码:A80540013700005;币种:1560001;属性:01;日期:;频度:;机构:;扩展1:;扩展2:;期数:1;可编辑:1;颜色:] | E137: [指标][代码:A80540013700006;币种:1560001;属性:01;日期:;频度:;机构:;扩展1:;扩展2:;期数:1;可编辑:1;颜色:] | F137: [指标][代码:A80540013700007;币种:1560001;属性:01;日期:;频度:;机构:;扩展1:;扩展2:;期数:1;可编辑:1;颜色:] | G137: [指标][代码:A80540013700008;币种:1560001;属性:01;日期:;频度:;机构:;扩展1:;扩展2:;期数:1;可编辑:1;颜色:] | H137: [指标][代码:A80540013700009;币种:1560001;属性:01;日期:;频度:;机构:;扩展1:;扩展2:;期数:1;可编辑:1;颜色:]
A138: =A137+1 -> 134 | B138: 3.20社（行）内部往来 | C138: [指标][代码:A80540013800004;币种:1560001;属性:01;日期:;频度:;机构:;扩展1:;扩展2:;期数:1;可编辑:1;颜色:] | D138: [指标][代码:A80540013800005;币种:1560001;属性:01;日期:;频度:;机构:;扩展1:;扩展2:;期数:1;可编辑:1;颜色:] | E138: [指标][代码:A80540013800006;币种:1560001;属性:01;日期:;频度:;机构:;扩展1:;扩展2:;期数:1;可编辑:1;颜色:] | F138: [指标][代码:A80540013800007;币种:1560001;属性:01;日期:;频度:;机构:;扩展1:;扩展2:;期数:1;可编辑:1;颜色:] | G138: [指标][代码:A80540013800008;币种:1560001;属性:01;日期:;频度:;机构:;扩展1:;扩展2:;期数:1;可编辑:1;颜色:] | H138: [指标][代码:A80540013800009;币种:1560001;属性:01;日期:;频度:;机构:;扩展1:;扩展2:;期数:1;可编辑:1;颜色:]
A139: =A138+1 -> 135 | B139: 3.21外汇营运资金 | C139: [指标][代码:A80540013900004;币种:1560001;属性:01;日期:;频度:;机构:;扩展1:;扩展2:;期数:1;可编辑:1;颜色:] | D139: [指标][代码:A80540013900005;币种:1560001;属性:01;日期:;频度:;机构:;扩展1:;扩展2:;期数:1;可编辑:1;颜色:] | E139: [指标][代码:A80540013900006;币种:1560001;属性:01;日期:;频度:;机构:;扩展1:;扩展2:;期数:1;可编辑:1;颜色:] | F139: [指标][代码:A80540013900007;币种:1560001;属性:01;日期:;频度:;机构:;扩展1:;扩展2:;期数:1;可编辑:1;颜色:] | G139: [指标][代码:A80540013900008;币种:1560001;属性:01;日期:;频度:;机构:;扩展1:;扩展2:;期数:1;可编辑:1;颜色:] | H139: [指标][代码:A80540013900009;币种:1560001;属性:01;日期:;频度:;机构:;扩展1:;扩展2:;期数:1;可编辑:1;颜色:]
A140: =A139+1 -> 136 | B140: 3.22衍生工具 | C140: [指标][代码:A80540014000004;币种:1560001;属性:01;日期:;频度:;机构:;扩展1:;扩展2:;期数:1;可编辑:1;颜色:] | D140: [指标][代码:A80540014000005;币种:1560001;属性:01;日期:;频度:;机构:;扩展1:;扩展2:;期数:1;可编辑:1;颜色:] | E140: [指标][代码:A80540014000006;币种:1560001;属性:01;日期:;频度:;机构:;扩展1:;扩展2:;期数:1;可编辑:1;颜色:] | F140: [指标][代码:A80540014000007;币种:1560001;属性:01;日期:;频度:;机构:;扩展1:;扩展2:;期数:1;可编辑:1;颜色:] | G140: [指标][代码:A80540014000008;币种:1560001;属性:01;日期:;频度:;机构:;扩展1:;扩展2:;期数:1;可编辑:1;颜色:] | H140: [指标][代码:A80540014000009;币种:1560001;属性:01;日期:;频度:;机构:;扩展1:;扩展2:;期数:1;可编辑:1;颜色:]
A141: =A140+1 -> 137 | B141: 3.23套期工具 | C141: [指标][代码:A80540014100004;币种:1560001;属性:01;日期:;频度:;机构:;扩展1:;扩展2:;期数:1;可编辑:1;颜色:] | D141: [指标][代码:A80540014100005;币种:1560001;属性:01;日期:;频度:;机构:;扩展1:;扩展2:;期数:1;可编辑:1;颜色:] | E141: [指标][代码:A80540014100006;币种:1560001;属性:01;日期:;频度:;机构:;扩展1:;扩展2:;期数:1;可编辑:1;颜色:] | F141: [指标][代码:A80540014100007;币种:1560001;属性:01;日期:;频度:;机构:;扩展1:;扩展2:;期数:1;可编辑:1;颜色:] | G141: [指标][代码:A80540014100008;币种:1560001;属性:01;日期:;频度:;机构:;扩展1:;扩展2:;期数:1;可编辑:1;颜色:] | H141: [指标][代码:A80540014100009;币种:1560001;属性:01;日期:;频度:;机构:;扩展1:;扩展2:;期数:1;可编辑:1;颜色:]
A142: =A141+1 -> 138 | B142: 3.24被套期项目 | C142: [指标][代码:A80540014200004;币种:1560001;属性:01;日期:;频度:;机构:;扩展1:;扩展2:;期数:1;可编辑:1;颜色:] | D142: [指标][代码:A80540014200005;币种:1560001;属性:01;日期:;频度:;机构:;扩展1:;扩展2:;期数:1;可编辑:1;颜色:] | E142: [指标][代码:A80540014200006;币种:1560001;属性:01;日期:;频度:;机构:;扩展1:;扩展2:;期数:1;可编辑:1;颜色:] | F142: [指标][代码:A80540014200007;币种:1560001;属性:01;日期:;频度:;机构:;扩展1:;扩展2:;期数:1;可编辑:1;颜色:] | G142: [指标][代码:A80540014200008;币种:1560001;属性:01;日期:;频度:;机构:;扩展1:;扩展2:;期数:1;可编辑:1;颜色:] | H142: [指标][代码:A80540014200009;币种:1560001;属性:01;日期:;频度:;机构:;扩展1:;扩展2:;期数:1;可编辑:1;颜色:]
A143: =A142+1 -> 139 | B143: 3.25外汇买卖 | C143: [指标][代码:A80540014300004;币种:1560001;属性:01;日期:;频度:;机构:;扩展1:;扩展2:;期数:1;可编辑:1;颜色:] | D143: [指标][代码:A80540014300005;币种:1560001;属性:01;日期:;频度:;机构:;扩展1:;扩展2:;期数:1;可编辑:1;颜色:] | E143: [指标][代码:A80540014300006;币种:1560001;属性:01;日期:;频度:;机构:;扩展1:;扩展2:;期数:1;可编辑:1;颜色:] | F143: [指标][代码:A80540014300007;币种:1560001;属性:01;日期:;频度:;机构:;扩展1:;扩展2:;期数:1;可编辑:1;颜色:] | G143: [指标][代码:A80540014300008;币种:1560001;属性:01;日期:;频度:;机构:;扩展1:;扩展2:;期数:1;可编辑:1;颜色:] | H143: [指标][代码:A80540014300009;币种:1560001;属性:01;日期:;频度:;机构:;扩展1:;扩展2:;期数:1;可编辑:1;颜色:]
A144: =A143+1 -> 140 | B144: 4.所有者权益 | C144: [指标][代码:A80540014400004;币种:1560001;属性:01;日期:;频度:;机构:;扩展1:;扩展2:;期数:1;可编辑:2;颜色:#99CCFF] | D144: [指标][代码:A80540014400005;币种:1560001;属性:01;日期:;频度:;机构:;扩展1:;扩展2:;期数:1;可编辑:2;颜色:#99CCFF] | E144: [指标][代码:A80540014400006;币种:1560001;属性:01;日期:;频度:;机构:;扩展1:;扩展2:;期数:1;可编辑:2;颜色:#99CCFF] | F144: [指标][代码:A80540014400007;币种:1560001;属性:01;日期:;频度:;机构:;扩展1:;扩展2:;期数:1;可编辑:2;颜色:#99CCFF] | G144: [指标][代码:A80540014400008;币种:1560001;属性:01;日期:;频度:;机构:;扩展1:;扩展2:;期数:1;可编辑:2;颜色:#99CCFF] | H144: [指标][代码:A80540014400009;币种:1560001;属性:01;日期:;频度:;机构:;扩展1:;扩展2:;期数:1;可编辑:2;颜色:#99CCFF]
A145: =A144+1 -> 141 | B145: 4.1实收资本（股本） | C145: [指标][代码:A80540014500004;币种:1560001;属性:01;日期:;频度:;机构:;扩展1:;扩展2:;期数:1;可编辑:1;颜色:] | D145: [指标][代码:A80540014500005;币种:1560001;属性:01;日期:;频度:;机构:;扩展1:;扩展2:;期数:1;可编辑:1;颜色:] | E145: [指标][代码:A80540014500006;币种:1560001;属性:01;日期:;频度:;机构:;扩展1:;扩展2:;期数:1;可编辑:1;颜色:] | F145: [指标][代码:A80540014500007;币种:1560001;属性:01;日期:;频度:;机构:;扩展1:;扩展2:;期数:1;可编辑:1;颜色:] | G145: [指标][代码:A80540014500008;币种:1560001;属性:01;日期:;频度:;机构:;扩展1:;扩展2:;期数:1;可编辑:1;颜色:] | H145: [指标][代码:A80540014500009;币种:1560001;属性:01;日期:;频度:;机构:;扩展1:;扩展2:;期数:1;可编辑:2;颜色:#99CCFF]
A146: =A145+1 -> 142 | B146: 4.2 资本公积 | C146: [指标][代码:A80540014600004;币种:1560001;属性:01;日期:;频度:;机构:;扩展1:;扩展2:;期数:1;可编辑:1;颜色:] | D146: [指标][代码:A80540014600005;币种:1560001;属性:01;日期:;频度:;机构:;扩展1:;扩展2:;期数:1;可编辑:1;颜色:] | E146: [指标][代码:A80540014600006;币种:1560001;属性:01;日期:;频度:;机构:;扩展1:;扩展2:;期数:1;可编辑:1;颜色:] | F146: [指标][代码:A80540014600007;币种:1560001;属性:01;日期:;频度:;机构:;扩展1:;扩展2:;期数:1;可编辑:1;颜色:] | G146: [指标][代码:A80540014600008;币种:1560001;属性:01;日期:;频度:;机构:;扩展1:;扩展2:;期数:1;可编辑:1;颜色:] | H146: [指标][代码:A80540014600009;币种:1560001;属性:01;日期:;频度:;机构:;扩展1:;扩展2:;期数:1;可编辑:2;颜色:#99CCFF]
A147: =A146+1 -> 143 | B147: 4.3盈余公积 | C147: [指标][代码:A80540014700004;币种:1560001;属性:01;日期:;频度:;机构:;扩展1:;扩展2:;期数:1;可编辑:1;颜色:] | D147: [指标][代码:A80540014700005;币种:1560001;属性:01;日期:;频度:;机构:;扩展1:;扩展2:;期数:1;可编辑:1;颜色:] | E147: [指标][代码:A80540014700006;币种:1560001;属性:01;日期:;频度:;机构:;扩展1:;扩展2:;期数:1;可编辑:1;颜色:] | F147: [指标][代码:A80540014700007;币种:1560001;属性:01;日期:;频度:;机构:;扩展1:;扩展2:;期数:1;可编辑:1;颜色:] | G147: [指标][代码:A80540014700008;币种:1560001;属性:01;日期:;频度:;机构:;扩展1:;扩展2:;期数:1;可编辑:1;颜色:] | H147: [指标][代码:A80540014700009;币种:1560001;属性:01;日期:;频度:;机构:;扩展1:;扩展2:;期数:1;可编辑:2;颜色:#99CCFF]
A148: =A147+1 -> 144 | B148: 4.4一般准备 | C148: [指标][代码:A80540014800004;币种:1560001;属性:01;日期:;频度:;机构:;扩展1:;扩展2:;期数:1;可编辑:1;颜色:] | D148: [指标][代码:A80540014800005;币种:1560001;属性:01;日期:;频度:;机构:;扩展1:;扩展2:;期数:1;可编辑:1;颜色:] | E148: [指标][代码:A80540014800006;币种:1560001;属性:01;日期:;频度:;机构:;扩展1:;扩展2:;期数:1;可编辑:1;颜色:] | F148: [指标][代码:A80540014800007;币种:1560001;属性:01;日期:;频度:;机构:;扩展1:;扩展2:;期数:1;可编辑:1;颜色:] | G148: [指标][代码:A80540014800008;币种:1560001;属性:01;日期:;频度:;机构:;扩展1:;扩展2:;期数:1;可编辑:1;颜色:] | H148: [指标][代码:A80540014800009;币种:1560001;属性:01;日期:;频度:;机构:;扩展1:;扩展2:;期数:1;可编辑:2;颜色:#99CCFF]
A149: =A148+1 -> 145 | B149: 4.5本年利润 | C149: [指标][代码:A80540014900004;币种:1560001;属性:01;日期:;频度:;机构:;扩展1:;扩展2:;期数:1;可编辑:1;颜色:] | D149: [指标][代码:A80540014900005;币种:1560001;属性:01;日期:;频度:;机构:;扩展1:;扩展2:;期数:1;可编辑:1;颜色:] | E149: [指标][代码:A80540014900006;币种:1560001;属性:01;日期:;频度:;机构:;扩展1:;扩展2:;期数:1;可编辑:1;颜色:] | F149: [指标][代码:A80540014900007;币种:1560001;属性:01;日期:;频度:;机构:;扩展1:;扩展2:;期数:1;可编辑:1;颜色:] | G149: [指标][代码:A80540014900008;币种:1560001;属性:01;日期:;频度:;机构:;扩展1:;扩展2:;期数:1;可编辑:2;颜色:#99CCFF] | H149: [指标][代码:A80540014900009;币种:1560001;属性:01;日期:;频度:;机构:;扩展1:;扩展2:;期数:1;可编辑:2;颜色:#99CCFF]
A150: 146 | B150: 4.6利润分配 | C150: [指标][代码:A80540015000004;币种:1560001;属性:01;日期:;频度:;机构:;扩展1:;扩展2:;期数:1;可编辑:1;颜色:] | D150: [指标][代码:A80540015000005;币种:1560001;属性:01;日期:;频度:;机构:;扩展1:;扩展2:;期数:1;可编辑:1;颜色:] | E150: [指标][代码:A80540015000006;币种:1560001;属性:01;日期:;频度:;机构:;扩展1:;扩展2:;期数:1;可编辑:1;颜色:] | F150: [指标][代码:A80540015000007;币种:1560001;属性:01;日期:;频度:;机构:;扩展1:;扩展2:;期数:1;可编辑:1;颜色:] | G150: [指标][代码:A80540015000008;币种:1560001;属性:01;日期:;频度:;机构:;扩展1:;扩展2:;期数:1;可编辑:2;颜色:#99CCFF] | H150: [指标][代码:A80540015000009;币种:1560001;属性:01;日期:;频度:;机构:;扩展1:;扩展2:;期数:1;可编辑:2;颜色:#99CCFF]
A151: 147 | B151: 4.7库存股 | C151: [指标][代码:A80540015100004;币种:1560001;属性:01;日期:;频度:;机构:;扩展1:;扩展2:;期数:1;可编辑:1;颜色:] | D151: [指标][代码:A80540015100005;币种:1560001;属性:01;日期:;频度:;机构:;扩展1:;扩展2:;期数:1;可编辑:1;颜色:] | E151: [指标][代码:A80540015100006;币种:1560001;属性:01;日期:;频度:;机构:;扩展1:;扩展2:;期数:1;可编辑:1;颜色:] | F151: [指标][代码:A80540015100007;币种:1560001;属性:01;日期:;频度:;机构:;扩展1:;扩展2:;期数:1;可编辑:1;颜色:] | G151: [指标][代码:A80540015100008;币种:1560001;属性:01;日期:;频度:;机构:;扩展1:;扩展2:;期数:1;可编辑:1;颜色:] | H151: [指标][代码:A80540015100009;币种:1560001;属性:01;日期:;频度:;机构:;扩展1:;扩展2:;期数:1;可编辑:2;颜色:#99CCFF]
A152: 148 | B152: 5.损益 | C152: [指标][代码:A80540015200004;币种:1560001;属性:01;日期:;频度:;机构:;扩展1:;扩展2:;期数:1;可编辑:2;颜色:#99CCFF] | D152: [指标][代码:A80540015200005;币种:1560001;属性:01;日期:;频度:;机构:;扩展1:;扩展2:;期数:1;可编辑:2;颜色:#99CCFF] | E152: [指标][代码:A80540015200006;币种:1560001;属性:01;日期:;频度:;机构:;扩展1:;扩展2:;期数:1;可编辑:2;颜色:#99CCFF] | F152: [指标][代码:A80540015200007;币种:1560001;属性:01;日期:;频度:;机构:;扩展1:;扩展2:;期数:1;可编辑:2;颜色:#99CCFF] | G152: [指标][代码:A80540015200008;币种:1560001;属性:01;日期:;频度:;机构:;扩展1:;扩展2:;期数:1;可编辑:2;颜色:#99CCFF] | H152: [指标][代码:A80540015200009;币种:1560001;属性:01;日期:;频度:;机构:;扩展1:;扩展2:;期数:1;可编辑:2;颜色:#99CCFF]
A153: 149 | B153: 5.1利息收入 | C153: [指标][代码:A80540015300004;币种:1560001;属性:01;日期:;频度:;机构:;扩展1:;扩展2:;期数:1;可编辑:1;颜色:] | D153: [指标][代码:A80540015300005;币种:1560001;属性:01;日期:;频度:;机构:;扩展1:;扩展2:;期数:1;可编辑:1;颜色:] | E153: [指标][代码:A80540015300006;币种:1560001;属性:01;日期:;频度:;机构:;扩展1:;扩展2:;期数:1;可编辑:1;颜色:] | F153: [指标][代码:A80540015300007;币种:1560001;属性:01;日期:;频度:;机构:;扩展1:;扩展2:;期数:1;可编辑:1;颜色:] | G153: [指标][代码:A80540015300008;币种:1560001;属性:01;日期:;频度:;机构:;扩展1:;扩展2:;期数:1;可编辑:1;颜色:] | H153: [指标][代码:A80540015300009;币种:1560001;属性:01;日期:;频度:;机构:;扩展1:;扩展2:;期数:1;可编辑:2;颜色:#99CCFF]
A154: 150 | B154: 5.2金融机构往来收入 | C154: [指标][代码:A80540015400004;币种:1560001;属性:01;日期:;频度:;机构:;扩展1:;扩展2:;期数:1;可编辑:1;颜色:] | D154: [指标][代码:A80540015400005;币种:1560001;属性:01;日期:;频度:;机构:;扩展1:;扩展2:;期数:1;可编辑:1;颜色:] | E154: [指标][代码:A80540015400006;币种:1560001;属性:01;日期:;频度:;机构:;扩展1:;扩展2:;期数:1;可编辑:1;颜色:] | F154: [指标][代码:A80540015400007;币种:1560001;属性:01;日期:;频度:;机构:;扩展1:;扩展2:;期数:1;可编辑:1;颜色:] | G154: [指标][代码:A80540015400008;币种:1560001;属性:01;日期:;频度:;机构:;扩展1:;扩展2:;期数:1;可编辑:1;颜色:] | H154: [指标][代码:A80540015400009;币种:1560001;属性:01;日期:;频度:;机构:;扩展1:;扩展2:;期数:1;可编辑:2;颜色:#99CCFF]
A155: =A154+1 -> 151 | B155: 5.3手续费及佣金收入 | C155: [指标][代码:A80540015500004;币种:1560001;属性:01;日期:;频度:;机构:;扩展1:;扩展2:;期数:1;可编辑:1;颜色:] | D155: [指标][代码:A80540015500005;币种:1560001;属性:01;日期:;频度:;机构:;扩展1:;扩展2:;期数:1;可编辑:1;颜色:] | E155: [指标][代码:A80540015500006;币种:1560001;属性:01;日期:;频度:;机构:;扩展1:;扩展2:;期数:1;可编辑:1;颜色:] | F155: [指标][代码:A80540015500007;币种:1560001;属性:01;日期:;频度:;机构:;扩展1:;扩展2:;期数:1;可编辑:1;颜色:] | G155: [指标][代码:A80540015500008;币种:1560001;属性:01;日期:;频度:;机构:;扩展1:;扩展2:;期数:1;可编辑:1;颜色:] | H155: [指标][代码:A80540015500009;币种:1560001;属性:01;日期:;频度:;机构:;扩展1:;扩展2:;期数:1;可编辑:2;颜色:#99CCFF]
A156: =A155+1 -> 152 | B156: 5.4其他业务收入 | C156: [指标][代码:A80540015600004;币种:1560001;属性:01;日期:;频度:;机构:;扩展1:;扩展2:;期数:1;可编辑:1;颜色:] | D156: [指标][代码:A80540015600005;币种:1560001;属性:01;日期:;频度:;机构:;扩展1:;扩展2:;期数:1;可编辑:1;颜色:] | E156: [指标][代码:A80540015600006;币种:1560001;属性:01;日期:;频度:;机构:;扩展1:;扩展2:;期数:1;可编辑:1;颜色:] | F156: [指标][代码:A80540015600007;币种:1560001;属性:01;日期:;频度:;机构:;扩展1:;扩展2:;期数:1;可编辑:1;颜色:] | G156: [指标][代码:A80540015600008;币种:1560001;属性:01;日期:;频度:;机构:;扩展1:;扩展2:;期数:1;可编辑:1;颜色:] | H156: [指标][代码:A80540015600009;币种:1560001;属性:01;日期:;频度:;机构:;扩展1:;扩展2:;期数:1;可编辑:2;颜色:#99CCFF]
A157: =A156+1 -> 153 | B157: 5.5汇兑损益 | C157: [指标][代码:A80540015700004;币种:1560001;属性:01;日期:;频度:;机构:;扩展1:;扩展2:;期数:1;可编辑:1;颜色:] | D157: [指标][代码:A80540015700005;币种:1560001;属性:01;日期:;频度:;机构:;扩展1:;扩展2:;期数:1;可编辑:1;颜色:] | E157: [指标][代码:A80540015700006;币种:1560001;属性:01;日期:;频度:;机构:;扩展1:;扩展2:;期数:1;可编辑:1;颜色:] | F157: [指标][代码:A80540015700007;币种:1560001;属性:01;日期:;频度:;机构:;扩展1:;扩展2:;期数:1;可编辑:1;颜色:] | G157: [指标][代码:A80540015700008;币种:1560001;属性:01;日期:;频度:;机构:;扩展1:;扩展2:;期数:1;可编辑:1;颜色:] | H157: [指标][代码:A80540015700009;币种:1560001;属性:01;日期:;频度:;机构:;扩展1:;扩展2:;期数:1;可编辑:1;颜色:]
A158: =A157+1 -> 154 | B158: 5.6公允价值变动损益 | C158: [指标][代码:A80540015800004;币种:1560001;属性:01;日期:;频度:;机构:;扩展1:;扩展2:;期数:1;可编辑:1;颜色:] | D158: [指标][代码:A80540015800005;币种:1560001;属性:01;日期:;频度:;机构:;扩展1:;扩展2:;期数:1;可编辑:1;颜色:] | E158: [指标][代码:A80540015800006;币种:1560001;属性:01;日期:;频度:;机构:;扩展1:;扩展2:;期数:1;可编辑:1;颜色:] | F158: [指标][代码:A80540015800007;币种:1560001;属性:01;日期:;频度:;机构:;扩展1:;扩展2:;期数:1;可编辑:1;颜色:] | G158: [指标][代码:A80540015800008;币种:1560001;属性:01;日期:;频度:;机构:;扩展1:;扩展2:;期数:1;可编辑:1;颜色:] | H158: [指标][代码:A80540015800009;币种:1560001;属性:01;日期:;频度:;机构:;扩展1:;扩展2:;期数:1;可编辑:2;颜色:#99CCFF]
A159: =A158+1 -> 155 | B159: 5.7投资收益 | C159: [指标][代码:A80540015900004;币种:1560001;属性:01;日期:;频度:;机构:;扩展1:;扩展2:;期数:1;可编辑:1;颜色:] | D159: [指标][代码:A80540015900005;币种:1560001;属性:01;日期:;频度:;机构:;扩展1:;扩展2:;期数:1;可编辑:1;颜色:] | E159: [指标][代码:A80540015900006;币种:1560001;属性:01;日期:;频度:;机构:;扩展1:;扩展2:;期数:1;可编辑:1;颜色:] | F159: [指标][代码:A80540015900007;币种:1560001;属性:01;日期:;频度:;机构:;扩展1:;扩展2:;期数:1;可编辑:1;颜色:] | G159: [指标][代码:A80540015900008;币种:1560001;属性:01;日期:;频度:;机构:;扩展1:;扩展2:;期数:1;可编辑:1;颜色:] | H159: [指标][代码:A80540015900009;币种:1560001;属性:01;日期:;频度:;机构:;扩展1:;扩展2:;期数:1;可编辑:2;颜色:#99CCFF]
A160: =A159+1 -> 156 | B160: 5.8营业外收入 | C160: [指标][代码:A80540016000004;币种:1560001;属性:01;日期:;频度:;机构:;扩展1:;扩展2:;期数:1;可编辑:1;颜色:] | D160: [指标][代码:A80540016000005;币种:1560001;属性:01;日期:;频度:;机构:;扩展1:;扩展2:;期数:1;可编辑:1;颜色:] | E160: [指标][代码:A80540016000006;币种:1560001;属性:01;日期:;频度:;机构:;扩展1:;扩展2:;期数:1;可编辑:1;颜色:] | F160: [指标][代码:A80540016000007;币种:1560001;属性:01;日期:;频度:;机构:;扩展1:;扩展2:;期数:1;可编辑:1;颜色:] | G160: [指标][代码:A80540016000008;币种:1560001;属性:01;日期:;频度:;机构:;扩展1:;扩展2:;期数:1;可编辑:1;颜色:] | H160: [指标][代码:A80540016000009;币种:1560001;属性:01;日期:;频度:;机构:;扩展1:;扩展2:;期数:1;可编辑:2;颜色:#99CCFF]
A161: =A160+1 -> 157 | B161: 5.9利息支出 | C161: [指标][代码:A80540016100004;币种:1560001;属性:01;日期:;频度:;机构:;扩展1:;扩展2:;期数:1;可编辑:1;颜色:] | D161: [指标][代码:A80540016100005;币种:1560001;属性:01;日期:;频度:;机构:;扩展1:;扩展2:;期数:1;可编辑:1;颜色:] | E161: [指标][代码:A80540016100006;币种:1560001;属性:01;日期:;频度:;机构:;扩展1:;扩展2:;期数:1;可编辑:1;颜色:] | F161: [指标][代码:A80540016100007;币种:1560001;属性:01;日期:;频度:;机构:;扩展1:;扩展2:;期数:1;可编辑:1;颜色:] | G161: [指标][代码:A80540016100008;币种:1560001;属性:01;日期:;频度:;机构:;扩展1:;扩展2:;期数:1;可编辑:2;颜色:#99CCFF] | H161: [指标][代码:A80540016100009;币种:1560001;属性:01;日期:;频度:;机构:;扩展1:;扩展2:;期数:1;可编辑:1;颜色:]
A162: =A161+1 -> 158 | B162: 5.10金融机构往来支出 | C162: [指标][代码:A80540016200004;币种:1560001;属性:01;日期:;频度:;机构:;扩展1:;扩展2:;期数:1;可编辑:1;颜色:] | D162: [指标][代码:A80540016200005;币种:1560001;属性:01;日期:;频度:;机构:;扩展1:;扩展2:;期数:1;可编辑:1;颜色:] | E162: [指标][代码:A80540016200006;币种:1560001;属性:01;日期:;频度:;机构:;扩展1:;扩展2:;期数:1;可编辑:1;颜色:] | F162: [指标][代码:A80540016200007;币种:1560001;属性:01;日期:;频度:;机构:;扩展1:;扩展2:;期数:1;可编辑:1;颜色:] | G162: [指标][代码:A80540016200008;币种:1560001;属性:01;日期:;频度:;机构:;扩展1:;扩展2:;期数:1;可编辑:2;颜色:#99CCFF] | H162: [指标][代码:A80540016200009;币种:1560001;属性:01;日期:;频度:;机构:;扩展1:;扩展2:;期数:1;可编辑:1;颜色:]
A163: =A162+1 -> 159 | B163: 5.11手续费及佣金支出 | C163: [指标][代码:A80540016300004;币种:1560001;属性:01;日期:;频度:;机构:;扩展1:;扩展2:;期数:1;可编辑:1;颜色:] | D163: [指标][代码:A80540016300005;币种:1560001;属性:01;日期:;频度:;机构:;扩展1:;扩展2:;期数:1;可编辑:1;颜色:] | E163: [指标][代码:A80540016300006;币种:1560001;属性:01;日期:;频度:;机构:;扩展1:;扩展2:;期数:1;可编辑:1;颜色:] | F163: [指标][代码:A80540016300007;币种:1560001;属性:01;日期:;频度:;机构:;扩展1:;扩展2:;期数:1;可编辑:1;颜色:] | G163: [指标][代码:A80540016300008;币种:1560001;属性:01;日期:;频度:;机构:;扩展1:;扩展2:;期数:1;可编辑:2;颜色:#99CCFF] | H163: [指标][代码:A80540016300009;币种:1560001;属性:01;日期:;频度:;机构:;扩展1:;扩展2:;期数:1;可编辑:1;颜色:]
A164: =A163+1 -> 160 | B164: 5.12业务及管理费 | C164: [指标][代码:A80540016400004;币种:1560001;属性:01;日期:;频度:;机构:;扩展1:;扩展2:;期数:1;可编辑:1;颜色:] | D164: [指标][代码:A80540016400005;币种:1560001;属性:01;日期:;频度:;机构:;扩展1:;扩展2:;期数:1;可编辑:1;颜色:] | E164: [指标][代码:A80540016400006;币种:1560001;属性:01;日期:;频度:;机构:;扩展1:;扩展2:;期数:1;可编辑:1;颜色:] | F164: [指标][代码:A80540016400007;币种:1560001;属性:01;日期:;频度:;机构:;扩展1:;扩展2:;期数:1;可编辑:1;颜色:] | G164: [指标][代码:A80540016400008;币种:1560001;属性:01;日期:;频度:;机构:;扩展1:;扩展2:;期数:1;可编辑:2;颜色:#99CCFF] | H164: [指标][代码:A80540016400009;币种:1560001;属性:01;日期:;频度:;机构:;扩展1:;扩展2:;期数:1;可编辑:1;颜色:]
A165: =A164+1 -> 161 | B165: 5.13其他业务支出 | C165: [指标][代码:A80540016500004;币种:1560001;属性:01;日期:;频度:;机构:;扩展1:;扩展2:;期数:1;可编辑:1;颜色:] | D165: [指标][代码:A80540016500005;币种:1560001;属性:01;日期:;频度:;机构:;扩展1:;扩展2:;期数:1;可编辑:1;颜色:] | E165: [指标][代码:A80540016500006;币种:1560001;属性:01;日期:;频度:;机构:;扩展1:;扩展2:;期数:1;可编辑:1;颜色:] | F165: [指标][代码:A80540016500007;币种:1560001;属性:01;日期:;频度:;机构:;扩展1:;扩展2:;期数:1;可编辑:1;颜色:] | G165: [指标][代码:A80540016500008;币种:1560001;属性:01;日期:;频度:;机构:;扩展1:;扩展2:;期数:1;可编辑:2;颜色:#99CCFF] | H165: [指标][代码:A80540016500009;币种:1560001;属性:01;日期:;频度:;机构:;扩展1:;扩展2:;期数:1;可编辑:1;颜色:]
A166: =A165+1 -> 162 | B166: 5.14营业税金及附加 | C166: [指标][代码:A80540016600004;币种:1560001;属性:01;日期:;频度:;机构:;扩展1:;扩展2:;期数:1;可编辑:1;颜色:] | D166: [指标][代码:A80540016600005;币种:1560001;属性:01;日期:;频度:;机构:;扩展1:;扩展2:;期数:1;可编辑:1;颜色:] | E166: [指标][代码:A80540016600006;币种:1560001;属性:01;日期:;频度:;机构:;扩展1:;扩展2:;期数:1;可编辑:1;颜色:] | F166: [指标][代码:A80540016600007;币种:1560001;属性:01;日期:;频度:;机构:;扩展1:;扩展2:;期数:1;可编辑:1;颜色:] | G166: [指标][代码:A80540016600008;币种:1560001;属性:01;日期:;频度:;机构:;扩展1:;扩展2:;期数:1;可编辑:2;颜色:#99CCFF] | H166: [指标][代码:A80540016600009;币种:1560001;属性:01;日期:;频度:;机构:;扩展1:;扩展2:;期数:1;可编辑:1;颜色:]
A167: =A166+1 -> 163 | B167: 5.15资产减值损失 | C167: [指标][代码:A80540016700004;币种:1560001;属性:01;日期:;频度:;机构:;扩展1:;扩展2:;期数:1;可编辑:1;颜色:] | D167: [指标][代码:A80540016700005;币种:1560001;属性:01;日期:;频度:;机构:;扩展1:;扩展2:;期数:1;可编辑:1;颜色:] | E167: [指标][代码:A80540016700006;币种:1560001;属性:01;日期:;频度:;机构:;扩展1:;扩展2:;期数:1;可编辑:1;颜色:] | F167: [指标][代码:A80540016700007;币种:1560001;属性:01;日期:;频度:;机构:;扩展1:;扩展2:;期数:1;可编辑:1;颜色:] | G167: [指标][代码:A80540016700008;币种:1560001;属性:01;日期:;频度:;机构:;扩展1:;扩展2:;期数:1;可编辑:2;颜色:#99CCFF] | H167: [指标][代码:A80540016700009;币种:1560001;属性:01;日期:;频度:;机构:;扩展1:;扩展2:;期数:1;可编辑:1;颜色:]
A168: =A167+1 -> 164 | B168: 5.16营业外支出 | C168: [指标][代码:A80540016800004;币种:1560001;属性:01;日期:;频度:;机构:;扩展1:;扩展2:;期数:1;可编辑:1;颜色:] | D168: [指标][代码:A80540016800005;币种:1560001;属性:01;日期:;频度:;机构:;扩展1:;扩展2:;期数:1;可编辑:1;颜色:] | E168: [指标][代码:A80540016800006;币种:1560001;属性:01;日期:;频度:;机构:;扩展1:;扩展2:;期数:1;可编辑:1;颜色:] | F168: [指标][代码:A80540016800007;币种:1560001;属性:01;日期:;频度:;机构:;扩展1:;扩展2:;期数:1;可编辑:1;颜色:] | G168: [指标][代码:A80540016800008;币种:1560001;属性:01;日期:;频度:;机构:;扩展1:;扩展2:;期数:1;可编辑:2;颜色:#99CCFF] | H168: [指标][代码:A80540016800009;币种:1560001;属性:01;日期:;频度:;机构:;扩展1:;扩展2:;期数:1;可编辑:1;颜色:]
A169: =A168+1 -> 165 | B169: 5.17所得税费用 | C169: [指标][代码:A80540016900004;币种:1560001;属性:01;日期:;频度:;机构:;扩展1:;扩展2:;期数:1;可编辑:1;颜色:] | D169: [指标][代码:A80540016900005;币种:1560001;属性:01;日期:;频度:;机构:;扩展1:;扩展2:;期数:1;可编辑:1;颜色:] | E169: [指标][代码:A80540016900006;币种:1560001;属性:01;日期:;频度:;机构:;扩展1:;扩展2:;期数:1;可编辑:1;颜色:] | F169: [指标][代码:A80540016900007;币种:1560001;属性:01;日期:;频度:;机构:;扩展1:;扩展2:;期数:1;可编辑:1;颜色:] | G169: [指标][代码:A80540016900008;币种:1560001;属性:01;日期:;频度:;机构:;扩展1:;扩展2:;期数:1;可编辑:2;颜色:#99CCFF] | H169: [指标][代码:A80540016900009;币种:1560001;属性:01;日期:;频度:;机构:;扩展1:;扩展2:;期数:1;可编辑:1;颜色:]
A170: =A169+1 -> 166 | B170: 5.18以前年度损益调整 | C170: [指标][代码:A80540017000004;币种:1560001;属性:01;日期:;频度:;机构:;扩展1:;扩展2:;期数:1;可编辑:1;颜色:] | D170: [指标][代码:A80540017000005;币种:1560001;属性:01;日期:;频度:;机构:;扩展1:;扩展2:;期数:1;可编辑:1;颜色:] | E170: [指标][代码:A80540017000006;币种:1560001;属性:01;日期:;频度:;机构:;扩展1:;扩展2:;期数:1;可编辑:1;颜色:] | F170: [指标][代码:A80540017000007;币种:1560001;属性:01;日期:;频度:;机构:;扩展1:;扩展2:;期数:1;可编辑:1;颜色:] | G170: [指标][代码:A80540017000008;币种:1560001;属性:01;日期:;频度:;机构:;扩展1:;扩展2:;期数:1;可编辑:2;颜色:#99CCFF] | H170: [指标][代码:A80540017000009;币种:1560001;属性:01;日期:;频度:;机构:;扩展1:;扩展2:;期数:1;可编辑:2;颜色:#99CCFF]
A171: =A170+1 -> 167 | B171: 6.合 计 | C171: [指标][代码:A80540017100004;币种:1560001;属性:01;日期:;频度:;机构:;扩展1:;扩展2:;期数:1;可编辑:2;颜色:#99CCFF] | D171: [指标][代码:A80540017100005;币种:1560001;属性:01;日期:;频度:;机构:;扩展1:;扩展2:;期数:1;可编辑:2;颜色:#99CCFF] | E171: [指标][代码:A80540017100006;币种:1560001;属性:01;日期:;频度:;机构:;扩展1:;扩展2:;期数:1;可编辑:2;颜色:#99CCFF] | F171: [指标][代码:A80540017100007;币种:1560001;属性:01;日期:;频度:;机构:;扩展1:;扩展2:;期数:1;可编辑:2;颜色:#99CCFF] | G171: [指标][代码:A80540017100008;币种:1560001;属性:01;日期:;频度:;机构:;扩展1:;扩展2:;期数:1;可编辑:2;颜色:#99CCFF] | H171: [指标][代码:A80540017100009;币种:1560001;属性:01;日期:;频度:;机构:;扩展1:;扩展2:;期数:1;可编辑:2;颜色:#99CCFF]
A172: 填表人：Transino_Reporter | C172: 复核人：Transino_Checker | G172: 负责人：Transino_Manager